,username,comment_created_utc,comment_score,comment_text
0,marcospb19,1627932200.0,391.0,"In 2021, 87% of people who have used Rust in development work want to keep using it for 2022.

Top 3 of 2021:
- Rust: 87%
- Clojure: 81% (-6%)
- TypeScript: 72% (-15%)

Here's the result from previous year:

Top 3 of 2020:
- Rust: 86%
- TypeScript: 67% (-19%)
- Python 66% (-20%)

# Podium timeline

- 2021: 86.98% (First place!)
- 2020: 86.1% (First place!)
- 2019: 83.5% (First place!)
- 2018: 78.9% (First place!)
- 2017: 73.1% (First place!)
- 2016: 79.1% (First place!)
- 2015: 73.8% (Third place, losing to Swift and C++)

This is the perfect opportunity to acknowledge and thank the huge collective effort made for the amazing language and community, Rust is my favorite language by far, and I wish to keep using it for a long time.

Thank you ;)"
1,TehPers,1627932835.0,104.0,I want to know who the 54 responses from North Korea are from.
2,yerke1,1627937858.0,79.0,"Rust is now also 5th most wanted language by developers at 14.09% after Python 19.04%, Typescript 15.29%, JS 14.59%, Golang 14.54%."
3,link23,1627935351.0,22.0,"Does anyone know how long other languages' streaks at the top spot have been? I.e. is this an unprecedented popularity, or did C++ have this spot for 20 years, or...?"
4,Iron-E_Dev,1627956147.0,13.0,Hopefully more employers start hiring for it!
5,Timely_Novel_7914,1627977481.0,13.0,"Sampling bias IMO: people who would hate rust are weeded out at the start from not even being able to put two feet up the learning curve, but don't complain because they blame themselves."
6,FlumeLife,1627934051.0,36.0,"I really want to like this language but as someone who is not very experienced in programming in general, I find Rust extremely hard to write. Does it get easier?"
7,cryptospartan,1627934870.0,18.0,Anyone else surprised to see C++ so far down the list?
8,skyacer,1627934290.0,17.0,we only keep growing😎
9,timClicks,1627943789.0,15.0,"This a tremendous achievement for many levels for every Rust working group. Thank you for everyone's attention to ergonomics and error handling, as well as performance."
10,UltraPoci,1627938832.0,17.0,"Incredible! I'm also very happy for Julia being that high on the list, above Python."
11,ForShotgun,1627940191.0,10.0,"I don't know what clojure is and at this point, I'm too scared to ask.

I'll ask though, why is clojure so beloved, is it just that it's the good implementation of a lisp that people have been waiting for?"
12,kode1985,1627931762.0,19.0,hooray! I wanted it!
13,teryret,1627939235.0,9.0,"This is my ""not at all surprised"" face  :-)

Congrats (and a big thank you) to everyone involved in making this language a thing!"
14,eXoRainbow,1628003421.0,2.0,"Does someone else get annoyed by the listing of ""HTML/CSS"" compared to programming languages? Markup languages to write documents and stylesheets, such as HTML, CSS, XML, Markdown, LateX should be listed separately. You don't write program logic with it."
15,circular_rectangle,1628013025.0,2.0,The whole world should see and acknowledge Rust at this point. Some people like to create an illusion for themselves and don't like to believe that in at least a decade or so Rust will have replaced the clunky C/C++ to a considerable degree. Rust is rising and it won't stop rising. In Rust I believe and in Rust I trust.
16,ALBOND1,1628024929.0,2.0,I can not type any code without mut and &self
17,rabidferret,1627949361.0,7.0,"I think we need to stop celebrating this every time it happens. Yes, the fact that SO calls this metric ""loved"" is great for marketing, but I don't think this indicates anything other than survivorship bias. Folks are bouncing off the learning curve of our language, leading to the folks who actually push through the barrier being more likely to be the folks who enjoy using this language. It's fun to say we're the most ""loved"", but this indicates a serious problem with the language's onboarding that needs to be addressed -- not something that we should be celebrating"
18,,1627957701.0,4.0,ok. 7 is next
19,,1627953120.0,2.0,Incredible! Has any other programming language ever been as loved as Rust?
20,ImprobableOtter,1627983161.0,2.0,Never thought I'd enjoy being so bad at something :)
21,CrushedBatman,1627976042.0,1.0,"Genuine question: who participates in these surveys? I have never met or seen any developer who has ever participated, and I have worked with a lot of developers in the past six years."
22,cobance123,1627981443.0,1.0,What are the employment rates tho? Is it getting higher?
23,Aoxxt2,1628079684.0,0.0,Most loved but hardly ever used and no robust libraries even after all this time. Cute fad.
24,Petsoi,1628160592.0,1.0,Maybe they should convert the question at one point into a statement 😀
25,m-kru,1628065981.0,0.0,"Rust, the language almost everyone loves, and almost no one writes in."
26,gregwtmtno,1627938895.0,148.0,The most impressive part is that the percents keep going up (even as more are required to use the language as part of their work). Amazing job by the Rust team.
27,ShadowWolf_01,1627940075.0,40.0,"Kinda crazy to me that Clojure is so high up on the list! It’s definitely a nice language, just wouldn’t necessarily expect to see it up there.

And +1 to what you said about Rust! Great language and community."
28,Sapiogram,1627946447.0,27.0,"> 2015: 73.8% (Third place, losing to Swift and C++)

C++ was among the most loved languages?"
29,Zeta0114942,1627934379.0,56.0,Can't wait untill 100% :)
30,bowbahdoe,1627953579.0,3.0,"If anyone wants to learn clojure too, hit me up"
31,SusanthCom,1628530265.0,1.0,✅✅✅
32,ergzay,1627935213.0,102.0,"There's a tiny segment of North Korean population that has strictly controlled and monitored access to the internet for research purposes. Primarily educated elites in their two technology areas they invest in, nuclear and rocket technology. And also the schools that train those people.

Edit: Here's a nice article covering one of these schools: https://www.nytimes.com/2017/05/29/world/asia/north-korea-university-christian-evangelical.html

And a really interesting short documentary (you see them accessing google): https://vimeo.com/86820870"
33,BrokenAndDeadMoon,1627934926.0,19.0,"Dunno but im sure the 1000 responses from china are from \[REDACTED\], friends of \[REDACTED\] and people from \[REDACTED\]."
34,alixoa,1627937906.0,1.0,Occam's razor
35,ShadowWolf_01,1627939618.0,106.0,"What is it with people wanting to use Go? I’ve used it some and to me it just feels so verbose and overall just kind of meh. I get wanting simplicity but the lack of stuff like Rust’s higher-order functions like `.map()`, the annoying `if err != nil` repetition, weird package management (at least pre-Go packages), etc. just make it not very nice to use to me. And that’s not including the unsafe parts of it like `nil`.

This isn’t to say Go doesn’t have its upsides, or that it’s a horrible language or anything, I do like its trailing type w/out the colons (e.g. `x int`) syntax for example. But I can’t seem to see why people like it as much as they seem to? Although maybe the answer is just its simplicity . . ."
36,popasmuerf,1627944562.0,5.0,"I would bet 5 dollars that most of the these votes for Rust are coming from people who have not once actually written anything in it worth mentioning or have not written anything in it at all.   I have ran into more than a developers where the conversation turned to Rust...where they were hyper-enthusiastic about the language but upon further discussion....I came to find out they know absolutely nothing about it except for that it is a decent C++ ""replacement""(What's a borrow checker ?) 

Rust I feel definitely has a future for domains that require a ""Safe C/C++"" but a lot of this ""Rust is EVERYONE'S FAVORITE"" is mostly due to hype and the need to be one of the cool kids."
37,marcospb19,1627937828.0,19.0,I only found public reports from StackOverflow with this category starting up from 2015.
38,Sharlinator,1627974364.0,11.0,That would be rather impressive given that Stack Overflow itself has only existed for twelve years or so.
39,Repulsive-Street-307,1627946472.0,0.0,"Before the internet became a popularity contest, people didn't care about counting this except in absolute terms of 'number of jobs' (which is not the same thing as we can see)."
40,vadixidav,1627938349.0,27.0,"Rust will always be harder to write a small snippet. However, the code you write will be easier to read, easier to refactor, less likely to need to be debugged, less likely to contain bugs, etc. A library author has tools at their disposal to prevent users from incorrectly using the library. This will feel like moving through molasses at first, but eventually you will become ""fearless"". It is very empowering to be able to know when and where you can lean on the compiler to check behind you, and knowing where the compiler wont help you, and then teaching the compiler to help you by encoding invariants in the type system as soon as you encounter them. As soon as you think of something that could go wrong, you can put it in an API that can't be misused, and then when you use that API you no longer need to worry about that thing. This can make writing large projects much faster, even though small ones might be slower.

For this reason, Rust is not a good scripting/REPL language, but it is great for systems programming, making library ecosystems, and applications. I think you will see languages come out that are better than Rust for applications one day. I think it is an accident that Rust is so good at applications as well, and I believe that one day Rust will probably be more associated with systems programming. Even today, you have Golang, but I personally think that it's type system isn't expressive enough, and it doesn't protect against several footgun situations. You will continue to see more experimentation in this space and in the REPL/scripting space, as I think Rust can get in the way for these applications, and it just happens to be good at them relative to other options. Python is great, but you already can see alternatives brewing like Julia. Keep an eye on these."
41,nboro94,1627934219.0,53.0,"Can I ask why you want to like the language so much? Generally speaking system level programming, one of rust's strong points, and one of the primary reasons for using the language is not an ideal starting point for someone who is not very experienced in programming.

Of course it gets easier over time like any other learnable skill but if you are new you may get more mileage out of languages like javascript or python which are much more widely adopted and considered easier to learn, unless of course you have a specific use case for rust then nevermind."
42,Direwolf202,1627935108.0,21.0,"I think it does - firstly in terms of getting used to what rustc is asking from you, but also in terms of just knowing how to structure things in a way that is compatible with rust as a language. 

I have to say, I think I had the easiest possible transition into rust, seeing as the two languages I was most experienced with before rust were C++ and Haskell (a weird combination I know) - I had experience with both the low-level side of things, and the functional programming side of things."
43,IceSentry,1627935184.0,21.0,"It definitely gets easier. I started using rust for hobby projects about a year and a half ago. At first it felt like a syntax soup with so much going on, but going through the book and seeing simpler examples made me understand how clean it actually is. Now I can never go back and I just want to use rust everywhere. Everytime I use something else and I hit some issues I think to myself that it would be so much easier with rust."
44,TheMistbornIdentity,1627934297.0,16.0,"I'm not very experienced myself, but I will say that I had 2-3 years of experience with Java/C# and Javascript, and I found it nigh impossible to write Rust programs at first. 

It's still a huge struggle, but now I find I'm a lot more comfortable with certain aspects of it, and some of its more unique patterns (e.g. the match keyword and knowing how/when to use the Options enum), to the point that I've managed to make a basic application that can connect to a MySQL database and actually query and insert some data."
45,WormRabbit,1627989564.0,2.0,"That strongly depends on the type of code that you're writing. Async is hard, but it will get better once more dev time is put into the feature. Callback-oriented programming in Rust is not pleasant, and likely never will. If you rely heavily on self-referencing, graph-like objects, then Rust will likely always lose to a good GC language. GUIs are also hard for that reason.

On the other hand, numeric processing is a breeze. Anything related to systems-level programming (both implementing and using the existing apis) is state of the art. CLI apps are in general very pleasant to write. Algorithmically complex problems are good to solve in Rust. They may be not as easy to get a first-order solution to as more dynamic or memory-managed languages, but you get very predictable and (relatively) easily tunable performance, strong correctness guarantees and a possibility for designing rock-solid APIs. On that point, Rust has a great ecosystem by design. It may be not as large as in other languages, but it's very easy to use, and the APIs are in general high-quality. It's no accident, Rust was built with the ecosystem in mind, and gives librart writers many tools for good APIs (Send/Sync markers, strong type system, macros, inline documentation etc)."
46,Botahamec,1627948689.0,3.0,"After a couple years of Rust, it feels very natural to me now"
47,insanitybit,1627943318.0,2.0,"Yes, it does get easier."
48,lorslara2000,1627935723.0,30.0,"Typically the most popular languages are far down on the list because, well, they are already being used so nobody loves them. Their limits are known and they are boring, productive languages."
49,thelights0123,1627935619.0,65.0,"For me, C++ went from a language I wanted to use for the rest of my life to a language I use only for work unhappily after learning Rust."
50,matthieum,1627984569.0,6.0,"No, not really.

I started work in 2007, and I've been mostly working in C++ since then. I was very excited for C++0x (as it was known back then), and I invested heavily in learning the language and following the development.

I was sorely disappointed, and I have been getting more and more disappointed.

I do appreciate that I can do pretty much whatever I want with C++, by which I mean that with a specific idea of what assembly should look like, I can generally write C++ to get there. That's empowering.

The problem? Everything else.

C++ is a mess, due in part to backward compatibility and in part (I feel) to the excruciating process to get any change in.

Already for C++0x it was clear that C++ backward compatibility were holding the language back. Even integer arithmetic is complicated in C++. But the problem is ignored, for the most. No effort has been made to allow transitioning C++ code, to allow getting rid of the terrible ideas of the past. And thus, 15 years later, the shackles remain.

And in parallel, the process to get any change in is excruciating. As a result, proponents of changes tend to propose narrow, special-purpose, changes, all slightly different from the next, instead of one big change. The exceptions are few and far between, and generally championed by the big names, and the big corporations, and even then... contracts were pulled out.

The result? A mess. It's quite visible that the language is organically grown. It's quite obvious why. The pragmatist in me understands... but the pragmatist in me also realizes it makes working with the language _so difficult_.

When I write C++ code, I don't do it to show off my C++ skills, to explore the dark corners of the C++ standard. I write code to solve real-world problems, and C++ is a mean to an end. So all those dark corners? All those exceptions? All those weird interactions between seemingly independent features? They're just getting in the way, and holding me back.

Writing code in C++ is an uphill battle. And I'm tired of battling the language more than the problem at hand."
51,censored_username,1627937930.0,19.0,"As an embedded C++ guy who's done a lot of mentoring with C++:

No. Not at all. The language is an unintuitive, inexpressive mess of illogical syntax reuse, has absolutely terrible error messages, an extremely outdated compilation model and is a minefield of implementation-specific workarounds."
52,QualitySoftwareGuy,1627935757.0,8.0,I'm surprised it's not lower.
53,oakinmypants,1627938915.0,5.0,Any language that doesn’t have a built in function to strip/trim a string isn’t a language worth using.  We are all forced to write that code.  That is how little they respect our time.
54,tamrior,1627999938.0,3.0,I'm sure that those great books people write about rust also help 🙂
55,Mouschi_,1627981054.0,2.0,Agree julia is underrated
56,Kneasle,1627944871.0,12.0,"I also wondered the same thing; I've barely heard of clojure, but what I have heard is that it's very good. From reading other comments (the best source of information, of course ;) ), it seems that clojure has a small but very dedicated community. 'Most loved' in stack overflow's survey is the _proportion_ of current developers who want to continue using the language, so you can see why Clojure does well."
57,met0xff,1627944568.0,2.0,Have been waiting for is relative - it's also been around since at least 2007 with a loyal community. But I think the language could really need stewardship more similar to Rust.
58,ranty_mc_rant_face,1628089737.0,2.0,"I'm a clojure fan, though I haven't used it heavily for a few years. It's a very different language from rust! But I'm a big believer in the right language for the right task, and the languages have quite different sweet spots.

Clojure is a pragmatic, practical, functional lisp. It runs on the JVM which makes it slower to start, but also easy to run on masses of platforms. It is elegant and powerful - a great language for functional programming.

However, it has a very steep learning curve - different to rust, the syntax is so strange that it puts off a lot of people before they even start. And it's quite pure FP so you can't fall back to familiar idioms, you need to think differently. 

So it's a hard sell in the business world - harder to hire for, harder to get people to maintain, big organisations often are quite resistant to it. And unlike rust, there is not a compelling ""only clojure solves this"" niche - so it's hard to get traction when a lower-initial-learning-curve language like Kotlin or Scala might be an easier sell.

All of which is why despite loving clojure, I don't use it much any more. I also love rust these days, and it feels much more likely that I'll get to use it at work some day!"
59,kode1985,1627931943.0,29.0,And that's 6 year in a row I missed the survey to vote for Rust. Why they no spam me when the voting started?!
60,thiez,1627978142.0,5.0,"> Folks are bouncing off the learning curve of our language, leading to the folks who actually push through the barrier being more likely to be the folks who enjoy using this language

If that were true, wouldn't languages such as Haskell, APL, C++, C, R, and Assembly be more popular?"
61,hgwxx7_,1627974447.0,5.0,"It can be both. 

Marketing this SO survey metric is great for getting people interested. 

And once they’re interested and try the language, they’re more likely to stick around thanks to work being put into friendly error messages, IDE experience and so on. No one is putting less effort into these things because the language is “loved”. You’re worried about something that isn’t happening."
62,moltonel,1628027078.0,2.0,"IMHO this survivor bias is real but it doesn't explain the whole measurement.  Annecdotically, I started loving Rust long before I had a working understanding of lifetimes and stopped fighting the borrow checker. There's a lot to like about Rust, don't explain it all away with survivor bias or early adopter enthusiasm."
63,Programmurr,1627983840.0,1.0,"You present a valid concern. Rust adoption isn't anywhere near the level that I hoped it would be by now. 

I'm really curious what kind of analysis you've done against crates.io to measure adoption trends.  What are you seeing?"
64,hgwxx7_,1627974496.0,7.0,"This survey question is only 7 years old, and Rust has won it 6 times. We don’t know what the results would have been in previous years."
65,Sharlinator,1627976424.0,2.0,Impossible to say because this survey has only  existed for about as many years as Rust has been >=1.0.
66,zerakun,1627977487.0,4.0,Hi! I'm one of the ~80k respondents
67,thiez,1627977903.0,3.0,I participated 🤷‍♀️
68,matthieum,1627984781.0,2.0,"It depends.

SO methodology has changed over the years. At the start, they'd just put a banner on SO and anyone could take the survey. In recent years, they've started sub-sampling, and polling outside of SO if I remember correctly.

There is still a strong self-selection bias, I expect. It's not clear that SO users are representative of the whole developer population for example."
69,Jaondtet,1628024291.0,1.0,"Not too many people, considering they have ""only"" 80k participants. I think the most insightful is that ~80% of the participants said they have a Stackoverflow account (sadly no USA vs overall breakdown on that one). And of those, ~30% said they actively participate multiple times a month or more. And about 80% have partipated in the past.

So, this is mostly active Stackoverflow users. That already massively restricts who answers this. I've never even really considered making an SO account, and I don't think anyone on my team has either. Maybe there's one or two people. The percentage of people that actively participate in any online forum is usually a tiny percentage of the total userbase.

I imagine the overlap with the (active) Reddit community is pretty large though."
70,marcospb19,1628106072.0,1.0,"Rust 1.0 was released 6 years ago, it is new and hard to learn, considering this, it's growth rate is pretty pretty decent."
71,marcospb19,1628106749.0,2.0,"Rust is new, here's the amount of people who voted in this category for each language https://www.reddit.com/r/rust/comments/owll2j/rust_is_the_most_loved_language_six_years_in_a/h7hcl3e?utm_source=share&utm_medium=web2x&context=3"
72,Sw429,1627945244.0,95.0,I'm looking forward to the day when my job requires me to use Rust.
73,timClicks,1627942206.0,64.0,"Remember that these are relative percentages, not absolutes. It reflects the proportion of current users who want to continue to use it."
74,marcospb19,1627951235.0,13.0,"Actually, it was ""C++11"". But... yeah."
75,LeberechtReinhold,1628001791.0,3.0,There was a lot of hype about modern C++ back then
76,shponglespore,1627977620.0,3.0,Seems odd to me since it's near the top of my personal list of most hated languages.
77,zepperoni-pepperoni,1627939063.0,58.0,TOTAL GLOBAL CARCINIZATION
78,jl2352,1627947586.0,36.0,"They also invest in malicious software. Given their targets such as key financial systems, they must be investing a lot into this. As it requires analysing software that is quite difficult to acquire.

They also do a lot of general software development. A lot of North Korean software engineers are trained in NK or China, and then work in China for various software companies. Doing any freelance work they can find online.

If you find a very hardworking Chinese software engineer online to help you with your projects. There is a slim chance they might be North Korean.

The BBC podcast the Lazarus Heist goes into a lot of this. I highly recommend it."
79,Agitates,1627936397.0,22.0,Imagine if Rust plays a role in NK nuclear program.
80,toomanypumpfakes,1627961228.0,24.0,"I think it’s extremely easy to be productive in Go and get new team members ramped up on the language super quickly. 

It’s so common server side now as well because the concurrency and memory model is extremely simple. You get one async runtime and your concurrency primitives are built into the language; everything is garbage collected so there’s no worrying about teaching Python devs about memory models. But it still has a type system and compiles to a static binary. 

If you have to go deeper than a simple REST/gRPC server that talks to a data store or optimize for the 99th percentile of latencies then it gets more complicated as you fight these layers of abstraction.

Edit: one other thing that I want to add is that the standard library is very comprehensive. I could write (and have written) a full HTTP web server using just the standard library and put it into production because that’s essentially what the language was created for. For its use case it works very well."
