,username,comment_created_utc,comment_score,comment_text
81,IshKebab,1627984537.0,15.0,"Go had a very unique combination of features at the time it was released:

* Fast compilation
* Compiles to static binary
* Easy cross-compilation
* Simple, easy to learn language
* Pretty great performance
* Very well designed and comprehensive standard library

For certain tasks, especially CLI and infrastructure type things it is a really good choice. Even today its obvious alternatives (Rust, Zig, maybe Typescript) fall down in some areas (e.g. compilation speed, simplicity, safety).

The only thing really holding it back is the lack of generics. They're finally doing that but I think if they had done it maybe 5 years ago Go would be way way more popular today.

The `if err != nil` verbosity is overblown IMO. Rust-style error handling would be better but it wouldn't really be significantly less verbose. Go just encourages proper error handling, which is always verbose.

I'd much rather that than ""eh just throw an exception and catch it in `main()`. Users understand stack traces right?""."
82,Inityx,1627940147.0,84.0,"I think the strive for language simplicity is really weird; the complexity has to go somewhere, and if the language doesn't encode it, the developers have to write it themselves."
83,HK-32,1627940836.0,44.0,"I've used pretty much everything from cpp to python but at the end I fell in love with Go. C++ is too big at this point, you don't know what to use and what not to use. Almost like every company has its own subset that they use and strictly stick to it. Rust is good, but I feel like its almost never productive to work in rust as an indie or a small team. Rust will become the language for corporate, effecient, ultra complex software in the future where big teams are working together. 

Go on the other hand just provides the perfect sweet spot where you have the performance of a compiled language and the productivity of a language like python. I feel like Go isn't really a language aimed at c++ or rust devs as it is at people coming from dynamic languages that want to continue to be productive and still get the advantages of performance."
84,CSI_Tech_Dept,1628005563.0,3.0,"IMO it's only because it was created by Google. After using it for some time I hate it and wanted to get back to Python. It is a mediocre language and coding in it feels like a chore.

The language is very simple, but I think it actually makes the code more complex. Not sure how to explain it."
85,Noughmad,1627947687.0,15.0,"From my use of Go, I never ever liked it, but I always felt that it would be the best language if you were paid by line if code. 

On a similar but more serious note, the same property of the language make your feel like you're making always making progress. You're always adding more code. In Rust, you could tweak some iterator/option/result combinator monstrosity for days and the resulting diff would still be just a couple of lines. In 
Go, you would instead add some more for loops, feel like you're progressing all the time, and end up with a substantial diff with lots of added lines. And that very irrationally feels good both for the reviewer and the author."
86,dudpixel,1627945446.0,7.0,"I agree with you. I've been using Go a bit lately and then decided to try something bigger. I went looking for a nice SQL lib and found some, but then discovered the horrible mess that is migration support. Most SQL packages didn't even have support for migrations, and the packages specifically for migrations seemed half baked and unpolished. I assume they worked but they involved cumbersome setup and with hardly any documentation.

The error handling seems so fragile and careless. It's super easy to create race conditions and nil pointer dereferences. I don't know why people say Go is good for concurrency. Yes it has green threads but it's super risky to use them safely. You have to put a lot more effort in to make sure they're safe, and even then it's a case of hoping for the best.

Yes the simplicity means you can write code faster, but the lack of safety means you can also write bugs faster. It's like a language that got half way to completion and stopped. So now you have to do the rest of the work to make your code safe.

Don't get me wrong. I think Go is ok and has some good points. I just wish it had a better type system, better error handling syntax, and better safety."
87,shponglespore,1627977709.0,3.0,You just need to get a keyboard with an `if err != nil { return err }` key.
88,Repulsive-Street-307,1627946656.0,1.0,"It's the normal curve. Unconfident - with cause or not - ~~programmers~~ people will feel more attracted to things they feel they can fully understand.

Of course, then they become 10 years veterans and get white hair from things they can't understand but aren't in the manual, like complex race conditions, finding that memory unsafety heisenbug, bizarre UB that depends on architecture, arcane and machine specific fiddling of the garbage collector etc.

This phenomenon can be weaponized to make 'simple' and incorrect popular (ie: antivax propaganda), but it's natural even without the propaganda."
89,cyber_pride,1627945009.0,24.0,"The StackOverflow question was specifically targeting languages that the user had extensively used over the past year. I really doubt most of these votes come from people who deliberately lied just to add to the hype. I could be wrong, just an educated guess."
90,Nilstrieb,1627978830.0,2.0,"I certainly do love rust, and it has so many nice features and it's full of good language design, which is a part of it that is often overlooked."
91,ButItMightJustWork,1627964092.0,15.0,"So, what you are saying is that Rust has *always* been the most loved language? /s"
92,asmx85,1627983960.0,3.0,"Nice joke! 12 years, sure. Software exists longer than 12 years. How do you think it was written without SO? First there was SO and after that someone invented Software from snippets found on SO!"
93,IceSentry,1627949928.0,16.0,"Rust isn't as terse as a scripting language, but of the compiled, typed, languages I know it's probably the one that's the easiest to write a short snippet."
94,u2m4c6,1627948697.0,7.0,"Swift’s type system is as expressive as Rust’s but is much easier to write. If they can get Linux better supported, I think it will be a very popular language."
95,dwalker109,1627934633.0,42.0,"As a counterpoint to this, coming to Rust without some of the baggage we inherit from garbage collected dynamically typed languages might actually make this a bit easier than it first seems. 

It’s still a hard language but maybe not in the same areas I found it hard. 

Lifetimes can be a nightmare though, I’ll concede that."
96,topologicalfractal,1627937628.0,8.0,"I'm coming from a long time spent coding in python, right now going through the rust book and find impl/methods/match/traits kinda weird, but I guess their usecase will become clearer as I start my own projects"
97,Gearwatcher,1627937366.0,10.0,"Rust offers a valuable proposition for applicative development - that of being very high level, while offering native performance for programs that need it.

There are very few languages that can provide higher levels of abstraction in the same language that targets system level. Go, much like C, is a great example of a language that cannot provide it. It might be small and simple as a language, but regardless of how many layers up the stack you are above system level, it never gets any better for you.

The price one pays in Rust, having to think about, and deal with ownership of data, is much smaller than the price one pays in, say, C++ which is dealing with probably the most complex language in the industry, with generational layers of new approaches to old problems and also deal with handling memory and data ownership."
98,Kirk_Kerman,1627962601.0,3.0,I've started learning Rust for personal stuff while working with PHP professionally. I really think it just makes me a better dev to write Rust - at least compared to PHP.
99,lukewchu,1627952887.0,17.0,">Everytime I use something else and I hit some issues I think to myself that it would be so much easier with rust.

Oh boy. The times I wanted Rust enums in other languages."
100,dexterlemmer,1630049690.0,1.0,"1. Callbacks: Rust is great at this, only different. I admit that I myself sometimes struggle for a while implementing an ergonomic API that accepts callbacks, then kick myself afterwards. Or rather not, I learn a new way of working and feel a great sense of accomplishment. ;-) 
2. Rust has tracing GCs in its library ecosystem and borrow checking and GCs work very nicely together. That said, if you have a borrow checker, there seems to be much better approaches to self-referential graph-like objects than GCs. The Rust community is still figuring things out, though. We're exploring new territory in a lot of ways. But yes, for now Rust can be hard and limiting here and may be always. Exiting (in some ways, frustrating in others) times.
3. GUIs are hard in Rust because GUIs are hard. There are various frameworks that show nothing of what you mentioned is important for GUIs. What is important is composition and the ability to vectorize the framework impl and what you mentioned hinders both the important parts. The only reason that the things you mentioned combined with inheritance is the way things are in GUIs, is because it won the first mover advantage half a century ago through worse is better and it takes a very massive org years to build a proper GUI framework up to todays standards. This means we are hard stuck in a very-suboptimal local minimum. However the Rust community has both the means and the motive to innovate and some of them now have the opportunity as well. I watch with facination as some of our GUI frameworks just magically solve some insanely hard problems then start to very rapidly work on a very long tail of details that **has** to be tackled before they can be considered mature or even really useful. One thing that will be interesting to see is whether these different solutions to different subproblems of GUIs could be composed in the long run, but few languages has as great tools for allowing that as Rust."
101,moltonel,1627942510.0,22.0,"One interesting-but-debatable way to slice this is to multiply ""respondents * using * loving"" to get an absolute number of happy users (starting with the 83k respondents to the ""using"" question). Gives something like:

1. Javascript:  33305
2. Python: 27274
3. Typescript: 18301
4. C#: 14388
5. Java: 13893
6. C++: 9977
7. Php: 7372
8. C: 6928
9. Rust: 5097
10. Go: 4994"
102,cryptospartan,1627935882.0,10.0,Wasn't this true for C++ around 2015 as well? It's crazy that C++ was in the top 3 in 2015 but is now very far down the list
103,Bobbbay,1627936223.0,31.0,"Right? I used to think that C/C++ were so cool. Look ma, I can manually mutate memory! After using Rust, I can't use any manually memory managed language again."
104,pjmlp,1627939527.0,6.0,"Since 2006 I only use it for native libraries, being a polyglot dev, I managed to mostly use something else.

Rust would not help much in cases similar to mine, because the languages are already managed and the native libraries or GPGPU shaders are anyway already in C++, no need to add an additional middle layer.

C++ is one of my favourite languages, but the micro-optimization culture inherited from C circles spoils the fun.

At least in Rust security trumps performance and language gimmicks around C compatibility."
105,marcospb19,1627937243.0,11.0,"Same, I forced myself to love C++, I was stuck in this toxic relationship."
106,Tyg13,1627945587.0,2.0,"My own relationship with C++ is mixed. It was my first love, and I still think there's a lot of really cool stuff you can do with it that's not fully-baked in languages like Rust (compile-time metaprogramming, really good debugging support).

At the same time, its legacy really holds it back. I want to like modules, and I really want to like the static analysis stuff coming down the pipeline to get modern features like lifetime checking, but I think those efforts will always be hamstrung by having to work with the old ways. C++ as a language just feels like it has too much baggage to really do things right."
107,sparky8251,1627939971.0,-4.0,"It literally has trim and has for a long time...

Source: https://doc.rust-lang.org/std/string/struct.String.html#method.trim

The docs say it has been there since 1.0.0... so, over 5 years now. https://doc.rust-lang.org/src/core/str/mod.rs.html#1733"
108,Satoru_094,1628085453.0,1.0,Laughs in random number generator 🤣
109,timClicks,1628011784.0,2.0,Thanks :)
110,Sharlinator,1627976153.0,2.0,"Honestly, at least in my neck of woods it’s much easier to find a Clojure job than a Rust job, in large part because, like other JVM languages, it’s more or less a drop-in replacement for Java, providing interop with the vast existing ecosystem (plus you can write your frontend in Clojure(Script) too, which is an attractive proposition). And honestly it’s a beautiful functional immutability-first language extremely well suited to the sort of data processing and manipulation that 99% of webapps tend to be about. However, the dynamic duck typing and persistent lack of good error reporting are sort of antithetical to the Rust philosophy."
111,ForShotgun,1627945392.0,2.0,"From a cursory googling it seems like it has access to everything java does but it's using lisp syntax? That does sound pretty awesome to me, but it's weird that that alone makes it so beloved. If that is the case... who wants to do the same thing with C++ or C? Please?"
112,ForShotgun,1627945198.0,1.0,"Oh, well I guess that's not it? From some casual browsing it seems like it's basically java with Lisp syntax? Uses the JVM and can consume java libraries"
113,Floppie7th,1627936127.0,14.0,"If you're anything like me, they did, but you didn't see it because of all the other spam"
114,TahsinTariq,1651571573.0,2.0,Time to vote?
115,TahsinTariq,1627977359.0,2.0,"!remindme 9 month

&#x200B;

There, I'll tell you to vote next time."
116,Jaondtet,1628023693.0,1.0,"I'm also not sure I buy the learning curve argument, but I don't see why your languages would fit the description.

Assembly is a neverending story of new architectures, massive instruction sets, and weird corner-cases. Also, very few people are really Assembly developers at all. When you interact with it, it's usually in a debugging manner. That's usually not too pleasant. 

C is mostly easy to learn, but is just really frustrating as you scale up. C++ is notorious for being impossible to learn completely, so you never really pass the learning curve. I think these ""low level"" languages are also used by older developers who are more likely to be specialized from a time where they had less choice.

No idea about APL, but I think it was just never well-liked to begin with.

Haskell maybe? But I think it's similar to C++, in that the language is massive and constantly changing. But I'm also a bit surprised about its position, considering how hightly users usually speak of the language."
117,,1628068128.0,1.0,[deleted]
118,gregwtmtno,1627945607.0,132.0,"Me too, but given that I’m a lawyer, I’m not holding my breath."
119,ShadowWolf_01,1627945521.0,12.0,"> It reflects the proportion of current users who want to continue to use it.

Oh, TIL, thanks for the info."
120,TinBryn,1627951969.0,16.0,So it was actually asking those that don't want to do the work to change to C++14.
121,Sapiogram,1628003152.0,1.0,"Good point, I guess the Rust train hadn't really got going yet."
122,Axmouth,1627992555.0,12.0,Carcinization or oxidization?
123,ergzay,1627936800.0,57.0,The NK nuclear and rocket program both probably rely heavily on open source software as they don't have enough people with knowhow to develop everything themselves.
124,,1628097701.0,1.0,"I doubt anybody even thinks about Rust, Zig and TypeScript as serious alternatives for infrastructure solutions given that Go dominates like C used to do in the Linux world. Though, I would take Zig, Rust, even Java anyday over Go for databases, filesystems, etc. since these do not require tight integration with other solutions in the ecosystem."
125,pjmlp,1628167397.0,1.0,Almost like FreePascal!
126,nultero,1627942473.0,36.0,"The big languages continuously ingesting new features are the foil to Go's simplicity. All the extra complexity makes it very easy to write really bad, really unreadable spaghetti. It's already too easy to churn out some pasta, Java / C++ just make it even easier.

Rust tries to enforce antispaghetti in other ways, but as somebody who ends up fighting the borrow checker, I usually end up with some anyway."
127,ShadowWolf_01,1627944730.0,30.0,"> Rust is good, but I feel like its almost never productive to work in rust as an indie or a small team. Rust will become the language for corporate, effecient, ultra complex software in the future where big teams are working together.

Interesting. I will agree with you that it isn't *as* productive, although it would be kind of surprising to me if it's ""almost never productive"" as you say. I feel like Rust would also have value for smaller projects, but having never worked with it in a professional setting, I don't have any experience as to whether that's the case or not.

> Go on the other hand just provides the perfect sweet spot where you have the performance of a compiled language and the productivity of a language like python.

For small scripts, I could see where it's just as productive. But one of my main problems with it is that you have to reinvent the wheel way more than you would in even Javascript, and that makes it less productive/more annoying in the long run, at least for me.

As a completely contrived example, say I wanted to write a quick little function that took some items with various fields, two of which being `name` and `amount`, and then added up all of the `amount`s for items with a `name` starting with the letter ""A"", and then returned that value. In Rust, that might be something like this:

    struct Item {
      // ...
      name: String,
      amount: i32,
    }

    fn add_items(items: &Vec<Item>) -> i32 {
      items
        .iter()
        .filter(|i| i.name.starts_with('A'))
        .fold(0, |acc, i| acc + i.amount)
    }

Super easy to read, and those sorts of `.iter()` expressions work for much more complex transformations.

But in Go, unless there's a better way of doing this I don't know about, you'd have to resort to a good ol' for loop:

    type Item struct {
        // ...
        name string
        amount int
    }

    func addItems(items []Item) int {
        sum := 0
        for i := 0; i < len(items); i++ {
            if items[i].name[0] == 'A' {
                sum += items[i].amount
            }
        }

        return sum
    }

Maybe you prefer the Go version, and that's fine! But personally I find the Rust version much nicer; plus, as I mentioned, if you have to do other transformations Rust gives you quite a few with the [iterator trait](https://doc.rust-lang.org/std/iter/trait.Iterator.html), whereas with Go, you just have to write more custom code in the for loop for the specific situation you're dealing with.

IIUC this is a result of Go not having generics; you simply can't write generic algorithms taking higher-order functions like those of Rust's iterators in Go, at least not afaik.

For some people, maybe this isn't a big deal; ""what's so wrong with writing for loops?"" But for me, it's so much nicer being able to use generic algorithms that do these sorts of things for me, and with an implementation that's likely better than whatever I could write myself.

And that's just the thing with Rust, iterators will almost always (or always? I don't know for sure) compile down to efficient code, so I'm not paying much if any perf. penalty for the above code.

And this isn't even to mention stuff like error handling in the two languages (personally I prefer `Result<T, E>`'s ways to handle/deal with errors, like `.unwrap()` and `.expect()`, over `if err != nil` handling), or null safety, or the borrow checker keeping you from shooting yourself in the foot (specifically with thread safety, but I haven't written any async or multithreaded apps with Go so I wouldn't know what the situation is like there/how safe it is to do?), Rust's wonderful type system, really helpful compiler, or a whole host of other things that make Rust nice to use.

I guess if you don't need or want those things, have a different usecase, etc., then Go might make sense for you. For example, I'd almost certainly choose Go over Rust for writing a Qt application (and Go is cleaner than C++ for sure, although I do like C++'s std algorithms). Ultimately, you should choose what to use based on your specific application's needs. But for me, I'd almost always prefer using Rust over Go where/when I can."
128,,1627946566.0,30.0,[deleted]
129,metaden,1627996185.0,4.0,"Go forces the complexity onto the developer. The amount of boilerplate you need to write for a simple k8s controller is astronomical, this is all due to the lack of good abstractions. Because of these reasons, I need to write, read, maintain and liable to lot of LoC. Everyone’s argument is “go is simple” but a go program is not simple. For inspiration, you can look at rich hickey’s talk on simple made easy, to understand the difference between the two."
130,pjmlp,1627976385.0,2.0,"Go will also get there, C17 + all major extensions common across FOSS and commercial compilers, is a very different language from K&R C, or Scheme 7 versus its original implementation."
131,beowolfey,1627985004.0,2.0,"Have you tried Julia? Your description of Go is what Julia feels like to me, was wondering how it compares."
132,sloganking,1627942397.0,9.0,"My perspective (as someone who had not yet taken the time to learn go but has looked it's way a few times) is that it aims to be better python. Of course a large appeal of python is that it's old so it has a library for almost anything. But the GO community will slowly build that over time.

What I don't understand about GO is why there are so many diehard (almost arrogant seeming) fans of it who act like it's the best thing in the world or even better than other languages. I see those people, then I go look at GO's main website https://golang.org/ and docs, and they frankly look like a crummy highschool science presentation compared to Rust's immaculate website and docs https://www.rust-lang.org/ . 

It just give some the impression that the people behind GO really haven't put a lot of love and time into it in comparison. 

I think GO has a place and I want to learn it in the future, but those have been my first impressions."
133,zerakun,1628014318.0,1.0,"Uh? As a reviewer, I like less code, especially if code has a lot of similar looking ""for""y constructs"
134,popasmuerf,1628539870.0,0.0,...and because people who take surveys ...especially in this context don't  make schitt up?   LOLz...OK.
135,popasmuerf,1628540108.0,0.0,"...and the ""lie"" isn't about hyping Rust as much as it is a product of self-delusion and the need to be in the ""in-crowd"".  If you have been active in the ""coder"" community for any significant amount of time...I am sure you have ran into more than a few people who will pretend to possess knowledge that upon cross-examination of any rigor reveals they are just another poser.   Think about it...how could it possibly be ""The most loved language"" if most in the software development community...especially within the niche it excels in...don't actually use it?"
136,TahsinTariq,1627977490.0,8.0,Always has been 🔫🔫🔫🔫
137,Sharlinator,1627985017.0,8.0,"No, I was being serious. There haven't been other streaks at the top spot because *the survey itself* has not existed long enough. Unless the GP asked about the counterfactual situation of what *would have been* the top language if someone had done the same survey, with the same target group, two decades ago, but that is of course unknowable."
138,u2m4c6,1627961831.0,7.0,Agreed. Functional programming concepts help a lot with that. A lot of information can be contained within the algebraic types and then add map and similar functions and you got a good stew going.
139,razrfalcon,1627967469.0,13.0,"Swift is nice, but it's basically Apple-only. There are not many libraries available (way less than for Rust) and most of them are depending on Foundation.

Not to mention that Swift is way less safe. Array indexing is not bound checked, which is bizarre for a modern language. And there is no safe alternative by default, you have to write your own safe wrapper."
140,vadixidav,1627948790.0,4.0,"I have heard good things about Swift. I definitely need to try it. Currently I develop on Linux though. I should be getting a Mac soon (when Apple Silicon macs come out with 32GB of RAM), and then I can give it a go."
141,OmnipotentEntity,1627938990.0,33.0,"Lifetimes are difficult in C++ and C as well. The difference is in those languages if you get them wrong it's an impossible to diagnose runtime error and possibly a security vulnerability, rather than a somewhat-cryptic-to-the-uninitiated compile time error."
