,username,comment_created_utc,comment_score,comment_text
142,Dhghomon,1627948826.0,4.0,">Lifetimes can be a nightmare though, I’ll concede that.

They just got a *little* bit better with 1.54:

https://github.com/rust-lang/rust/blob/master/RELEASES.md#version-1540-2021-07-29

>You can now use multiple generic lifetimes with impl Trait where the lifetimes don't explicitly outlive another. In code this means that you can now have **impl Trait<'a, 'b>** where as before you could only have **impl Trait<'a, 'b> where 'b: 'a**.

I guess that's something."
143,tamrior,1627999857.0,3.0,"Impl, methods, traits are the replacement object oriented programming with inheritance in Python.

Match is a more convenient replacement for if/elif chains. It also brings pattern matching. Regardless of you making the switch to rust, becoming familiar with match will be useful since it will also come to python in 3.10! With pattern matching and everything."
144,beowolfey,1627985299.0,1.0,Great suggestion and this list makes a ton of sense. Although I am a bit surprised at where PHP and C placed.
145,drjeats,1627980729.0,7.0,"I think people are tired of waiting for it to get transformatively better again. C++11-14 was that. C++20 brought modules and coroutines and concepts which are all kinda complicated and not widely used. We all want the metaclasses and Rust/Zig style error handling that Herb Sutter proposed.

And then there was the ABI drama.

Folks also seem generally unhappy with initializer_list because it further complicates initialization, and after all this time explaining how constexpr is not a way to mark something that must be executed at compile time and how this is all you really need, they finally added consteval. The big wins have been C++11 features and later refinements on them: lambdas, in-class member initializers, standard type traits, explicitly defaulted/deleted special members (but even these have usability issues).

And then there's build systems, which currently and probably will always suck in C++ land. (Yes, I know how to use the target_* cmake functions.)

Aside from building, the tools are better than they've ever been, but C++ just stopped being fun to write now that the novelty of C++11 has worn off. At work I actively avoid newer features I was once excited about slowly trying out and incorporating (concepts are a big one). No one wants to spend unnecessary brainergy outside of the problem domain when reading someone else's code. But it's still the workhorse. I'll probably be writing in C++ for at least another decade."
146,lorslara2000,1627936347.0,6.0,I don't know. If it was then I can imagine it could be explained by the modernization hype. Now it's all mainstream and boring again.
147,another_day_passes,1627942816.0,19.0,"Memory is manually managed in Rust, it’s just that the compiler does it for you. I think modern C++ and Rust share many ideals; the reason Rust is nice to write while C++ is less so is that Rust was able to start afresh while C++ had been stuck with the C baggage from the 70s."
148,thelights0123,1627944383.0,6.0,">	the micro-optimization culture inherited from C circles spoils the fun.

For me, it's the other way around: many optimizations don't happen in C++ because of how the language was designed. There's no equivalent to Rust's `Rc` in C++'s std—only `Arc`, because the standards designers were scared that people wouldn't realize that it's not thread safe. Additionally, `string_view` is not highly recommended, because it's way too easy to hold onto it while its backing memory is freed. Both of those are not issues in Rust.

Also, `restrict`/`noalias`."
149,pjmlp,1627976606.0,3.0,"C++ is like this wild girlfriend from years back that we aren't no longer together, however regardless of how things are, I will always agree meeting her again, for better or worse."
150,tim-fish,1627949016.0,2.0,What do you find missing from debugging support with Rust?
151,UltraPoci,1627940294.0,18.0,I believe they're talking about C++ not having a trim function
152,BosonCollider,1627953139.0,11.0,"That and a large chunk of the language was designed with web backends and database interactions in mind, and it has a super strong concurrency story based around immutability & atomics. So it has a really good library ecosystem for anything related to web backends & databases (plus having a good compile-to-js dialect if you want to use it for full-stack), and can fall back on the Java ecosystem for the rest.

I don't know if I would use it for everything, and the poor type safety & error messages are a definite minus when working with it, but it is a very beautiful opinionated language and I can understand why some people \*really\* love it.

It has fairly solid corporate support from a subsidiary of Berkshire Hathaway that is dependent on it for its banking systems, so while it may not ever become big (it looks like its momentum came and went), it also has no real chance of disappearing or going unmaintained."
153,mwassler,1629473905.0,1.0,"I think Rust's marketing hits a more broad group than the typical C,C++ dev sometimes.

I see a lot of web developers coming from ruby, node, PHP or python trying out rust as their first stab at a more systems oriented language. Thinking this is the solution to their scaling problems. (this is just based on the amount of times I see people I work with trying to pitch rewriting 300+ DB table rails CRUD apps in rust as a good idea)

So I think there might be some learning curve there. People learning not just rust but systems programming in general. A node.js dev may never even try to write a C program but will probably dabble in rust at some point just due to the hype.

On the flip side web developers who try it and it clicks are probably more likely to evangelize it since it gives them this ""I can do systems programming now"" moment of empowerment."
154,hgwxx7_,1628068230.0,1.0,"???

Did I say on boarding wasn’t challenging? How did you infer that I wasn’t aware of it? I worked in a company that onboarded hundreds of programmers onto Rust FWIW."
155,,1627957799.0,93.0,pls rewrite the law to be unambiguous and memory safe
156,stuzenz,1627974948.0,3.0,"Funny you say that, I came across this today.

https://42papers.com/p/catala-a-programming-language-for-the-law"
157,,1628002528.0,2.0,[deleted]
158,LousyBeggar,1628152253.0,3.0,yes
159,basiliskgf,1627944266.0,27.0,Their intelligence program has plenty of scars from memory corruption exploits being used against them and would definitely be interested in preventing those - not to mention that [malware has already been rewritten in Rust to slow down/evade reverse engineering/detection.](https://www.proofpoint.com/us/blog/threat-insight/new-variant-buer-loader-written-rust)
160,therealslimshoddy,1627940473.0,28.0,Quick! Someone patch upstream to disable the warheads
161,toastedstapler,1627951318.0,12.0,"Small nitpick: for go you can do

    for ind, item := range mySlice {

Which would remove some of the bloat in your example"
162,po8,1627950811.0,18.0,"Matter of taste, but I would rewrite that `.filter().fold()` as

    .filter_map(|i| i.name.starts_with('A').then(|| i.amount))
    .sum()

But yeah, way easy to read."
163,HK-32,1627949558.0,3.0,"Its amazing how people have wildly different tastes when it comes to programming. The manual looping is something I always found eaiser and thought it was a really good ""feature"" of Go because it made you think about the problem and solve it in a logical way that made you learn something. And error handling, I learned C as my first language and have always thought manually checking for error = nil is the best way to do it. Try and catch was nice but just thought it was too much for what error handling really is. I like simplicity in programming, if i wanna check for an error then I will check for an error. ""if error != nil"". To the point and adds no extra constructs to the language. But yeah ultimately it just comes down to personal taste. There really is no wrong and right I guess."
164,Repulsive-Street-307,1627947499.0,2.0,"I don't think this will stay the same forever. Go is probably sooner or later have a update where list comprehensions or similar are a thing. 

Syntax complexity is probably one of the largest salt mines in rust too - necessarily so, because of lifetimes. I have no clue if list comprehensions and generators will be feasible in rust. Maybe it's a glimmer in the rust devs eyes right now.

But they're feasible in Go (because garbage collection and no commitment to '0 cost abstractions').

I think Rust could be more popular too if they had 'massaged' some of the more important and repetitive types to be special cased in the function signature syntax, like Result to be like the Haskell (i think) 'Either' and overload ' T || Err ' in function signatures or the same for 'Option' with some symbol overload (like 'T?').

People tend to hate generics signatures that span multiple lines, so a reduction in the number of characters or 'type matryoshka' in function signatures will almost always have a positive response of 'this is easier to learn' (even if it's not really true), just because they make documentation 'neater'.

And if casual people think rust generics are already complex (just the choice of associated types vs generics confuses many), wait until higher kinded types become something they encounter regularly ... Fortunately rust has no inheritance - except in obscure corner cases in lifetimes iirc - otherwise it'd be even worse."
165,backtickbot,1627944743.0,2.0,"[Fixed formatting.](https://np.reddit.com/r/backtickbot/comments/owpz93/httpsnpredditcomrrustcommentsowll2jrust_is_the/)

Hello, ShadowWolf\_01: code blocks using triple backticks (\`\`\`) don't work on all versions of Reddit!

Some users see [this](https://stalas.alm.lt/backformat/h7hhdso.png) / [this](https://stalas.alm.lt/backformat/h7hhdso.html) instead.

To fix this, **indent every line with 4 spaces** instead.

[FAQ](https://www.reddit.com/r/backtickbot/wiki/index)

^(You can opt out by replying with backtickopt6 to this comment.)"
166,HK-32,1627948792.0,6.0,"Hmm I see. I guess it always comes down to use what's best for your use case. If it works then it works. Maybe I did throw some personal bias in there. But for pretty much everything I've done. I always found Go to be a better fit because it was easier to implement, took less time and the code would come out cleaner, easy to reason about. Now maybe I've most of the time done a certain type of projects where rust just didn't make sense, totally possible."
167,HK-32,1628005509.0,2.0,"Julia feels like the perfect language for people coming from languages like lua or perl. Its syntax puts me off as I come from a more traditional C style background. Its doing great in the scientific world I've heard. Taking a good chunk off of python's audience. But for what I do, that is game servers and backend I pretty much stopped looking at other languages after I found Go. Would love to give it a try though if I ever find myself with a choice."
168,insanitybit,1627943281.0,14.0,>Lots of people will say rust has arrogant diehard fans and attacking their website feels petty. Let's try to limit zealotry.
169,HK-32,1627943003.0,8.0,"Haha I feel ya lol. Personally I feel like once you've ""really"" used Go for a project or two, you just can't go back to anything else. I don't know what it is but everything from it's builtin concurrency mechanism to simplicity just starts to pull you. You can learn the language in a weekend. Its the bare bones. You have functions, variables, loops, goroutines, channels, structs, interfaces and thats like all. People who learn Go and love it, just feel so strongly about it that it almost become arrogance if you wanna call it that :)"
170,cyber_pride,1627943410.0,10.0,"I would also like to learn Go or at least become familiar with it but have felt hesitation by Go‘s perhaps tone-deaf community. I think the biggest contributor to this is the main Go creator himself. He works at Google and said that Googlers (but somehow not himself??) are not capable of understanding a brilliant language. So when designing Go, it needed to be easy to understand and deliberately sought to dumb down the language. 

If you search the Google forums (I forget what they’re called), you’ll realize that his arrogant point of view was not some unfortunate slip of tongue that was captured on video, but that he really did envision and created a language for idiots."
171,rv77ax,1627996020.0,1.0,"> What I don't understand about GO is why there are so many diehard (almost arrogant seeming) fans of it who act like it's the best thing in the world or even better than other languages.

If your opinion is based on your experience on r/golang subreddit then I agree. That subreddit is cancer."
172,Noughmad,1628015713.0,1.0,"So do I, but if you're a manager who doesn't know much about code, it looks more impressive."
173,cyber_pride,1628541174.0,1.0,"My thought process is that for this particular question, the participant would choose a language they liked and move on to the next question. (There are plenty of questions to fill out). 

Why would somebody who’s never used Rust chose to select Rust and not a language they actually love? What do they gain from selecting Rust? Psychologically speaking, what would motivate one to overhype Rust at the expense of not voting for their preferred language?

Do you have stats on how often people lie in surveys?"
174,cyber_pride,1628542400.0,2.0,"Anecdotally speaking I’ve observed growth in the Rust Community Server over the last year or so. People from all ages (high school level and up) and abilities (some users are just starting out with programming, others are experts of some subdomain) seem to thoroughly love the language even if they don’t use it on a day to day basis or even professionally."
175,vadixidav,1628234929.0,2.0,"Hmm, very strange indeed. If it has the same pitfalls in terms of safety as a systems language while not having systems language capabilities, then it doesn't seem like it is of much use to me. I will still give it a go though and check it out."
176,u2m4c6,1627949253.0,4.0,"If the ecosystem was there for server-side, I would say it is the ""perfect"" language. At least for me because I really like functional features like algebraic types and ""Option"" :D"
177,dwalker109,1627941334.0,6.0,"Oh yeah, absolutely. I wouldn’t have it any other way. 

It’s just that however many articles I read about lifetimes, something doesn’t click. I’ll get there eventually but it’s a tough one. Basic use cases (“which argument of my function is the return value relying on”) I get. But there’s a lot more to it than that, obvs."
178,NeonVolcom,1627945563.0,3.0,"Okay, for real, I don't feel like I'm ""good enough"" to use C++ sometimes. Stuff like this makes it an absolute nightmare for me to use. 

It's like, every time I implement something new, 100 people have a 100 contradicting points saying I should do 100 different things. The errors are hard to debug unless your brain is big (and even then...).

I've heard Rust error handling is fairly nice compared to C++. I just don't have the drive to swap languages."
179,nyanpasu64,1628043525.0,3.0,"I think that's not quite the full story. In C and C++ it's possible to write complex lifetimes (self referential types, circular references, non-scoped threads referencing non-'static data) which may or may not be correct, cannot be statically checked by Rust's rules, but nonetheless work well enough to write useful applications around. And Rust will give you a ""somewhat-cryptic-to-the-uninitiated compile time error"" even for the ones that aren't wrong. So Rust lifetimes are only a subset of all programs without UB, that doesn't allow you to achieve everything you may want, though it's a useful and easy-to-reason-about subset."
180,pjmlp,1627970096.0,3.0,"Those are all examples of what I meant with ""micro-optimization culture inherited from C circles spoils the fun."".

string_view doesn't do the required checks, which is what makes it not highly recomended, because those checks are ""costly"".

It is also the reason if you want a safe std::span, you should use Microsoft's gsl::span, as the standard one doesn't do bounds checking."
181,WormRabbit,1627989834.0,6.0,"It's almost nonexistent. Have you tried comparing the support for debugger in Visual Studio and Intellij between C++ and Rust? So many basic features are missing, I struggle to say there is a debugger at all."
182,ForShotgun,1627954494.0,3.0,"Thanks, that's a much better write-up than anything I found"
183,,1628077698.0,1.0,[deleted]
184,isHavvy,1627971841.0,21.0,"You _really_ don't want to write the law with a programming language. The problems with it aren't to do with ambiguous language; often times the ambiguity is a feature; but rather with discoverability and the size of it; at least in America. You have to understand not just the law as written, but also case law which requires even knowing about which cases affect it."
185,house_monkey,1627961125.0,7.0,omg yes
186,ShadowWolf_01,1628011343.0,5.0,"> c++14 and up are actually pretty nice as long as you get to start fresh with them :) 

I know, I'll find myself really wanting to do something in modern C++ with all the nice std algorithms and such; then I learn of the Rust alternative being much simpler and way safer; remember how trying to build a C++ project is a nightmare compared to Rust (cargo is *so* nice); and remember how Rust is just a nicer language overall, and kind of lose the motivation haha.

Plus, there's so much legacy C++ around that trying to, say, write a GUI in modern C++ is hard; want to use Qt? Well good luck with using the standard lib and smart pointers etc. with all the non-modern practices (e.g. raw pointers everywhere) Qt enforces (plus it kind of gives you its own standard lib of sorts)."
187,ergzay,1627948237.0,20.0,So RIIR is even coming to malware.
188,ShadowWolf_01,1628011835.0,3.0,"> Rewriting the malware in Rust can enable the threat actor to evade existing Buer detections that are based on features of the malware written in C.

This is really interesting to me, the idea that malware detection could be language-specific (although I'm not familiar with this sort of thing, so maybe that's just normal?). Any idea exactly what sort of features/things there are in C that would make malware easier to detect, or that would be used to detect malware, but that can't be used for malware written in Rust?"
189,kevingoslar,1628001958.0,2.0,That would also make an unnecessary copy of `item`. So better not do this for complex types like this struct here.
190,BosonCollider,1627951818.0,27.0,">if i wanna check for an error then I will check for an error.

Many people would find this honestly kind of terrifying to read. Particularly anyone that has had to review code submissions for an open source project.

In particular, that's a good reason to support a language that makes sure that the reviewer can find every spot in your code where the submitter ignored an error by simply using grep .unwrap on your source file.  


Also, if error != nil does add constructs to a language. Go has multiple return values as an explicit special cased construct instead of having tuple types or ADTs in the language."
191,,1627951595.0,2.0,[deleted]
192,frxstrem,1627949549.0,12.0,"You could implement list comprehensions quite easily with macros in Rust, e.g.

    list![for x in y => x * x]

And generators are already supported in nightly Rust, with the `generators` and `generator_traits` features.

Here's a [full example](https://play.rust-lang.org/?version=nightly&mode=debug&edition=2018&gist=9aa6ab52b807d9f79db3cd121264b304) showing both."
193,ShadowWolf_01,1627948717.0,5.0,"> I don't think this will stay the same forever. Go is probably sooner or later have a update where list comprehensions or similar are a thing.

That would be an improvement (although I'm not 100% sure I know what you mean by list comprehensions?), although it still doesn't solve other issues like lack of null safety.

> Syntax complexity is probably one of the largest salt mines in rust too - necessarily so, because of lifetimes and LR parsing. I have no clue if list comprehensions and generators will be feasible in rust. Maybe it's a glimmer in the rust devs eyes right now.

Oh for sure, it definitely is complex syntactically compared to Go. I'm not sure about list comprehensions, what exactly do you mean by that? And as for generators, I'm not sure how feasible they are, but I know there's an experimental/unstable API for them, which you can see some info on here I think: https://doc.rust-lang.org/std/ops/trait.Generator.html#"
194,shponglespore,1627978435.0,2.0,"I'm skeptical that Go will ever last list comprehensions given that it doesn't have a list type. One of the things that really irritates me about Go is that the only practical way to deal with sequences if values is by using slices, and they have to me manipulated using magical functions that don't even a have a Go type signature. They lack both the simplicity of immutable types and the convenience of having methods that mutate them."
195,bs2kbs2k,1628006697.0,1.0,"From my experience using python and Rust, they felt like a really limited subset of .filter and .map for me. They are great if you don't have the FP-Style .map/.filter/etc, but they are very much inferier to the .map/.filter methods."
196,ShadowWolf_01,1627949206.0,15.0,"> and the code would come out cleaner, easy to reason about.

Do you have any examples where this is the case? I'm genuinely curious to see an example/some examples where Go is cleaner than Rust, beyond it simply being the result of Rust's more verbose/explicit nature (i.e. an example where Go is cleaner for more reasons than just extra code from Rust wanting you to handle all errors or explicitly cast numbers to different types or something)."
197,sloganking,1627943119.0,5.0,I’ll have to check it out soon :)
198,r0ck0,1627977921.0,3.0,"> Personally I feel like once you've ""really"" used Go for a project or two, you just can't go back to anything else.

Fair enough, and true.  But people say that about a lot of languages, other tech, and just anything in life in general.  

It's important to keep in mind that their new language is only one part of that opinion... the rest of that opinion is based on what languages they used prior.  You can only compare the stuff you have experience with.

On terms of above: not saying anything about Go specifically, I've never actually used it.  More just a general point on trying to make accurate comparisons.

But on Go:

I have looked into Go a little bit, but given that my main languages right now are TypeScript + Rust, and a little of Haskell tinkering (and interest in F#).... pattern matching, non-nullability, generics, tagged unions, advanced typing systems, and heavy sanity checking at compile time are very important to me.  And from what I've read, Go would ***feel*** like a regression for me in terms of the direction I've been going in my language hopping journey.  

Fast compile times would be very nice to have though!  And while I don't know much about the concurrency stuff in Go, from some limited reading it sounds cool.

What languages did you use in the past?  Not trying to start a debate (preferences are subjective and personal for all of us, plus heavily dependent on context too). I'm just curious to understand some more about what you found in your comparisons.

Cheers."
199,_IPA_,1628003453.0,2.0,I found the lack of proper enum support disappointing. Or did I miss something there?
200,nultero,1627948200.0,15.0,"To be fair to Rob Pike (guy who said that), when you've worked alongside the guys at Bell Labs, it really might warp your opinion on everybody else in industry.

Ken Thompson is also on the Go team, and in some ways they made the language that they wanted -- Pike, Ken, and Robert Griesemer say they would only include things they all agreed were crucial to the language they wanted.

Even if it's not a brilliant language, I think it's a little bit fascinating to dissect Go to see what they've decided on. Pike called it the narrowest ""vector space"" of all of a number of feature sets they needed in a production language.

Whether that makes it any more or less interesting is up to you. But I think it's worth having that context for a language that a place like the Rust sub would reinforce as worthless."
201,NotAFedoraUser,1627948931.0,10.0,"He said that new coders joining google might not have 30 years of experience reading and writing complex code, so Go is good for intermediate level of experience IIRC."
202,JanneJM,1627948777.0,2.0,"> but that he really did envision and created a language for idiots.

That's not necessarily bad, though. ""idiots can use"" == ""easy to pick up and use for normal developers and hobbyists"". Think of adaptations for disabled: ramps, elevators, curb cuts, hands-free door latches, wide hallways, traffic light sound signals and so on. They all also help the rest of us go through our lives a little easier and less frustrating."
