,username,comment_created_utc,comment_score,comment_text
175,SkiFire13,1590677257.0,9.0,"> I never have a problem using variables that are null.  I actually use this functionality a lot.  If a variable is null it tells me something in the logic of my program.  How can you do that in rust if you have no null variables, or am I misunderstanding what you are saying?  

In Rust you can use `Option` instead of nullable variables."
176,teryror,1590677905.0,14.0,"Nullable pointers exist in rust, they just have a different type, `Option<&T>` for references, `Option<Box<T>>` for the equivalent of `unique_ptr`, etc. So you have the same functionality without the risk of passing null where that isn't allowed."
177,ThirdEncounter,1590684825.0,5.0,"It's not a fair comparison, since Qt is a framework, not a programming language.



It's like saying ""why would I want to crop an image in Rust when I can simply upload them and Facebook can do it for me?"""
178,AndreasTPC,1590680200.0,2.0,"Instead of having a null value you have an enumerable type like this:

    enum Option<T> {
        Some<T>,
        None,
    }

So if a function returns an Option<i32> you can tell just from the function signature that this function might return an integer, but it might also return nothing, and you need to handle that. If a function returns an i32 instead, you will know that this function is guaranteed to return a valid integer, no need to check anything.

You deconstruct the Option type to get at the value inside Some, typically via pattern matching. The nice part is that when pattern matching you are forced to consider all the possibilities. Forgetting to consider the None case is a compile time error, so the class of bugs that comes from forgetting a null check can never happen. After deconstructing the type you're left with a variable with a guaranteed valid value you can use for the rest of the scope.

There's also nice syntax shortcuts for common cases like ""if there isn't valid value I just want to print an error message and exit"" or ""if there isn't a valid value I just want to pass on the error state to the function that called me"", making the code quite elegant and readable.

The Option type is defined in the standard library, and often sufficient, but you can also define your own that matches whatever states your function might return.

This is by no means unique to rust, this style of handling multiple states for values has been popular in functional languages for some time. This is just one of many advantages that comes from using a language with a modern type system."
179,,1590658452.0,15.0,"Can you please give me a link to a tool which quickly identifies all the issues in a C++ code base, which would have been prevented by Rust's guarantees?"
180,UltraNemesis,1590663184.0,6.0,"Why would anyone move from assembly to C programming when everything can be achieved in assembly?

Because, even if you can do the same things, getting up to speed would make it less tedious to maintain your software in the longer run.

Rust adds major improvements over C in the areas of memory safety. That alone makes it worth moving to for a lot of cases, especially for large code bases and critical frameworks.

A simple memory safety bug in OpenSSL like Heartbleed was responsible for billions of $ worth of expenses for companies. Security Incidents can be more expensive than the cost of ditching your pipeline and migrating to a safer language. You don't have to run additional tools like a static analyzer to know about basic issues or have to live with the possibility that somethings may have crept in despite the tools.

So, Rust is finding use in browser code bases, device drivers, Operating systems, TLS engine libraries and the like. Microsoft is porting parts of the Windows code base to Rust."
181,,1590686736.0,6.0,"Making an account with almost the same name as a well known person in the rust community to keep shitposting about it, really?"
182,ChannelCat,1590680865.0,1.0,What makes this shilling?
183,betamos,1590724630.0,2.0,">I'm sorry, but no one should be rolling their own pointer-based linked list today. In any language.

Nothing to be sorry about, but yes, that's a good injunction. I can agree with that. I guess I'm reluctantly accepting the ""here's how you do X, but never do it yourself"" in this case, similar to crypto.

>Especially in the presence of threads

Yes, absolutely. Lock free programming is considered one of the hardest areas of computer programming. Heck, even basic message passing queue based concurrency adds a layer of complexity that is often larger than the rest of your application combined. And if you go even lower level to threads, not a chance. ""We"" just can't do it right. I honestly think that's a contributing factor of success for JS, that ""everything is single threaded BUT async"" (or, well, non-blocking might be a better term since callbacks and ""async"" aren't exactly the same). It's a paradigm that holds up surprisingly well to this day (despite all its downsides).

>One of the truly great things about Rust is that it forces you out of  this kind of naïve ""in-place mutation with pointers is easy to get  right"" thinking.

Yep, but even without that seemingly minor changes often warrant large refactors. I have yet to convince myself that it's because of Rust as opposed to that they are intrinsically large changes in the ""abstract data model"", if that makes sense. I'm open to either. But it's definitely something that I've noticed with Rust as compared to higher level languages."
184,betamos,1590725045.0,2.0,">In some ways, the product and its culture reminds me of the early days of git.

That's a good analogy since git is amazingly powerful but lacks good defaults, imo.

> Go developers tend to use the same idioms and patterns throughout 

Totally agree, and this is by far my favorite trait (ha!) about Go. Rust is not bad in this respect, unless you go async. In C and C++, you can just forget it - every project has its own dialect to the point of almost being its own language.

>It's a blue-collar language indeed. 

This may be the best compliment that Go has ever gotten. Struggle with the problem, not with the language."
185,quicknir,1590726699.0,2.0,"Where did you get 5x the users? I suspect the ratio is much, much larger. C++ seems to commonly be estimated to have 5 million or so users. I'd be shocked if Rust has a tenth of that."
186,the_game_turns_9,1590681631.0,2.0,"I really don't care which metric of programming language popularity  you like or dislike, it's not the point I'm making, just substitute as appropriate."
187,lelanthran,1590750164.0,1.0,"> The interesting question is - can Rust become comparable in popularity to C and C++ which currently have 5x the users.

C++ alone is estimated between 4m and 5m users. C probably adds another 1m or so on top of that.

Where do you get 1m - 1.2m user population for Rust?"
188,the_game_turns_9,1590652312.0,5.0,"To put it mildly, I have not found Rust 'a joy to use'. I described this [a few days ago](https://old.reddit.com/r/programming/comments/gpbthh/chrome_70_of_all_security_bugs_are_memory_safety/frllepf/)."
189,SkiFire13,1590677733.0,6.0,"> not being able to even open documents like PDF from rust code due to some strange idea that adding decryption support for older cypher algorithms is just insane.

You can do that, it's just that others don't want to write a library for that."
190,,1590670153.0,-16.0,"Whether you’re the same person or not, you exhibit exactly the same failure to understand the risks of what you’re demanding, and characterizing refusal to comply as “insane” like an entitled jackass. And jackasses, it turns out, are interchangeable."
191,,1590750580.0,0.0,"While fair enough, it just underscores that the issue is not as cut-and-dried as OP claimed. I could think of a few alternative paths forward, like implementing the cipher in the PDF library, or forking the crypto crate to add the cipher, ideally with some docs about its known weaknesses. But the demand was literally “add this known weak cipher to your crate.” Now, OP here says it wasn’t him, but also characterizes refusal as “insane.” So I’m sorry, but that kind of behavior will never get a pass from me."
192,BubuX,1590759652.0,-1.0,"Agreed. rust's already steep learning curve only gets steeper as they shove more features in.

Not to mention the intentionally shallow standard library adds even more cognitive load by requiring developers to decide, learn and stay updated on external libraries that can break at the authors whim for a lot of functionality. Hell even today there are popular crates that don't t work well or at all together because they use different implementations of threads.

It'll never be a get stuff done language.  Forever relegated to small niche. Not even close to being comparable to more productive languages.

I'd only use rust as a last resort only if absolutely required for a project. And even then i'd consider waiting a few years for rust to mature."
193,IndependentDocument5,1590647750.0,2.0,"Ok you get my light version

Rust officially says it's memory safe, but it also has 'safe' written everywhere. It's no safer than java which is considered by a safe language by noone. Java was so unsafe it's no longer used by browsers

It's not well thought out. Without going into a rant, you can't build a good app with the standard library. There are essential cargo libraries that should be included in every app and really should be part of the language. Syntax is part of what they didn't think through but that's more subjective

Big projects take too long to compile. If you're going after C++ noone will switch. If you're going after Java, noone will switch. I understand why rust is not used in production anywhere. Who the fuck wants to deal with poor build/development time and garbage standard library

They fucked it up so bad you can't even use the rust language server protocol. Another plugin replaced rls

And this is just my light version. I haven't talked about arrays, null, reflection, error handling, etc  
It's a mess"
194,camelCaseIsWebScale,1590681068.0,0.0,"Not him;

* compile times: technical debt in LLVM IR generation, mainly. Elsewhere written well about how it was a mistake not prioritizing it earlier. Generic monomorphization is so pervasive even in debug builds and no suitable strategy exists to reduce the impact.

* Crates ecosystem: it is being webshit-invaded. Micro packages, holding package names for hostage, no package names pacing by author. Crate-as-compilation-unit also hurts compile time but that's a different issue. Another side effect is big dependency graphs. Hundreds of crate dependencies, requiring lot of disk space and RAM.

* Rust started for servo (the chrome killer™). They discarded GC pointer types shifting goalposts. (Note that RC doesn't interface well with JS world of the browser. That's why chrome has oilpan). Their current flagship is ripgrep where it appears forking the process is a valid GC strategy. (This point is not mine, stolen from somewhere)

* Cognitive overhead: the rust community heralds rust as a language for everything - but there is lot of overhead in reasoning about lifetimes. Some people may say / act like they are not a thing - but in a world where people have different cognitive abilities, and not willing to endure cognitive overhead just in order to show off on reddit ..

* Circlejerk community: They are so annoying.. heralding about their crab god to anyone who talks about anything remotely programming related topics. When you point out the flaws in their language 10% (members doing useful work) acknowledge or clarify. The rest repeats cliche like ""borrow checker fades into background"" or outright start a flamewar. Are you mandated by code of conduct to shill rust whenever Go is mentioned? Go authors never told Go is awesome language for writing OS kernels or UIs. Rust is a well-designed-for-memory-safety systems language.

It appears like lot of influx to 'inclusive' rust community is from webshit communities like RoR which explains spread of webshit micropackages. There is more to CS than knowing difference between stack and heap. Stop showing off webshits!!

/rant"
195,IndependentDocument5,1590688856.0,0.0,You can probably see why I didn't want to post my thoughts. If you look it's clear people are comparing rust to C when I compared it to java. They're nitpicking on things I clearly explained (such as how to use panics after I said panics aren't good enough for error handling and how it's obviously not good enough in java)
196,,1590671467.0,14.0,"I've been using C++17 mostly and Rust is still way better.

I like all the new modern features C++ got recently (especially 'auto' and lambdas) but the committee is just never gonna be able to get rid of the nasty baggage of C and earlier C++ unless they deprecate a whole bunch of stuff and thus invalidating a lot of old code.

I don't get why you're so much against the idea that sometimes new things are just better. Rust learned from the design mistakes of an older generation of languages and came out better for it."
197,AyrA_ch,1590651595.0,1.0,"I automated COVID19 related responses for permits for part of Switzerland this way because the government it department only gave us a half finished solution.

VBA is ugly but it can get shit done fast. [It can also do a lot more than some people think](http://i.imgur.com/VMqYo5b.png)"
198,,1590687739.0,6.0,"Rust is faster and more efficient than every language that fit these conditions. In fact, Rust has the fastest runtime aside from C and assembly.

There is no language that's both faster and safer than Rust. And this is specifically because of their memory management design."
199,CryZe92,1590702444.0,2.0,"If you don't know what I'm talking about, then you don't really know Rust enough to argue that only memory safety is its only trick."
200,leviathon01,1590646023.0,5.0,Nice
201,,1590695215.0,1.0,[deleted]
202,,1590694165.0,0.0,[deleted]
203,,1590659384.0,-4.0,[deleted]
204,,1590668705.0,0.0,[deleted]
205,steveklabnik1,1590688317.0,6.0,"He is not the first, and will not be the last, unfortunately."
206,zerakun,1590781254.0,3.0,"I bet they get their number from the survey: https://insights.stackoverflow.com/survey/2020#technology-programming-scripting-and-markup-languages

In ""All respondents"" C++ is at 23.9%, rust is at 5.1%, so yes roughly a factor 5.

In ""professional developers"", the number is at 20.5% for c++ and 4.8% for rust users, so even closer to a x4.

It is also interesting to note the growth of rust, from 3.5% last year"
207,gaumutra_fan,1590821356.0,3.0,The survey we’re discussing. Rust is at 5% of the respondents while C++ is at 25%.
208,Izacus,1590678562.0,12.0,"That was an example. Not having a feature complete crypto library that can handle older encrypted data is a big oversight for a programming language that wants to compete with C++ no matter how you look at it.

Yes, I can reimplement my own crypto (or use an unsafe mess that is OpenSSL whose bindings won't build for Windows), but that's orders of magnitude worse.

Also note that I did not expect others to implement it (I've contributed to plenty of OSS projects on my own), but even the idea of filling out the library to feature completeness was stonewalled with insults like some other commenters did here.

Having been called a ""jackass"" over this pretty much proves my point about the Rust community attitude you can expect when building software in the language. I've never been called ""jackass"" by people on CppCon, PyCons or pretty much any of Java communities or conferences when working with large systems. Rust is the first."
209,Izacus,1590671108.0,16.0,There's really no need for insults here.
210,sex-fluids,1590795449.0,1.0,"> It'll never be a get stuff done language

I don't know, I've been getting plenty done with it. I also don't agree that the standard library is all that shallow. This seems like a very broad generalization. Plus, like I mentioned, there are things I can't practically get done with JS that I can with Rust. Like, parsing 15-20MM rows of multi-gigabyte CSV files. I'm just not going to do that at any feasible pace or with code I can rely on in JS. In Rust it was pretty easy to get something running which still doesn't crash and runs really quickly. In that sense, it's a 'get stuff done language'. Doing it with C++ for comparable performance would have been misery for me, personally."
211,kankyo,1590648856.0,11.0,"Everyone considers Java a memory safe language. It's just that no one is impressed because it's a managed memory model with a normal tracing GC. 

Rust is memory safe without a GC, that's why people are mentioning it."
212,username-is-mistaken,1590648562.0,2.0,"I can see what you mean, and those are some good criticisms.

I can't make an argument for or against the safety of Rust since I'm not familiar enough with it yet, but I definitely agree that some of the standard library is lackluster.

I personally ran into something like this when trying to work with converting relative paths to absolute ones. I know we have `File.canonicalize`, but we need an external crate to convert a relative path to an absolute path (without resolving symlinks)? That should be built-in along with canonicalize.

As for the compile time... yeah... All that borrow checking is pretty costly, but they've managed to make some small increases in compile time over the past year or two. With LTO enabled, the link time is absolutely awful, but that's not really a Rust problem from my understanding.

And oddly enough, I've had the opposite experience with Rust and C++ compile times. I've had abysmal incremental compile times with CMake and a multi-module C++ project, while a similarly sized Rust one took maybe 2/3rds of the time. That might have just been because of CMake, though.

What's the issue with the LSP? I use CLion for my Rust projects, and it's pretty decent. I haven't had to use another IDE though, so I'm not very familiar with type state of things."
213,shadow31,1590698982.0,2.0,"It comes across like you don't actually know enough about Rust to be able to critique it in the way you're trying to do. A lot of your complaints are misinformed and the comparisons to Java just don't hold water. 

You're free to have whatever opinion of Rust you want but you're never going to convince anyone else they should care about your opinion if you can't communicate it effectively."
214,0xC1A,1590704887.0,-1.0,We've seen this movie before.
215,Shnorkylutyun,1590692925.0,1.0,...is that why Switzerland is reporting such low numbers lately? O\_o
216,,1590696016.0,2.0,"> Rust is faster and more efficient than every language that fit these conditions. In fact, Rust has the fastest runtime aside from C and assembly.

Apart from D.

Also, Rust itself suffers from memory safety bugs: https://www.cvedetails.com/product/48677/Rust-lang-Rust.html?vendor_id=19029

Rust is not the second coming. Stop talking nonsense."
217,,1590703686.0,1.0,What?
218,matthieum,1590769543.0,2.0,"> Why would you do that?

Performance, in general.

While creating an integer without an initial value doesn't bring much, creating 10MB worth of integers without an initial value saves quite a bit of time. It's of course done with the assumption that _something_ will initialize them later, but those assumptions are sometimes erroneous."
219,ThirdEncounter,1590694562.0,2.0,"You started right off the bat comparing Rust with Qt. So, my point stands.


>  If Rust doesn't have such a framework well then it isn't as good yet.

As good as yet for what? If that's a general statement, then it's an inaccurate one.  You have to be more specific than that."
220,SkiFire13,1590660852.0,17.0,"Can't test fbinfer right now, but clang doesn't seem to handle this simple case:

    #include <iostream>
    #include <vector>

    int main()
    {
        std::vector<int> vec = { -1 };
        int& first = vec[0];

        std::cout << ""First is "" << first << std::endl;

        for(int i = 0; i < 100; i++)
            vec.push_back(i);

        // This is now UB, first probably points to invalid memory
        std::cout << ""First now is "" << first << std::endl;
    }"
221,,1590660873.0,6.0,"I didn't read it as an attack and I'm just curious myself, because I'm neither an expert in C++ nor Rust.

But I wonder if it's that easy and reliable to provide all the guarantees Rust offers, then why do most C++ code bases (including professional ones with lots of highly skilled developers like Qt, Firefox, Chromium, ...) still suffer from all these issues? Are the number of issues found with analyzers just so overwhelming or hard to fix, or do they lack in certain regards?"
222,wrongerontheinternet,1590677454.0,6.0,"I know the people who work on Infer.  It's cool technology, but is not close to the level of static guarantees Rust can provide (for pretty fundamental reasons)."
223,UltraNemesis,1590674678.0,8.0,"That's utter rubbish. If a language improves something that's worth more than the cost of the migration, then it will always be worth migrating. Memory safety is definitely one such feature. Its clear that what ever support tools there are for C have not always helped given how many memory safety issues leading to security vulnerabilities are being discovered 20-30 years after the code was written and in heavily used pieces of software.

I also call bullshit on the size of software argument. I worked on a pretty massive code base of a professionally used software product which was first written in the mid 80's for Apple Mac's using C and Assembly. After more than a decade, it was subsequently ported to support Windows which was a massive port in itself given the difference in CPU architecture as well. Then a majority of the Mac side of the code was ported to Objective-C after another 15 years. I am no longer with the company, but I hear parts of the code are being ported to Rust now. You do whatever is needed to improve your product and keeping it current.

I am not saying that you need to port every damn thing written in C to Rust just for the sake of doing it, but there is always technical and business sense in doing some upgrades regardless of how massive the code base is.

As for Microsoft, they are indeed ""experimenting"" with rust and that experimentation involves porting/rewriting existing software in rust through they have not revealed which parts they are. Obviously, they have also adopted rust for new projects as well.

[https://msrc-blog.microsoft.com/2019/11/07/using-rust-in-windows/](https://msrc-blog.microsoft.com/2019/11/07/using-rust-in-windows/)

""Recently, I’ve been tasked with an experimental rewrite of a low-level system component of the Windows codebase (sorry, we can’t say which one yet). Instead of rewriting the code in C++, I was asked to use Rust, a memory-safe alternative. Though the project is not yet finished, I can say that my experience with Rust has been generally positive."""
224,crabbytag,1590694315.0,6.0,"I think it's reasonable to want to use older, insecure decryption algorithms. 

I also think it's reasonable to not want to add the corresponding insecure encryption algorithms in case someone uses it by accident. Adding something and maintaining it is a burden, and it's understandable that someone maintaining a library for free wouldn't want to add something insecure and deprecated. It goes against the founding principle of that library - ""no insecure crypto"".

If you feel strongly about this, you can create your own crate for this. If your use case is only decryption and only for an offline use case, I don't see any potential security issue. It doesn't seem ""orders of magnitude worse"".

Lastly, I would encourage you not to extrapolate about the hundreds of thousands of Rust developers in the community based on one or two people. The Rust sub alone has 100k subscribers. That seems like sampling bias to me."
225,,1590671477.0,-20.0,"Yes. There really, _really_ is."
226,BubuX,1590818130.0,0.0,"> Like, parsing 15-20MM rows of multi-gigabyte CSV files.

This can and IS frequently done with python in a performant way. No need for rust. It's not even a recommended niche for rust.

> Rust it was pretty easy to get something running which still doesn't crash and runs really quickly.

No it isn't. Naive rust implementation is often slower than other languages for various reasons. Here's an example of a naive Rust implementaion being slower than Go: https://news.ycombinator.com/item?id=23058147"
227,IndependentDocument5,1590649594.0,5.0,Yes. It is interesting that they did it without using a GC. However their community acts like it's safe as in it won't have a shitton of security vulnerabilities in a nontrivial app. The community annoys me so much as they think 'panic at runtime instead of memory corruption is good'. Like what in the actual fuck... Exceptions that people don't catch existed for over 25years and NOONE uses that
228,MEaster,1590668266.0,6.0,"> As for the compile time... yeah... All that borrow checking is pretty costly, but they've managed to make some small increases in compile time over the past year or two.

That doesn't match anything I've seen. Every compile time metric I've seen has shown borrow checking to be one of the faster stages of compilation. Typically it's been code gen, macro-related things, and heavy (ab)use of the trait system that tends to take the longest to compile."
