,username,comment_created_utc,comment_score,comment_text
91,lelanthran,1590751041.0,3.0,"> In system's programming, Rust competes with C and C++. Look how long it took C++ to take over.

I respectfully disagree; Rust is competing with C++, and C++ alone. Those C developers who wanted something better either already took the leap into C++ or jumped ship altogether to some other language already.

Those who remained *and wanted better static error analysis* made valgrind and clang-tidy and cppcheck part of the build/test process.

 C will die off on its own with no help from other language simply due to attrition - no competing language is necessary. Go might possibly pull a few C developers, maybe?"
92,jiffier,1590654597.0,-4.0,"Mm, I think Rust mistake is trying to sell itself as a systems language. A few days ago a guy told in /r/rust about how they moved from Wordpress to Rust for webdev, and they were loving it."
93,afnanenayet1,1590676743.0,15.0,I’m gonna go out on a limb here and say Haskell is still the Haskell of this generation. I think Haskell is a bit different because it’s actively developed by academia
94,camelCaseIsWebScale,1590681272.0,-7.0,Haskell was nowhere that bad. They were people who felt they were enlightened. Rust is mostly people trying to show off.
95,darderp,1591339091.0,3.0,"I'm a week late, but I just wanted to say as someone starting out with Rust this is a very valuable nugget of info. Thank you!"
96,typenil,1590757942.0,2.0,I appreciate the advice. I'll endeavor to make ugly code until I know enough to make it prettier
97,slowpush,1590676809.0,-11.0,"3 -> 5% isn’t significant growth. Feel free to look at typescript’s growth over time to show how a new language actually grows and gains acceptance. 

Also rust has moved way past the idea of being a systems language with how it’s being marketed nowadays. 

“A language empowering everyone to build reliable and efficient software”"
98,,1590746383.0,1.0,...and 14% hate it.
99,,1590644294.0,6.0,[deleted]
100,matthieum,1590685287.0,12.0,"I would note that it's perfectly OK to be lazy and give up ;)

There's lots more to life than learning Rust, so if you're not enjoying the experience, you may as well do something else. And maybe come back later."
101,devraj7,1590691184.0,3.0,"Fair enough but I think I have a pretty accurate picture of the language.

These past two decades, my programming has just been geared more toward higher level (not system) programming because I'd rather not think too much about lower level details such as memory management. Rust puts this front and center, which is why I think I wouldn't enjoy it. But it's a great language with a fantastic and well executed vision."
102,,1590826566.0,2.0,"FWIW, it looks like the other platforms are getting more love in 5.3."
103,,1590703768.0,-3.0,"Well, considering it was designed to avoid these errors it's failed, hasn't it. And this is code written by the authors of the language! lol."
104,,1590670623.0,-1.0,Memory safety. There is nothing more interesting about it.
105,couchrealistic,1590641564.0,46.0,"Rust prevents you from doing all the stupid things we sometimes accidentally do when coding in a language like C++. Like using an uninitialized variable (that just happens to be 0 most of the time, but sometimes not) or occasionally modifying a collection while we still hold a pointer or reference to some of its content, or while iterating over it – which often works fine, but depending on the implementation might be undefined behavior and lead to rare Segmentation Faults.

In short, you can't possibly hit a Segmentation Fault when only using Rust without the ""unsafe"" keyword\*. This also means that coming up with programs that compile successfully can be quite a bit harder in Rust compared to C++. This might lead to something like Stockholm Syndrome and therefore ""Rust love"".

\* If all your dependencies also refrain from using unsafe, or use unsafe only in safe ways, and there are no bugs in rustc.

Also, Qt might have almost everything and the kitchen sink included, but sometimes you need even more. Cargo really comes in handy in those cases, because adding dependencies is really easy. It's also much nicer to use than qmake or cmake to build your project (though less feature-rich). No crazy CMakeLists.txt or qmake config files, you just put your code in .rs files, list the required dependencies in Cargo.toml, set some options like the optimization level, and cargo knows what to do.

AFAIK, the rust ecosystem is lacking a decent cross-platform GUI library though. So Qt definitely still has very valid use cases."
106,sm2345,1590716879.0,2.0,"If you're using Qt to make GUI-based applications, I don't think Rust has an equally usable and mature GUI library yet, as pointed out by others.

I'd honestly just get my feet wet and try writing a few things. It does have a steep learning curve though, but for me, the end result keeps being worth it."
107,404_Identity,1590643521.0,15.0,[removed]
108,,1590655355.0,9.0,[deleted]
109,crabbytag,1590693401.0,4.0,Sounds like survivor bias?
110,lelanthran,1590743415.0,1.0,"> Despite this, though, that's still a surprisingly high number of users who adopted the language given its relative immaturity!


Doesn't seem that way to me; I can't think of a popular language that had a slower adoption rate than Rust. Can you?"
111,UncleMeat11,1590633561.0,24.0,"> There are certain pathalogical cases like graph data structures that you will struggle with in Rust compared to a GC'd language though.

Are these really pathological? ""It is really hard to implement thread safe persistent data structures because of ownership"" has been a known problem in C++ for ages and comes up with surprising frequency."
112,betamos,1590639769.0,35.0,">Often the architecture that Rust pushes you towards is legitimately the better architecture though.  

\[I've been developing on Rust professionally for about year and a half.\]

I think that's true often but not always. For instance, simple CS 101 data structures like linked lists, DAGs and trees require some serious gymnastics to get working and each performance improvement often comes with major re-architecture. [This tutorial](https://rust-unofficial.github.io/too-many-lists/) is an excellent example of this issue. Each iteration of improving the implementation goes down a completely different route. It's such a large tutorial (for making a linked list) and manages to cover really esoteric parts of Rust, even unsafe. So the implicit deception from the Rust community, the way I see it, is that showing some neat self-contained examples of pattern matching, borrowing, generic types, meta-programming, aren't representative of real world usage. More often than not, you have to step into the dark esoteric caverns of the language, or use community-maintained crates for standard use cases.

TL;DR: I think Rust delivers on performance, multi-paradigm and leaving the user in control over almost every single trade-off. However, it doesn't deliver quite so well on sane defaults and incremental learning. This results in a steeper-than-ideal learning curve and sub-dialects that vary from project to project."
113,camelCaseIsWebScale,1590678643.0,0.0,This is true maybe 1 out of 4 times. Other times you might end up with inefficient/bad design in order to work around the language.
114,,1590653157.0,0.0,[deleted]
115,the_game_turns_9,1590627467.0,7.0,"I am honestly not sure the point you are trying to make. Acquiescing to what? Features are what makes a language useful and not an enemy of language design, adding features doesn't in my head equate to ""buying"" popularity, and what makes Rust unique isn't a lean feature set.

In my head, Rust isn't rare because it is feature-lean. It's rare because it's an acquired taste the way that Haskell and F# are. It's a difficult path. The road less travelled. And while Rust will take its place in the world, I honestly think it can and will never be in the top five of TIOBE. Not because of what it is now, but because of what it is trying to be."
116,newpavlov,1590695501.0,4.0,"When have you tried to do that? [RustCrypto](https://github.com/RustCrypto) supports all kinds of basic cryptographic primitives, even broken ones (such as DES and MD-5) with appropriate [warnings](https://github.com/RustCrypto/hashes#supported-algorithms)."
117,,1590667320.0,-5.0,"I remember that issue. It was explained to you, in extremely clear and simple terms, that the crate in question would not be adding a _known insecure cipher algorithm_ to its codebase. Your intransigence in demanding they weaken the security of their crate for your particular dangerous use-case was spectacularly obnoxious, and they rightly kicked you to the curb."
118,coderstephen,1590688565.0,11.0,Earth?
119,sex-fluids,1590726326.0,3.0,"I've spent my career shooting myself in the foot with them occasionally so I just kind of figured, I guess. I mean, things like Sentry and Rollbar exist because this is just reality as far as I'm concerned."
120,BubuX,1590668401.0,-2.0,"the rust planet

it's not rare to see rust users trashtalk every other language like rust is the second coming"
121,matthieum,1590683929.0,1.0,"It doesn't surprise not because the Python is not friendly, but simply because it's so big you're bound to find less friendly people... and those experiences stick."
122,IndependentDocument5,1590644730.0,-11.0,I would want to write a full blown post but don't really know where to post it. And it'd totally get removed here or downvote to invisibility
123,GayAnalMan2,1590941929.0,3.0,"that would follow, yes."
124,,1590669569.0,19.0,"The only ugly thing about it are the lifetime annotations, which you won't be using that often anyway.

It has a bit of a learning curve but honestly it's worth it for what you're getting.

C++ also has a huge learning curve if you really want to learn it properly but even if you have an extensive C++ knowledge you're still gonna be shooting yourself in the foot quite often."
125,PrancingPeach,1593066134.0,2.0,Really it's considerably easier to learn than modern C++.
126,GYN-k4H-Q3z-75B,1590651020.0,7.0,"VB really went too far with that, and its reputation is irreparably damaged. Even today's VB which has little to do with VBA has these crazy options. Option Explicit Off, On Error Resume Next. Valid code that compiles and causes no error with such options:

x = ""Foo"" : x = 2
y& = x.ToLower
unknown.doStuff(42, y)

It's fun if you want to just glue together a few lines like when scripting but it's crazy to run business critical apps using that. Then again, today we have JS to do that and that's arguably worse than VB since the mid 2000s."
127,hector_villalobos,1590688575.0,1.0,"How stupid I was by using that, what was I thinking?"
128,netsec_burn,1590630302.0,4.0,https://i.redd.it/4fwnuc211ml01.jpg
129,haCkFaSe,1590635072.0,2.0,You mean VBScript?
130,LegitGandalf,1590625637.0,3.0,Oh gawd...please tell me it's not California?  I don't want to move!
131,,1590669897.0,12.0,"It can easily be both a systems language and a high level general purpose language.

It's definitely more suited for systems stuff since it's normally compiled to native and forces you to be aware of lifetimes, I wouldn't mind using it for web but I could think of more suitable languages."
132,,1590746203.0,1.0,"lol, it's ironic that the biggest web development framework for Rust is completely memory unsafe!

https://words.steveklabnik.com/a-sad-day-for-rust"
133,tsbockman,1590686867.0,2.0,"Learning basic Haskell made me a better programmer, by forcing me to learn the pure functional paradigm and how to implement data structures without mutability.

But, I have no desire to actually *use* Haskell for anything serious. Real computers have mutable memory, and practical programming languages should accept that..."
134,,1590677335.0,10.0,"Yeah, that's never gonna be comparable. JS is a fast moving eco system that constantly changes. Also typescript is completely compatible with JavaScript and only adds some extras on top of it, it's not difficult to learn for anyone already knowing JS which is a huge advantage for it.

Rust goes beyond systems programming but it's still with new concepts and a steep learning curve. And even if it's spreading into different fields it's main use is still in fields that aren't fast changing, especially not when compared to something like JS."
135,,1590864187.0,2.0,"...if you can only love or hate a thing with nothing in between, and also less “hated” than any other language at ONLY 14%, again assuming you are a emotionally binary automaton."
136,_demilich,1590675463.0,9.0,"It is called ""fighting the borrow checker"" and everybody has to go through that phase. At least I did and it was rough. They were times where I literally thought ""Fuck this, stupid compiler won't let me write perfect valid code"". Of course, the compiler was right, the code was not memory safe. My advice is: Take your time, keep on trying! Accept the rules of the borrow checker and over time you will encounter less and less issues. You will develop a skill to anticipate the borrow checker objections. 

And what is really interesting: This skill transfers to other languages without borrow checker. As a simple example: Many programmers write code where they want to modify a list while iterating over it. No matter the programming language, this is usually a bad idea. With Rust, the compiler will just not allow you to do that and as a result, you internalize that this just won't work."
137,gaumutra_fan,1590651059.0,7.0,I’d suggest asking for help on /r/rust. Folks are pretty friendly there.
138,CryZe92,1590698218.0,4.0,"I feel like it's somewhat the opposite. The fact that the compiler cares about all sorts of thread safety issues, memory issues and co. means I can actually focus on my actual application logic much more than I would be able to in other languages as I don't have to actively think about those as much, as you can rely on the compiler helping you out if you do indeed get them wrong."
139,Kissaki0,1590742649.0,4.0,"There’s a difference between avoid and eradicate though. If you can reduce them by 90% I would definitely consider that worth it.

I also think it’s unfair to look at just this statistic and say they failed when I don’t know what the cause was. Maybe this was not caused from within the safe rust code.

I certainly don’t know where the cause was. And the CVEs don’t say specifically. One mentioned a fix commit, which commit hash I searched for, but did not find. I did not check further."
140,,1590682024.0,6.0,"- faster than Java
- safer than C++"
141,CryZe92,1590698053.0,1.0,What about derives? Those seem fairly unique to Rust.
142,comentarista,1590645704.0,20.0,"I am learning rust, and lacking a production ready GUI library seems to be a problem. So I stay with C++ & Qt for these use cases.

Anyway, rust is a great language, I'm enjoying. Pattern matching is awesome."
143,coderstephen,1590687948.0,2.0,"In theory you can use existing GUI libraries since Rust has good C FFI. For example, the Rust wrapper around GTK is pretty comprehensive and well-received. C++ FFI is a bit lacking though."
144,,1590673968.0,0.0,[deleted]
145,,1590656623.0,-9.0,[deleted]
146,,1590678518.0,-24.0,[removed]
147,matthieum,1590769805.0,3.0,"Possibly, as well.

I picked Selection Bias because I am not sure that people who tried Rust and quit identify as ""Rust users"" or even ""former Rust users"".

I mean, I toyed with Haskell for a week or two a long time ago, and I don't claim to be a ""former Haskell user"" because it seems to me it would imply some degree of accomplishment that I do not feel I have.

Of course, the question is whether such users _should_ identify as ""former Rust users"" from the POV of the survey. It's hard to say that you love/hate a language after 8h or 16h of practice -- is your opinion really relevant when you know so little about it?^1

^1 *It's certainly relevant to the Rust community, as an indicator that the initial onboarding experience is lacking, but that's a separate topic.*"
148,matthieum,1590769407.0,2.0,"Well, I was born 1 year after the latest popular systems programming language was (C++), so its early history quite eludes me.

The only language which similar enough to Rust -- being a systems programming language and not forced upon developers -- is Zig; and it is younger and less popular, so cannot serve as a yardstick."
149,matthieum,1590682779.0,3.0,"That's indeed another case of a GC making things easier, but it's a very distinct one: it has nothing to do with the architecture of the program."
150,,1590666949.0,16.0,"> More often than not, you have to step into the dark esoteric caverns of the language, or use community-maintained crates for standard use cases.

I'm sorry, but no one should be rolling their own pointer-based linked list today. In any language. Especially in the presence of threads. As Simon Peyton-Jones put it when talking about [Software Transactional Memory](https://www.youtube.com/watch?v=4caDLTfSa2Q):

> A double-ended queue... if you write the code for just a sequential program, it's an undergraduate project to get queue insertion and deletion going. If you want to do this scalable lock-per-node thing, it's a publishable result. I kid you not. There are international academic conferences with a succession of papers that have been published about this very problem.

One of the truly great things about Rust is that it forces you out of this kind of naïve ""in-place mutation with pointers is easy to get right"" thinking."
151,matthieum,1590683168.0,10.0,"> For instance, simple CS 101 data structures like linked lists, DAGs and trees require some serious gymnastics to get working and each performance improvement often comes with major re-architecture.

I think the fault is in the premise, those data-structures are NOT simple.

Every single time I see a Stack or Linked-List C++ implementation on codereview.stackexchange.com, it's buggy. The good posters include tests, they still fail.

An array is a simple data-structure, after that it gets complicated. Even a dynamic array in C++ is quite the endeavor -- insertion of N elements in the middle is surprisingly complicated to handle^1 .

Data-structures are foundational bricks; the fact that they are _simple to use_ despite the complexity of their implementation is a testament to encapsulation.

^1 *And I say that after finishing coding yet another variant just today...*"
152,,1590657868.0,4.0,"Thanks, this is a great summary. I haven't been using Rust professionally but on the side for about a year. There's so much good stuff in there, but every time it seems like doing simple, practical, everyday things is far too complex. In some ways, the product and its culture reminds me of the early days of git. 

As a point of comparison, I've been using Go for a few years and while it has many annoyances, you can always find workarounds without going into esoteric hacks. They may not be pretty (heck, Go isn't pretty in general), but they aren't complex. Go developers tend to use the same idioms and patterns throughout, so finding your way around an existing codebase is fairly easy. It's a blue-collar language indeed."
153,Pand9,1590661901.0,0.0,"On the other hand - if you do dive deep, you can do anything.

IMO the biggest misconception in rust community is that ""obscure"" features are only for those that choose to use it, and most people are good with basics. This is not the case - programmers don't choose problems they encounter.

But that is still nothing compared to c++."
154,asmx85,1590654444.0,1.0,That's not how i remember what Mr. Blow was saying.
155,matthieum,1590683542.0,3.0,"Adding features is a dangerous game, though.

Stroustrup made a call [Remember the Vasa!](http://www.stroustrup.com/P0977-remember-the-vasa.pdf) for C++2a, and honestly it's not clear to me it's been heard.

C++ has too many features, interacting in subtle ways, and this entanglement generates a lot of complexity for everyone involved -- from compiler writers to developers.

I'm not saying you should never add a feature; just that you need a vision for the language -- a domain in which it should excel -- and make sure that the feature you plan on adding pull its weight for that domain.

Attempting to be everything sunk the Vasa, and drove the budget of the F35 through the roof. You don't want that for your language of choice."
156,gaumutra_fan,1590650259.0,8.0,"TIOBE is an absolute terrible measure of anything. It’s utterly meaningless. It’s literally the number of google results for a query. Not even something relatively clever like Google trends. 

If you disagree, please explain how C and Java seemingly lost half their popularity in 2017 and regained it the next year. We’re there some seismic shifts in the most stable languages in existence ... or maybe Google just made some changes to their algo. I’m inclined to believe the latter.

I get what you’re trying to say, that Rust won’t become as popular as the most popular languages (according to a real measure like Stackoverflow survey, Github repos, SO questions) - JS, Python etc. that’s a pretty reasonable take. Rust will always be more niche than them. 

The interesting question is - can Rust become comparable in popularity to C and C++ which currently have 5x the users."
157,,1590631010.0,4.0,[deleted]
158,TribeWars,1590693500.0,1.0,The near infinite amount of features and things to learn in C++ is what makes it so hard to use competently.
159,Izacus,1590669885.0,15.0,"I don't remember filling any such issue so I think you mistook me for someone else.

But this is the exact attitude I'm talking about though - not being able to even open documents like PDF from rust code due to some strange idea that adding decryption support for older cypher algorithms is just insane.

Being able to decrypt data that's older than a year is not a security hole by any definition."
160,lelanthran,1590750259.0,2.0,"> I remember that issue. It was explained to you, in extremely clear and simple terms, that the crate in question would not be adding a known insecure cipher algorithm to its codebase. Your intransigence in demanding they weaken the security of their crate for your particular dangerous use-case was spectacularly obnoxious, and they rightly kicked you to the curb.

You are demonstrating the problem they are complaining about. If you had only kept quiet the rest of us might have been skeptical."
161,sex-fluids,1590726264.0,1.0,"I love JS and Ruby for what it's worth. They're great for certain things. I wouldn't use Rust for plenty of things I'd use JS for, too. For a simple script on a server, I'd probably pick Ruby too. They all have their place. If anything I'm just trying to point out that there really are great uses for Rust. It has qualities those other two don't, and never will."
162,username-is-mistaken,1590645830.0,16.0,[deleted]
163,0xC1A,1590670003.0,-10.0,Not my fault u using Turbo C++.
164,Malgidus,1590636235.0,3.0,"Both, but mostly VBA."
165,Malgidus,1590628667.0,4.0,"Nah and TBH the VBA is usually not mission-critical code. At best it's  Excel reports that dont get generated the next day and at worst its an HMI screen not updating correctly.

The mission critical stuff is written in standard logic languages (ladder, function block, structrured text, etc.) which are tried and true for decades and run on processors with very low failure rates."
166,shadow31,1590750838.0,3.0,"1. It was never ""completely"" memory unsafe
2. The project actually takes those issues seriously now and has fixed them."
167,UARTman,1596623525.0,0.0,"You should research the situation before posting, my friend. I suggest heading to r/rust , looking for actix keyword, finding the controversy, reading more than one article about it, and *then* go to r/programming to pose as an expert throwing gotchas at these silly rustaceans."
168,,1590864233.0,0.0,Yeah but that doesn't seem to be the case with Rust fanbois!
169,,1590745515.0,1.0,"> If you can reduce them by 90% I would definitely consider that worth it.

So would I, but reading replies from fanbois you would have thought Rust is the holy grail of languages being perfect from top to bottom."
170,,1590682330.0,-3.0,Many languages fit this.
171,,1590702380.0,1.0,What?
172,UARTman,1596623900.0,1.0,"Like traits, they exist in all ML-based languages. Rust is just the only imperative one, so you never used others."
173,incompletebreadstick,1590645841.0,31.0,https://areweguiyet.com/
174,matthieum,1590682591.0,16.0,"> I never have a problem using variables that are null.  I actually use this functionality a lot.

Not that uninitialized != null.

Uninitialized in C++ is what you get when you write: `int i;`. The language simply doesn't initialize the variable:

 - The compiler may pull all kinds of shenanigans when it realizes this.
 - Even if it doesn't you'll get some unpredictable value -- whatever is left over there by the previous variable.

GCC compounds the issue by zeroing the stack in Debug, often hiding the issue until you compile in Release.

When it's an integer, it's annoying, when it's a pointer:

 - It will not likely be null, so you'll think it points to something.
 - If you're lucky it points into the nether, and you get a segmentation fault.
 - If you're not it points into the memory of the process, and you'll scribble all over another object, and get one hell of a headache attempting to understand what happened."
