,username,comment_created_utc,comment_score,comment_text
0,its_a_gibibyte,1590622249.0,64.0,Is rust really that lovable? What's the deal?
1,ChainsawArmLaserBear,1590630388.0,27.0,"I wonder how much of this is based on active use.

Like, as a non-Rust developer, I actually don't find myself on Stack Overflow all that often unless there's a really esoteric, one-off question that I don't feel like reading a textbook to answer."
2,zitrusgrape,1590614641.0,42.0,https://www.reddit.com/r/rustjerk/ /s
3,,1590668526.0,7.0,The best part of programming is breakpointing and single stepping with a debugger to find memory access defects and adding short delay loops to fix race conditions. WillI like Rust?
4,gaoshan,1590639795.0,28.0,My takeaway from that survey is that the most beloved language that a lot of people use is Typescript. Rust is an anomaly to me.
5,sm2345,1590716583.0,3.0,"There's this excellent video (not made by me) called [Considering Rust](https://www.youtube.com/watch?v=DnT-LUQgc7s) which goes into some detail on Rust's selling points, drawbacks and so on. I think it's a good watch for programmers who have experience in other languages but are curious about Rust.

Kudos to the author for making this!"
6,Malgidus,1590622384.0,23.0,"And VBA the most hated. I pleasantly agree with both: Rust is easily one of the best languages, and VBA is easily one of the worst."
7,,1590638782.0,38.0,[deleted]
8,,1590670649.0,3.0,[deleted]
9,shruubi,1590707686.0,3.0,"I feel like Rust is currently going through a cycle similar to how Ruby was a few years ago, it's a reflection of it being the current trendy thing in the industry due to certain people who are ""Twitter-influential"" jumping ship to the Rust bandwagon like they have for every other new, trendy technology over the last few years."
10,typenil,1590667411.0,8.0,"Only started getting into Rust in the last few weeks (after meaning to for years). It's much clearer to me now why actual usage is so low.

All that safety comes at the cost of frontloading a lot of required knowledge to get things to compile."
11,,1590663332.0,8.0,[deleted]
12,,1590642250.0,2.0,[deleted]
13,devraj7,1590665062.0,2.0,I love the idea and execution of Rust but I'm pretty sure I would dislike actually coding in it.
14,Artikash,1590684348.0,1.0,How is Swift so far down? What’s not to like about Swift?
15,Dean_Roddey,1590702397.0,1.0,"I'm a long, long time C++ developer and staunch OO advocate (when it's appropriate of course.) I've been digging heavily into Rust for the last couple months. Of course I could have just read articles forever and wouldn't have ever really gotten it. You sort of have to just jump in. And of course of course with only a couple months, despite deep diving, I've only scratched the surface.

It's like the completely annoying, known it all purist guy, and it can drive you crazy. And I hate that it ignores full inheritance. And I hate the fact that I spend a lot of time doing manually what exceptions could have done for me.

But, it has that one big party trick that's hard to ignore. That's probably why most folks who use it are using it. My hope is that some company (AKA Microsoft) would come along with a language that has the same memory safety, but learning from Rust's mistakes and making it a full on OO language. I'd be all over that.

In the meantime, I'll continue to explore Rust. Just to give myself a practical target I'm attempt to port my large C++ code base. Well, mutate my large C++ code base, you can't really 'port' from C++ to Rust for the most part, since they are so different. You really never appreciate how convenient a cavalier attitude towards memory safety is until you can't do it anymore.

One big problem Rust has is that it can't be some all seeing, all knowing code analysis tool as it's compiling. The overhead would be huge and compilation painfully slow. So it keeps its analysis very localized. That means that some things that actually would be safe if it could understand them, it will reject. That can be annoying."
16,,1590656088.0,-9.0,"Jesus, the fanbois are out in force today!

> Rust held onto it’s spot as the most beloved language among the professional developers we surveyed. That said, the majority of developers who took the survey aren’t familiar with the language.

If you read the small print the graph shows the following:

> % of developers who are developing with the language or technology and have expressed interest in continuing to develop with it

That means 13.9% of rust developers hate it."
17,,1590696235.0,-1.0,I'll just leave this here: https://www.cvedetails.com/product/48677/Rust-lang-Rust.html?vendor_id=19029
18,,1590683445.0,-6.0,[removed]
19,,1590667646.0,-9.0,Rust is a one trick pony.
20,,1590624030.0,173.0,[deleted]
21,,1590670241.0,16.0,"Coming from a C++ background it's a huuuuuge upgrade.

After the initial learning curve just about everything is easier. Coding is easier since the compiler thinks about a lot of the stuff you had to think of manually when using C++ and building is waaaay easier since Rust comes with a pretty good build system out of the box. There's no haphazardly duck taping libraries and build systems like you do in C++.

The only thing I miss about C++ is the rock solid utility libraries like boost, but the Rust ecosystem is getting bigger and more mature by the year so it'll get there."
22,the_game_turns_9,1590625485.0,126.0,"Rust isn't used in many production environments, so very few people are forced to use it. As Bjarne put it, ""There are only two kinds of languages: the ones people complain about and the ones nobody uses.""

Rust is the kind of language that you wouldn't even want to approach unless you were buying what it is selling, so you won't get very many dislikers since the dislikers will just never bother to become proficient in it.

And I'm sorry to say this, but when the Rust language fails to handle a case well, the Rust community tends to blame the coder for wanting to do the wrong thing, rather than the language for not being able to handle it. In cases where other language users would say, ""oh for fucks sake, this is stupid"", the Rust community tends to say ""That's bad form, you should rearchitect."" If you're outside the community, it can look a bit rose-tinted-glasses.

I'm not saying Rust isn't a good language, but I don't think that's all thats going on here."
23,UK-sHaDoW,1590671567.0,7.0,"Learning to write C++ bug free is freaking hard. It easy to get started with C++ but your probably writing tons of bugs with every line of code.

Rust is hard to get started, but its covering your butt for you most the time. It's pain in the ass to get it to compile though.

So its like marmite. A lot of people really hate it because they don't understand what it's protecting you against and feels really hard to use. They haven't learned **RAII** and the thousands things of that C++ lets you write code without, and don't realise the stuff their code is missing. Or they're just really lax in writing code?

Then there's people who know what its protecting you against and love it for it."
24,sex-fluids,1590643548.0,13.0,"I had to pick it up in the last few months (started by building something to parse and normalize huge amounts of data from multiple sources) and coming from JavaScript it's kind of incredible. The ergonomics aren't great at times (especially at first), and if you're used to a foot-gun language like JS or Ruby you could find yourself writing weird unnecessary abstractions that Rust probably already solves for. It's a bizarre shift in that regard. But Cargo *just works* like you'd hope npm would. The packages are generally high quality. The compiler is pretty good at telling you how you're fucking everything up. The type system is very capable and helpful. When you design things well, you can get away with remarkably concise yet robust solutions. I find when I finish something I feel pretty good, like... I wrote something that'll run and perform well.

At first I thought things like ""God damn, I need to worry about x and y? I just want to write code"", but now I actually enjoy writing it a lot. It's been an eye opener.

If you haven't tried it, I recommend starting out with a simple CLI tool tutorial. It's very easy to get going and once you've written something that actually works, you might see the value in it."
25,netsec_burn,1590628231.0,22.0,"I love Rust for two reasons. One, because of how easy it is to make relatively safe code. The compiler is very helpful. Two, the community is so friendly and welcoming. I contrast that to my experience with the Python community, where I was repeatedly told to read the docs, use lib x, or that I shouldn't bother to code y if I didn't know how. The Rust developers really go out of their way to help, even extending beyond the language (s/o seri). One year on, I'm a happy Rust programmer and I like helping the newbies. It's been a positive experience and the language just keeps getting better."
26,,1590667367.0,2.0,I recommend trying it. It’s open source and has no barrier to entry.
27,IndependentDocument5,1590635864.0,-21.0,"Honestly people like to say they love rust just like the idea of it

It's poorly executed trash for half a dozen reasons which anyone knows if they actual used the language. It's terrible and not well thought out."
28,GayAnalMan2,1590716710.0,-2.0,It is a superior language for a truly superior kind of mind.
29,thiago2213,1590665142.0,15.0,"Only 5% of the surveyed actually use it. The post itself points out _Rust held onto it’s spot as the most beloved language among the professional developers we surveyed. That said, the majority of developers who took the survey aren’t familiar with the language_"
30,,1590668106.0,9.0,Read the article and wonder no more.
31,,1590667422.0,-13.0,Salty
32,coderstephen,1590688473.0,6.0,"No, you monster."
33,zerakun,1590784278.0,3.0,"While it's true, the sentiment is not shared by management.

I can see you implementing unsafe heavily optimized data structures in rust"
34,Dall0o,1590655243.0,36.0,My humble guess is that TypeScript fix a lot of troubles js devs face like Rust fix a lot of troubles C++ devs face.
35,thiago2213,1590666333.0,9.0,"It is _my_ favorite at the moment for sure. I worked many years with C# and disliked JS so much. Once TS started gaining traction I put some effort into convincing my colleagues to migrate, now our legacy project is hybrid and new projects are TS only. I love it."
36,JB-from-ATL,1590694056.0,4.0,I toyed with Rust. I found it very enjoyable. Great tools and helpful documentation.
37,asmx85,1590654786.0,2.0,Rust – for sure – is an anomaly in every sense of the word.
38,Sokusan_123,1590689581.0,1.0,"I agree,

This graph should've been somewhat weighted in regards to # of responses imo, not just a raw percentage."
39,LegitGandalf,1590624708.0,6.0,"Just think about how much of the world runs on VBA now, terrifying really!"
40,milliams,1590655787.0,37.0,"The percentage of people who ""loved it"" is actually the percentage of ""people who use the language who loved it"". So in that 2019 survey 3.1% of respondents had used Rust and 83.5% *of that 3.1%* loved it.

This year 5.1% of respondents had used Rust and 86.1% of them love using it.

There's no artificial promotion here, just conspiracy theories."
41,coderstephen,1590693421.0,7.0,"I don't really understand this position myself. I use Rust weekly, and really enjoy it. Its my preferred language for many kinds of programs (not all). The language is well-designed and solves real-world problems. Why _wouldn't_ I suggest it to people? I always share languages and tools I come across to other people if they're useful; how is Rust any different?

Granted, I don't want to be pushy, and there are a few who definitely push it way too far. But on the other hand, I've also seen a lot of people who unfairly push back on _any_ discussion of Rust, labeling it as ""spam"" and ""fanboy noise"" just because they hate it so much. Both are equally unnecessary."
42,GYN-k4H-Q3z-75B,1590651417.0,9.0,"In system's programming, Rust competes with C and C++. Look how long it took C++ to take over. The only reason it did was complexity and even that still wasn't enough for many to switch from C. It's hard enough to find people who master C++ to work in such a field."
43,TrueTom,1590649690.0,28.0,It's the Haskell of this generation.
44,404_Identity,1590643943.0,12.0,[removed]
45,gaumutra_fan,1590650754.0,19.0,"This is only partly true. 

In 2019, 83.5% loved it but only 3.2% used it. In 2020, as the headline stated, it's 86.1% loved with 5.1% using. The % of people who love Rust has actually increased despite the total number of developers increasing. That’s pretty impressive growth for one year, on both metrics.

> artificially promote

All of these represent real world usage - Google (Fuschia, experimental branch on Chrome), Amazon (Firecracker), Facebook (Mercurial server), Dropbox (core sync engine), Mozilla (11% of Firefox). 

This is actually being used by companies to solve problems today."
46,LightShadow,1590686655.0,2.0,"Is it wrong that I like the idea of Rust, but I don't have enough time to dedicate learning to use it right?

I'm loving the tooling that's coming out of the rust community and leverage it heavily. (ripgrep, pyoxidizer, rust-csv)"
47,matthieum,1590684612.0,6.0,"If you're only used to OO the transition can be a tad difficult, indeed.

It seems that users with Modern C++ or JavaScript experience, where the traditional inheritance model isn't as used, have an easier time picking it up.

There are some books out there (like Rust in Action) that may help you getting used to the mindset by accompanying you in the implementation of larger-scale examples."
48,Kissaki0,1590702590.0,3.0,"Learning different programming paradigms can elevate how you can see and interpret things. It can be difficult to get familiar with different concepts of course, but peeking into OO, true functional (data flow and transformation), and rust borrowing can provide some interesting insights and perspective.

Where do you get lost? Is the concept of borrowing clear to you? The idea behind it?"
49,matthieum,1590685155.0,19.0,"It's the blank-page syndrome.

In many languages, you can just start by throwing plaster at the wall: it's ugly, some parts are not covered, but it lets you iterate.

In Rust, there are two obstacles to the strategy:

 - Ownership,
 - You.

One mistake that many Rust developers make is wanting to create an _optimized_ application from the get go. They still don't _quite_ know what they want, but they're already attempting to absolutely minimize the number of copies and borrowing left and right -- and crash into the wall.

The easiest way to start a program in Rust is to `.clone()` left and right. When you don't quite know where you're going, borrowing is a premature optimization which unnecessarily slows you down and impedes your progress.

Get a prototype rolling, even if it's got terrible performance. As you do, you'll gain experience on the problem and find yourself in a better position to see _how_ to more cleanly solve it.

Then it's time to refactor and introduce those borrows^1 . If it were C++, it would be a horrifying thought -- I know, I'm in the middle of such a refactoring -- but it's Rust: as long as you don't use `unsafe` the compiler will make sure that you're not wrecking stuff with your refactoring. So go ahead, address the `.clone()` that most annoys you, then the next, and little by little you'll get to the efficient piece of Rust code you wanted... and that nobody could have thought of out of nowhere.

^1 *Or start from scratch, if you realize you took a really wrong turn.*"
50,,1590669931.0,12.0,Once you have that bit of front loaded knowledge it’s fairly smooth sailing.
51,,1590826273.0,1.0,"IMO, this is a good point that’s similar to learning Haskell or functional programming in Scala with the Typelevel ecosystem: you’re basically acknowledging that as the codebase and/or team grows, the issues you can foresee facing warrant an up-front investment in their prevention, and that the compiler is the right place to prevent them.  The trade-off is exactly the flash-to-bang experience. And if you come from an ecosystem with a particularly good flash-to-bang experience, this can be hard to take at first, even if you’re already looking forward to the later benefits."
52,,1590676449.0,13.0,"86.1% of the 5.1% using it.

Last year it was already at 3.2% using with 83.5% loving it.

It's growing and getting more loved. But yes, growth is slow. Systems programming isn't a field that changes fast and rust is on the steeper side of learning curves."
53,,1590669764.0,9.0,"Also 86% of the 100% that use it, love it."
54,sex-fluids,1590643766.0,7.0,"How did you shoot yourself in the foot? I think I haven't managed to yet, but I might just not realize it yet."
55,,1590669667.0,2.0,"This post probably isn’t serving you well. It sounds like you were lazy and just gave up. 

I originally replied with a different tone but decided to point this out to you rather than assume you knew."
56,,1590669798.0,8.0,Based on what?
57,coderstephen,1590688689.0,3.0,"I love coding in it, most of the time. Better than most other languages I've used. I recommend trying it so that you can develop a solid opinion."
58,_demilich,1590675551.0,1.0,Why don't you try it? ;)
59,lelanthran,1590751252.0,3.0,"For all practical purposes, it's single platform?"
60,,1590713368.0,6.0,So many people complaining about OOP here. Am I the only one not that much into OO andore functional style that really likes the trait approach? 🤷‍♀️
61,wrongerontheinternet,1590677777.0,8.0,"Which is lower than the percentage of developers in every other surveyed programming language, so... uh... huh?  It's not like Rust is anywhere close to the most obscure programming language on Stackoverflow, why aren't those more obscure ones doing better?"
62,,1590670038.0,4.0,"Jesus, fanbois be hatin yo!"
63,Kissaki0,1590702955.0,3.0,"> Rust Vulnerability Statistics

> 2018 3, 2019 3"
64,CryZe92,1590697996.0,7.0,"Nice attempt at impersonation, lmao"
65,,1590669956.0,3.0,What’s its trick?
66,,1590637037.0,7.0,[deleted]
67,,1590634688.0,33.0,[deleted]
68,beefsack,1590629496.0,30.0,"It's being picked up very quickly - in the 2019 survey Rust had been used by [3.2% of respondents](https://insights.stackoverflow.com/survey/2019#technology-_-programming-scripting-and-markup-languages) but this year it had [grown to 5.1%](https://insights.stackoverflow.com/survey/2020#technology-programming-scripting-and-markup-languages-all-respondents).

Last year it had less than half the usage of Swift, but this year it's within 13% of it.

It powers a lot of tools that people depend on every day, from core components of large systems, to the search function inside VS Code. It's not really a small language that nobody uses anymore."
69,lanzaio,1590634096.0,25.0,"> Rust is the kind of language that you wouldn't even want to approach unless you were buying what it is selling, so you won't get very many dislikers since the dislikers will just never bother to become proficient in it.

This is the main cause. Nobody uses Rust that wasn't self motivated to learn Rust out of their own interests. In fact, those that I do know that were forced into Rust showed a relatively standard ratio of like/dislike that I see from most languages."
70,matthieum,1590683808.0,4.0,"> Rust isn't used in many production environments, so very few people are forced to use it. As Bjarne put it, ""There are only two kinds of languages: the ones people complain about and the ones nobody uses.""
>
> Rust is the kind of language that you wouldn't even want to approach unless you were buying what it is selling, so you won't get very many dislikers since the dislikers will just never bother to become proficient in it.

In short: selection bias.

The only people answering they've used Rust are those who still use Rust and like it, hence the top score.

Those who tried it and didn't like it abandoned early enough that they do  not think to answer ""I used Rust"", and thus do not pull down the score.

Despite this, though, that's still a surprisingly high number of users who adopted the language given its relative immaturity!"
71,coderstephen,1590688154.0,4.0,"Usage of Rust in production is increasing though. Besides, Rome wasn't built in a day; _no_ language can accelerate to top production usage quickly regardless of how good it is. This is _especially_ true in the sort of industries that are also known for using C++, which tend to be more slow-moving."
72,quicknir,1590727387.0,5.0,"Matches my experience as well. I was pretty shocked to discover the Rust duration type is a) positive only, and b) a two field, 96 bit, seconds and nanos approach. When I went to a rust chat to discuss it, and I mentioned that such an approach were too slow in HFT (high frequency trading), a *moderator* told me that making code unusable for HFT was a feature (and got some kind of positive emoticon). There wasn't any real technical discussion, and it was just an unpleasant experience."
73,MadRedHatter,1590632124.0,31.0,">but when the Rust language fails to handle a case well, the Rust community tends to blame the coder for wanting to do the wrong thing, rather than the language for not being able to handle it. In cases where other language users would say, ""oh for fucks sake, this is stupid"", the Rust community tends to say ""That's bad form, you should rearchitect."" If you're outside the community, it can look a bit rose-tinted-glasses.

Often the architecture that Rust pushes you towards is *legitimately* the better architecture though.  This talk explains it well.

https://www.youtube.com/watch?v=P9u8x13W7UE

There are certain pathalogical cases like graph data structures that you will struggle with in Rust compared to a GC'd language though."
74,SkiFire13,1590663560.0,8.0,"> the Rust community tends to blame ...

You're identifying all the rust community with just a part of it. That's also the part that tries to sell Rust as the definitive language without bugs. But in the rust community there's also people that will honestly tell you when rust is good and when is bad. 

Ps: Part of the C/C++ community is not that great either. Blame rust for not being able to handle certain cases, blame java for having a GC but blame the developer when there's a memory safety bug in C/C++ code"
75,Kache,1590626772.0,7.0,"For a young language that's already got a solid community and popularity, I'd say that's the right way to go.

Worse would be a language that needs to ""buy"" popularity by acquiescing and starting the path towards feature bloat and other language design issues.

If Rust can ride on its innate popularity and grow while staying ""not a language you're forced to use"", it can grow in a well-directed and designed manner and even make breaking changes if necessary without splitting the community."
76,,1590663166.0,8.0,[deleted]
77,PrancingPeach,1593065888.0,1.0,"Production/industry usage is nearly doubling each year, which is incredible for a language this young that didn't have massive backing by Google/Apple. I think it's going to eat the software industry in the next 10 years."
78,camelCaseIsWebScale,1590678390.0,1.0,This is what happens when an overambitious community shoehorns a well designed systems language into applications domain and hype it as a silver bullet.
79,thiago2213,1590665049.0,1.0,You make some compelling arguments
80,,1590667365.0,-3.0,"> if you're used to a foot-gun language like JS or Ruby

On what planet are they a foot-gun language?"
81,kankyo,1590648686.0,11.0,The size of the community often predicts pretty accurately the toxicity. There are outliers of course (elm I'm looking at you) but it's a good rule of thumb. Python is just so damn big. It's the same in Java online communities for the same reason.
82,butt_fun,1590637025.0,19.0,"I don't disagree with anything, but your experience with the python community surprises me. It's been a while but I remember mostly good things about it"
83,,1590658126.0,5.0,"This is what you can expect at this stage of the lifecycle. The Rust community is still fairly small and full of enthusiasts. Also, there's not a ton of industry experience and documentation of it (compared with Java or Python at least), so everyone needs to rely more on the community instead of telling you to RTFM."
84,username-is-mistaken,1590643694.0,16.0,[deleted]
85,0rac1e,1590718074.0,4.0,"This fuckin' guy again. When this account gets suspended too, are you gonna come back as `GayAnalMan3`?"
86,0xC1A,1590668617.0,-13.0,Like being 10x uglier and 20x harder to learn?
87,the_game_turns_9,1590626482.0,14.0,"`On Error Resume Next`

haven't used it in 15 years and its still burned into my skull"
88,Malgidus,1590625059.0,10.0,I ... I have to put it into production in industrial control systems for critical infrastructure.
89,Shnorkylutyun,1590693013.0,2.0,A terrifying number of hedgefunds are apparently supported by VBA + Excel sheets.
90,JB-from-ATL,1590694344.0,6.0,"And the relevant quote from SO is

> % of developers who are developing with the language or technology and have expressed interest in continuing to develop with it"
