,username,comment_created_utc,comment_score,comment_text
88,,1590763380.0,1.0,"Honestly, I should have said earlier that I thought you were right about Rust string handling, and I should have indicated that my Python comment was more of a joke than anything else.

I mean, it *is* crazy to me that people are still combining all options (when `.format` is supposed to be the way to do it now) and still arguing about % formatting, but you're totally right about the different ways to convert in Rust being a little overwhelming and not very well explained.

I appreciate the detailed response, too - I do actually 'struggle' with deciding which method to use right now, so it's helpful to know I'm not alone *and* to see some real differences. Thanks a lot for linking to the source for `str` and showing that unchecked conversion - I actually had no idea there would be a difference!"
89,KeepGettingBannedSMH,1590665741.0,5.0,"Exactly. The opposite of ""love"" isn't ""dread"", it's ""not love"". A language that barely anyone uses won't be particularly loved or dreaded."
90,notquiteaplant,1590647959.0,2.0,"I meant to reply to /u/bollop_bollop, whoops"
91,OS6aDohpegavod4,1590671420.0,1.0,"I see, thanks!"
92,asmx85,1590675082.0,1.0,"A generational GC to resolve circles, yes"
93,asmx85,1590680239.0,2.0,I don't see a problem here. That is the way science works. Mostly things are discovered on their own without knowing its greater classification. The first Mammal wasn't classified a Mammal. It was after a group of similar animals was retroactively classified into a greater group called Mammals. So you discover RC before knowing its classified under GC.
94,zzzzYUPYUPphlumph,1590681102.0,1.0,"Is it ""Generational""? I've never heard that. Is that new?"
95,zzzzYUPYUPphlumph,1590681021.0,1.0,"No, I don't see a problem either with the retroactive classification (well, kinda, I'm not convinced that Reference Counting and mark-and-sweep GC really have much in common to call them both ""Garbage Collection""), I was pointing out in reference to this:

&#x200B;

>And before Swift i haven't really heard of many people not attributing RC as a form of GC.

I had never heard of RC being called GC until GC (meaning mark-and-sweep, compacting, GC) was ubiquitous. In other words, depending on your horizon for the history of these things, there is a very different perception.

&#x200B;

>think no one would argue that Python IS NOT a GC'ed language dispite using RC.

I kinda would. Like I said, I'm not convinced they should be thought of as the same thing. There are GC'd languages (languages that defer freeing memory until the Garbage Man gets around to noticing you are done with it), and there are RC languages (where and auditor follows the use of the thing around and keeps a tally of each user, and when the last user says they're done with it, the auditor throws it in the trash can immediately), and there are manual memory management languages, where, you have to keep track yourself of who currently owns the thing and who is just borrowing/using it temporarily both concurrently and exclusively by the nature of your process and then you must have a step in your process where you ""know"" it's time to throw it away, and you do so immediately, and now, we have (with Rust) ownership/borrowing automatic tracking, where you the programmer don't have to figure out for yourself when it is the correct point to throw the item in the trash can, instead, the compiler will figure it out, and will throw it in the trash at the correct time in your process. These are 4 completely different methodologies in my mind, and to equate Rc and GC would be equivalent to equating manual memory management (like in C) and automatic ownership/borrow tracking (like in Rust)."
96,HenkPoley,1590742588.0,1.0,"https://en.wikipedia.org/wiki/Tracing_garbage_collection#Generational_GC_(ephemeral_GC)

Basically after you've looked at an object a couple of times, and found it in use, you chuck it in a category of 'probably still in use', that you revisit less often.

It is [not new](https://scholar.google.com/scholar?as_sdt=0%2C5&as_yhi=1994&q=generational+garbage+collection&btnG=). It was [first described in 1983](https://dl.acm.org/doi/10.1145/358141.358147)."
97,asmx85,1590682494.0,1.0,"That is very interesting! I can only recall from my times at university (not so long ago) and it was always referred at such. In papers, in books etc. Even [the best source ever](https://en.wikipedia.org/wiki/Garbage_collection_(computer_science)) (wikipedia :P)  is using it in that way. CPython is also listed as an example. Even the [Python docs](https://devguide.python.org/garbage_collector/) are using the term Garbage Collection.

Times must have changed drastically. Its very interesting how the perception over the times changes – sorry for being a bit ignorant, but that's the information I've been grown up with and i don't want to be disrespectful."
98,zzzzYUPYUPphlumph,1590753077.0,2.0,"Yes, I know what generational garbage collection is, I was asking if Python used generational collection. I had not previously heard that. 

I checked, and yes, Python uses a ""Cycle Detector"" that checks for reference cycles that are preventing objects from being deallocated. Any object found not to be in a cycle, but, still referenced (when the ""Cycle Detector"" runs) is moved to another ""Generation"" so that it isn't checked as often."
99,zzzzYUPYUPphlumph,1590684715.0,2.0,"

No disrespect was taken or perceived by you from me. I completely understand where you are coming from, but, I like to elaborate on these things, especially on something like Reddit, because I think it is funny how things are often couched as historical ""fact"", but, the ""facts"" have a way of changing drastically to the point where everyone forgets the actual ""history"" (re: your mention of Wikipedia). It's one of the reasons I don't consider ""history"" anything but a hobby. There is nothing ""factual"" about it. It is completely fluid.

EDIT: I'm guessing everything for here on will be considerd ""Off-Topic"". I kind of got on trying to make a point about ""History"", but, it was a ""Stream of Consciousness"" sort of thing. If anyone objects, I will edit to remove it.

For example, I attended Kent State University in the early '90's AFTER I got out of the Army. If you don't know, KSU was the site of one of the most infamous conflicts between ""authorities"" and ""protesters"" in the '70's where multiple people were killed when the Ohio National Guard opened fire on ""protesters"" when someone panicked. Worse yet, most of those killed or injured, weren't even protesters, but, students and faculty going about their business who just got caught in the ""cross-fire"". It was a terrible thing.

In the '90's, while at KSU, I met a man who was an ex-WWII vet, who at the time of the ""KSU Massacre"" (as it came to be known), was on the Campus Police. He was the person who was on the mega-phone reading the ""Riot Act"". In case you don't know, the ""Riot Act"" is kind of like the ""Miranda Warning"". It is a legal statement letting the crowd know that they are engaging in illegal behavior (there was breaking of windows, burning of businesses, vandalism, etc. going on. Not ALL were engaged in this, but, some were). The ""Riot Act"" is letting all those present know, that because there is too much illegal behavior happening, that the crowd is REQUIRED, under the law, to cease and desist and vacate the area so that law enforcement is able to enforce the law. (NOTE: If you ever hear the ""Riot Act"" being read over a megaphone, unless you want to be engaging in illegal behavior, leave the scene ""immediatly"" - for your own safety). It is ""Illegal"" in itself to not vacate once the ""Riot Act"" has been read. Make no mistake, at that point, your are breaking the law. And it is a felony, punishable by real time in jail and extensive fines.

Anyway, I digress, the point I was trying to get to, is this guy, who was there, who was an honest, upstanding guy, though he sincerely regretted the loss of life that day, had clear facts (including pictures and his own memories) showing that what happened that day was caused by an out-of-control crowd of protesters who were throwing rocks, breaking things, conducting vandalism, etc. They, and all those present, including those NOT involved in the protests, were given ample warning (not minutes, over the course of hours), to cease and desist and allow law enforcement to enforce the law. No one there that day, protester or not, was not aware of what was going on and the fact they were told to leave the area or face arrest. It was a volatile, dangerous situation that was working toward an escalation of violence by the protesters. Now, no one knows for sure exactly how the shooting started. Did some National Guardsmen panic? Probably. Did one get pissed off because he got hit by a bottle or rock? Maybe more probably, but, definitely possible. Did someone in charge order them to shoot? That has been examined and debated and never conclusively shown or completely ruled out, but, Harold, who was there, and had a good vantage of what took place, because he was in an elevated position with a megaphone reading the ""Riot Act"" and telling the crowd to disperse, did not see any evidence of that occurring (but, that, in itself is not evidence being that absence of evidence is not evidence of absence).

So, in all of the ""History"" I've scene, there is little to no mention of this man (except as ""the [evil] guy on the megaphone"",) this honest man who served his country and served the University, who up until he died, felt terrible about what happened that day even though he did everything right.

How do I know he isn't a liar? Because I spent extensive time with him. I was in my 20's and I had a daughter. My father was already dead, so my daughter had no grandfather, but, he took up that role after I got to know him and his family. When he talked about that day, he was haunted by what occurred (not by what he did, but, by what happened despite the warnings). Even moreso than what he saw in WWII in some ways. When you talk to someone in depth about something, and their story is completely consistent, and you see in their eyes, their body languages, everything, the total lack of holding anything back, you know it's true.

The thing about protests to remember is that not all the protesters are there for positive change. In fact, there are almost always foreign agents AND SOMETIMES DOMESTIC AGENTS WHICH IS WORSE YET, who are there specifically to foment things and attempt to drive this sort of outcome either to embarrass the authorities and undermine trust in them (foreign agents), irrespective of the cause, or to undermine the actual protesters and make them look bad in the eyes of the public (domestic agents like FBI, CIA, NSA, Delta Force/Special Forces, etc). If, as a protester, you don't keep that fact in mind, and keep yourself doing legal things (including honoring the ""Riot Act"" and dispersing when you are told), you are endangering yourself as well as others AND you are helping either foreign agents to undermine our democracy OR you are helping anti-democratic domestic agents to undermine your cause and perhaps even the fabric of our free society. In other words, not honoring the ""Riot Act"" isn't brave or ""fighting for a cause"", it is just stupid and playing into the hands of one or more enemies.

Regarding my comment about foreign and domestic agents: How do I know that is true? Because I has associations with members of Special Forces when I was in the Army who were VERY candid with me about things they and their cohorts had been tasked with, that in retrospect, they highly regretted and were ashamed of."
