,username,comment_created_utc,comment_score,comment_text
0,jrop2,1590606753.0,182.0,"It's hard not to love Rust: I actually started from that position.  My buddy told me about it some years back, and I tried it around 4 times, dismissing it each iteration before it actually began to stick.  Now, the more I use it, I still have some frustrating days, but I pull my hair out less and less.  Even more, whenever I imagine ""language utopia"", I can't really imagine much better.  I'm not saying there's no room for improvement, but man, Rust is really nice right now."
1,matthieum,1590604580.0,267.0,"Reminder: Most loved _amongst its users_. It's generally easier to achieve for smaller language...

... and with that said, 5 years in a row! :D"
2,flay-otters,1590613682.0,52.0,"Rust is an awesome, awesome language that faces a very difficult road ahead in gaining critical momentum. It solves problems that are not easy to solve and are not easy to get right on the first attempt. Please make sure you vote every year in this survey as it brings some much needed press-oxygen to the ecosystem."
3,LoyalDingo21,1590607208.0,223.0,Who has the biggest circle jerk?  We do!
4,Voultapher,1590647915.0,31.0,"- 2015: 73.8% 3rd place - 3.8% diff to top Swift
- 2016: 79.1% 1st place - 7.0% diff to 2nd place Swift
- 2017: 73.1% 1st place - 6.1% diff to 2nd place Smalltalk
- 2018: 78.9% 1st place - 3.8% diff to 2nd place Kotlin
- 2019: 83.5% 1st place - 10.4% diff to 2nd place Python
- 2020: 86.1% 1st place - 19.0% diff to 2nd place Typescript

Looks pretty good, others come and go, but Rust remains at the top. The gap even seems to be growing. One curious note, I didn't remember from back then. In 2015 C++11 had 75.6% and was in 2nd place."
5,,1590644921.0,21.0,other 13.9 are still stuck in borrow checker :D
6,code-n-coffee,1590604557.0,24.0,Five years in a row!
7,UARTman,1590648539.0,10.0,"I'm in high school and Rust is a second language I fully committed myself to. Sure, I can code in CPP a little and can write some C# code, but Rust is for me far more friendly. It has a steep learning curve at first, but becomes friendlier and friendlier as you become more familiar. Also, you can find online books on any big part of Rust - this is very helpful"
8,IshKebab,1590611098.0,25.0,"> frustrations with duplicate question handling

At last! They heard us!

Also some suggestions for the survey next year if anyone from SO is reading:

1. The company size survey would be better if the scale were fully logarithmic.
2. Instead of asking ""which of these technologies do you love the most""? You should as ""which of these technologies are you familiar with enough to rank"", and then out of those ""rank those technologies in order of you much you love/hate/want to use them"". There may be a language that is absolutely loved above all other languages by its 10 users and we would never know it."
9,norman784,1590609979.0,31.0,"It’s hard no to love it, the language itself it’s ok (nothing too extraordinary) but with the official tooling together is amazing, it’s pretty impressive how developers without several years of experience with the language, low level memory management, etc can write correct (it’s this the word for correctness?), performant and fast programs.

It resembles a lot that you can write easily code in a text editor and get good hints from the compiler, while others give cryptic errors or requires you to install a lot of third party tooling to have the same result, i.e. for C you need the compiler, then some other tools to analyze your code (I believe that those do static analysis or something like that), etc (I’m not C dev so I’m not aware of all the tooling you need to write apps that doesn’t shoot you in your face as a novice developer), or js/ts where you need to install a lot of stuff, configure a lot of tools, etc just to get some similar result.

I just read a lot this last year how apps became slower and slower with all the abstractions, slow languages, etc then rust appears (there are some people that still criticize it because it force you to write a correct app and not give you room to just prototype quickly, that’s might be true, but IMHO it’s just the lack of experience and bad habits you learned all those years) and bring the power of a system programming language to the mere mortals."
10,_TheBatzOne_,1590648022.0,6.0,"I came from Java/Kotlin and Python to Rust, it was really hard to get into it but now I love it so much. I am even starting to be a fanatic and try to put it everywhere"
11,swoleherb,1590664759.0,2.0,"reminds me of this comment

https://old.reddit.com/r/programming/comments/g5v1a3/programming_language_rusts_adoption_problem/fo5scgi/"
12,,1590675411.0,1.0,of course :)
13,rlamarr,1590681949.0,1.0,"Percentages everyone, Percentages."
14,Spartan-S63,1590622450.0,29.0,"This is sort of my story, too. My early missteps were a combination of a fast-moving v0.10 of Rust (circa 2014) and trying to translate C++ idioms and thinking to Rust. When I put that aside and learned it as a new language, things started clicking.

I also have my frustrating days with it, but in general, it's the tool I always want to reach for."
15,nagarjunp,1590652218.0,10.0,"I tried learning Go at least 4 times and kept dismissing it. On the other hand, I instantly ""got"" Rust. It just made sense to me. it really is a beautiful language."
16,,1590624299.0,23.0,[deleted]
17,techbro352342,1590974151.0,3.0,I tried rust about 2 years ago and I found it way too complex and I was struggling with even basic programs. I tried it again this weekend and I found it trivial and I was able to build a semi complex program interacting with SPI on the raspberry pi. I'm not sure if the language and error messages just got a lot simpler of if I just got better at programming but I went from not wanting to use it to absolutely loving it.
18,ectonDev,1590611901.0,139.0,"The other metric is to look at the 2019 report and the 2020 report and compare % of people who are using it. In 2019, [83.5% loved it](https://insights.stackoverflow.com/survey/2019#technology-_-most-loved-dreaded-and-wanted-languages) but only [3.2% used it](https://insights.stackoverflow.com/survey/2019#technology-_-programming-scripting-and-markup-languages). In 2020, as the headline stated, it's [86.1% loved](https://insights.stackoverflow.com/survey/2020#technology-most-loved-dreaded-and-wanted-languages-loved) with [5.1% using](https://insights.stackoverflow.com/survey/2020#technology-programming-scripting-and-markup-languages-all-respondents). Not only did Rust gain love over the last year, it did it while growing its userbase.

That to me is impressive, although not surprising (as a fairly recent adopter myself)."
19,godlikeplayer2,1590671741.0,7.0,"well, hate for a language usually starts when people HAVE to use it at work or to get a job. Rust is still too small for that effect."
20,Asyx,1590650969.0,21.0,"I hope it stays like this. A bit more each year. Look at the popularity of other languages (at least in web). They all got popular with hype. Once that hype died, the language died as well (kinda).

Except python. Slow and steady. Always getting more and more popular. I hope it doesn't take Rust 20 more years to get as mainstream as python but I also hope that we won't get that hype framework that will be popular for a few years just for Rust to join Ruby in the bucket of useless languages.

But I'm very optimistic. In the last few years we've seen some small but successful and professional game developers voice their positive opinion on Rust and, at least on Reddit, the embedded community were also optimistic for Rust in the future. I think you can also use Rust on the Linux kernel if there's a good reason to do so, Microsoft is also doing something with Rust I think.

In my opinion, the future looks pretty bright."
21,timClicks,1590659981.0,2.0,"What would be considered success? It already seems like it has reached a critical mass, imo"
22,rebootyourbrainstem,1590607295.0,98.0,-> /r/rustjerk
23,wishthane,1590608689.0,84.0,Upcrabs to the left
24,the-lord-empire,1590651900.0,2.0,"Can't be made fun by pcj if we do that to ourselves :D 

r/rustjerk ftw"
25,WormRabbit,1590680398.0,5.0,Smalltalk? That's weird. Why would Smalltalk suddenly get so much love in 2017?
26,matthieum,1590686074.0,2.0,"It's also interesting to see the growth in number of users among respondents:

 - 2019 was 83.5% of 3% of respondents.
 - 2020 is 86.1% of 5% of respondents.

The proportion of users doubled and _yet_ the number of users who love Rust still climbed."
27,ferruix,1590689599.0,4.0,"Importantly, Rust also makes you a better programmer by forcing you to be explicit about ownership details that experienced C/C++ developers learned to hold in their heads.

So you can learn those concepts without going through a huge morass of debugging, and they'll transfer to every future language you learn too: even to GC'd languages like JS where programmers have to know to avoid leaking."
28,rforrevenge,1590615153.0,3.0,"What do you mean by ""if the scale were fully logarithmic""?"
29,Quixotic_Fool,1590621505.0,44.0,"> nothing too extraordinary

I'm not a Rust zealot by any means, but it is state of the art in some ways. It's the only production language which is GC free that guarantees no data races, no use after free, no invalid memory accesses, etc. whilst maintaining a high level of expressiveness.

Imo even though there are warts in it, it's an extraordinary language. Not many languages can claim as much."
30,adante111,1590625070.0,9.0,"I dunno, I consider both language and tooling quite extraordinary"
31,stojakovicn,1590663252.0,6.0,"I understand that some people love Go's minimalism, but I always felt so limited writing it."
32,steadylearner_p,1590713307.0,1.0,It is difficult to motivate you learn other languages after you know Rust and its benefits.
33,Moxinilian,1590671083.0,11.0,"In my opinion, if you spend time figuring out which of the multiple ways to convert strings you want, then it means that you care about what it implies and it'll be the same issue in all languages. If you don't care, just take the first one with the types that work for you (`into` really just does the trick)."
34,epicwisdom,1590669298.0,6.0,"Those are pretty minor and honestly not much different from other languages. People used to Python will complain C-like syntax has too many curly braces, people used to C will complain Lisp has too many parents, etc. That kind of thing is mitigated by editor setup, too."
35,,1590700434.0,3.0,Figuring out which way to convert to a string isn’t nearly as bad as all the ways to format strings in Python
36,yerke1,1590626800.0,30.0,"It's also nice that Rust is 5th most wanted language ([https://insights.stackoverflow.com/survey/2020#technology-most-loved-dreaded-and-wanted-languages-wanted](https://insights.stackoverflow.com/survey/2020#technology-most-loved-dreaded-and-wanted-languages-wanted)) with 14.6% after Python, JS, Go, and TS."
37,matthieum,1590681793.0,1.0,"Yes.

I also think there's a selection bias effect: the few that tried Rust and abandoned may either not answer the survey or simply not mention they tried Rust there."
38,eypandabear,1590668149.0,3.0,"I don’t expect Rust to ever become “as mainstream” as Python, simply because Python has a higher “ceiling” to its user base."
39,matthieum,1590685968.0,6.0,"I think 2020 may be a pivotal year.

Nearly all of the high-viz tech companies (FAANG) have touched on Rust -- with Netflix being the exception -- which has attracted quite some attention in the past year or so.

With Microsoft publishing article after article about Rust, and a Rust branch for Chromium, I would expect growth to continue.

And I'm actually a bit worried. Exponential growth is hard to keep up with, so I hope the community will manage."
40,,1590610035.0,44.0,[deleted]
41,bollop_bollop,1590614435.0,8.0,What's upcrabs? (Can't leave you hanging)
42,HenkPoley,1590742126.0,1.0,"[Unsure](https://trends.google.com/trends/explore?date=2015-01-01%202020-04-30&q=%2Fm%2F070d2,%2Fm%2F06w16vz), maybe there was just a nostalgic article that coincided with their survey?"
43,UARTman,1590690247.0,1.0,Oh yes! Rust definitely made me think about stuff.
44,Spartan3123,1590932123.0,1.0,yea i feel that i will become a better c++ developer if i learn Rust first
45,IshKebab,1590651936.0,12.0,"It's like 0-5, 5-10, 10-50, 50-100, etc.

If company sizes are distributed smoothly when plotted logarithmically (they should be) then you would expect the 1...-5... bands to have more entries than the 5...-1... bands, because they are wider on a logarithmic scale. That means your results will always be zigzaggy and hard to interpret.

It should be 1-3, 3-10, 10-30, 30-100, etc. Because 10^0.5 is about 3."
46,matklad,1590657529.0,12.0,"I would be even more bold -- Rust seems to be the first significant advancement for programming languages in industry (I deliberately exclude research) since Java had proved that JIT and GC are viable options for relatively high-performance implementations. 

The only other contender I can think about is gradual typing, and I won't disagree with it being comparable to Rust's ownership and borrowing system in significance. But, personally, I discount its significance because, to me, it seems to be a work-around for languages which started as dynamically typed, and whose usage scaled well beyond the point where static types make more sense."
47,Mr_rm-rf,1590674039.0,1.0,"What does GC stand for?
Thanks in advance!"
48,zzzzYUPYUPphlumph,1590678644.0,1.0,"Just to clarify your point, and ensure their isn't misunderstanding or accusations of inflated claims by those who look for anything to pick apart, it is important to qualify the guarantees that Rust makes with the following:

&#x200B;

>it is state of the art in some ways. It's the only production language  which is GC free that guarantees no data races, no use after free, no  invalid memory accesses, etc. whilst maintaining a high level of  expressiveness

""and these guarantees hold provided that you have no incorrect use of ""unsafe"" anywhere in your code-base or its dependencies"". By ""incorrect"", we mean that all ""unsafe"" code is written so that, in conjunction with ""safe"" invariants upheld by the privacy barrier of the module containing the ""unsafe"" code, there is no possibility for that ""unsafe"" code to invoke ""Undefined Behavior"", and so it is ""Sound""."
49,OS6aDohpegavod4,1590635358.0,1.0,What about Ada?
50,The_Droide,1590636282.0,-5.0,Swift?
51,commo64dor,1590824670.0,1.0,I like both Go and Rust. Different approaches that make you a better programmer.
52,kimjoaoun,1590777948.0,2.0,"Yes, I'm going through this moment right now, it's hard to focus on learning Go after learning Rust... Sadly the last one is more demanded in the job market."
53,,1590708882.0,0.0,[deleted]
54,Keavon,1590649467.0,12.0,"And the *last* ""Most Dreaded"" language on the entire list.

Edit: Oh, that's because it is just the inverse list of ""Most Loved"" which is not particularly insightful. They should have actually asked which languages people most dread using on a daily basis."
55,jl2352,1590691606.0,4.0,"> With Microsoft publishing article after article about Rust, and a Rust branch for Chromium, I would expect growth to continue.
> 
> And I'm actually a bit worried.

I'm not as worried for the reasons you cited.

If you look at say Ruby. Ruby's growth is directly tied to Rails. Dart is directly tied to Flutter. When people stopped using Rails, Ruby went into decline. Same for Dart. Similar for PHP in that the industry has moved away from the PHP style of building websites.

Rust isn't popular because of one library or one app. It's popular because of what the language offers.

That said I worry the language is *too* different to get real traction."
56,timClicks,1590690060.0,2.0,Rust has been growing exponentially since 2013. Check out this post from Nov last year  https://tim.mcnamara.nz/post/188733729327/rust-2020-lets-embrace-the-eternal-september
57,aoeudhtns,1590610277.0,24.0,"> Most loved

> Hidden

Hmm."
58,_zenith,1590621699.0,6.0,The upvote button is an upwards facing crab in styled web format (mobile clients won't show it)
59,zzzzYUPYUPphlumph,1590679171.0,4.0,">Rust seems to be the first significant advancement for programming languages in industry

I could not agree with this more. I have been developing software for many industries for many years with many different languages. Not until Rust came along did I think I see anything different or extraordinary in any production languages I used. They all seemed to be one of:

  \* C/Pascal equivalent

  \* LISP equivalent

  \* Java equivalent (actually, I had used things that precede Java by almost 2 decades that had the notion of VM, bytecode, WORA, etc. - they were proprietary, but, they were actually much better than Java in many ways, so, Java to me, and all its follow on copy-cats, like C#, wasn't particularly interesting technology-wise, but, it was interesting because it was ""free"" (as in beer)).

  \* Bash/Zsh/Csh equivalent

Even Haskell and it's ilk just seems like a somewhat better LISP/Scheme (I know I'll never hear the end of that, but, it really is what I see when I look at it).

Rust, on the other hand, just seems like an entirely new way to approach programming that is at once familiar and extraordinarily novel in the best possible ways. It's not perfect, but, for me, it feels like such a breath of fresh air. I'm truly humbled and inspired by the effort and thoughtfulness that has gone into Rust, and I truly believe, that it, and/or its offspring will be the dominant future of software development."
60,desiringmachines,1590709974.0,5.0,I think the only reason you think this is that you frame it in terms of a 1-1 relationship between languages and the advancements. Plenty of big advancements entered the mainstream in the 20 years between Java and Rust. To name just one *huge* one: closure capturing anonymous functions. There's just no 1 language that can claim credit for bringing that mainstream.
61,zzzzYUPYUPphlumph,1590679351.0,2.0,">since Java had proved that JIT and GC are viable options for relatively high-performance implementations.

I would disagree with this in the sense that this was proved long before that. I used proprietary languages, that were even better languages, that had byte-code, JIT, GC, etc. that ""proved"" out all of this. Now, not that Java didn't make advancements in the state-of-the-art, but, not initially. Not even close. Initially it was fairly ho-hum and the only thing it really had going for it was it was ""free"" (as in beer) instead of being thousands of dollars per year per seat (of end-use, not developer)."
62,sprudelel,1590674538.0,3.0,**G**arbage **C**ollection. Letting the program track what memory is no longer used anywhere and cleaning it up automatically.
63,meteorMatador,1590637438.0,10.0,"It's trivial to break things by accident in Ada. It's certainly better than C, but it doesn't have Rust's guarantees of memory safety.

SPARK makes Ada's safety guarantees much more powerful but it still isn't a silver bullet. Apparently it's easy to make a mistake with your assertions that will send the compiler into infinite loops. There's a project underway to build a Rust-like borrow checker for use in SPARK; maybe that will be easier to use than the way it works today. (Disclaimer: I haven't personally used SPARK.)"
64,drawtree,1590641936.0,4.0,"It’s up to you whether to see RC as a form of GC or not. Anyway Swift RC is mandatory to make safe reference type, and is certainly not zero cost.

Lack of unique ownership means lack of data race prevention and many more.

Though Swift devs once have promised unique ownership, it’s still a vaporware for several years together with async-await and actor model."
65,steadylearner_p,1590780018.0,2.0,"Lucky you, where do you find jobs?"
66,,1590719798.0,2.0,"Also % formatting, f-strings (which admittedly are a short-hand for `.format`), `Template`s.. Yeah, in general it should probably just be `.format` (or f-strings unless inline variables make the template string too hard to read), but...Then there's the specific debate on whether log functions should use % formatting or `.format`ted strings, and that's still an active debate from what I've seen."
67,,1590653443.0,9.0,[deleted]
68,nicoburns,1590713452.0,1.0,"Agreed, except that the PHP ecosystem is better than it's ever been, and still growing."
69,matthieum,1590690842.0,3.0,"I know, and _until now_ it's worked pretty well.

The challenge with exponential growth, though, is that ""next year"" is always the biggest growth seen so far.

r/rust just reached 100k, if its exponential growth continues it'll get 100k new users in a year. That's a challenge for moderators :)"
70,crabbytag,1590613166.0,21.0,"Most loved among the people who use it though, which was only 5% of respondents. So somewhat hidden, still."
71,ellenkult,1590657346.0,2.0,Like a cult
72,notquiteaplant,1590647364.0,9.0,"Not much, what's up with you?"
73,matklad,1590735482.0,2.0,"Interesting! I indeed missed the whole OOP -> FP idiom shift in my thinking, which, with its many small advancements, does make today’s code look significantly differently. Though to me this seems more of a change in how we program, rather than a change in languages we use. We did have closures in JS and Python for a long time, and anonymous classes in Java as well, we now just use them more often. 

In other words, we did have a plenty of incremental improvements, and they do add up to a significant total advancement, but the amount of breakthroughs is small.

One breakthrough that I definitely missed though is async await."
74,oconnor663,1591374319.0,1.0,I'm super curious what those proprietary languages were.
75,Mr_rm-rf,1590674712.0,1.0,"Oh, haha how did I not realize that? Thanks!"
76,OS6aDohpegavod4,1590655449.0,1.0,I'm confused - it doesn't have Rust's guarantees of memory safety but it is memory safe and it has more powerful guarantees than Rust?
77,asmx85,1590658004.0,2.0,"> It’s up to you whether to see RC as a form of GC or not.

In Computer Science it is mostly attributed to be of form of GC. And before Swift i haven't really heard of many people not attributing RC as a form of GC. I think no one would argue that Python IS NOT a GC'ed language dispite using RC."
78,The_Droide,1590661068.0,1.0,"Swift is not RC-only. In fact, it promotes value types (structs) over refcounted types (classes) and even provides Rust-style pass-by-reference of value types (inout arguments)."
79,,1590729580.0,1.0,[deleted]
80,Keavon,1590653889.0,11.0,"~~The description for both seem to imply they are different survey prompts.~~

Edit: I checked again and I had remembered incorrectly, the ""dreaded"" prompt is the same as the ""loved"" prompt with the word ""not"" added. Thanks /u/chandrog"
81,timClicks,1590695140.0,2.0,"Yes, it's a huge risk. Volunteer burnout becomes very likely.

One thing that happens when the community doubles every 18 mo is half of the community has less than 18 months' of Rust experience. When managed well, this is an excellent outcome. More time is invested on resources for newer programmers, spending up the learning process for every future Rust developer.

But poorly managed growth can create a vicious cycle. More people asking questions with a small number of people answering them."
82,aoeudhtns,1590613994.0,3.0,"Shh, let me have this! ;)"
83,_zenith,1590647811.0,2.0,"Sadly, my username isn't upcrabs

(edit: seriously, downvotes for this? wtf. it was a joke, playing off what's up earlier up)"
84,meteorMatador,1590671058.0,7.0,"Hold on, let me clarify. Vanilla Ada does not have memory safety guarantees. SPARK is an optional compile-time assertion framework that statically analyzes your program in excruciating detail. A SPARK program is able to provide much more powerful guarantees than a vanilla Ada program,  but only with a lot of effort from the programmer, and it still doesn’t guarantee memory safety.

It’s kind of like working with formal verification in C. It’s possible to have a memory safe C program, after all."
85,drawtree,1590674189.0,2.0,"I've been thought Python detects cycles by running a separated tracing GC, isn't it?"
86,zzzzYUPYUPphlumph,1590679862.0,2.0,"Reference Counting, was never called ""Garbage Collection"" before GC became ubiquitous that I can recall. It was only retroactively classified as GC, mostly for purposes of being able to say, ""Yes, my language of choice has GC too!"" At least that's the way I remember it. Perhaps, there is some literature that would contradict this, but, I'm not aware of it."
87,RosaDidNothingWrong,1590750901.0,1.0,"All of your string conversion examples compile to the exact same assembly: [https://rust.godbolt.org/z/E6tdLb](https://rust.godbolt.org/z/E6tdLb). The difference is only in the semantics.

As for writing out a string, just use the `write!` macro.

The difference between `as_*` and `into_*` is one you'll find everywhere. `into_*` copies takes ownership. `as_*` is a copy-less conversion, in this case it returns a slice (NOT an array) to the bytes and doesn't take ownership. Prefer `as_*`. Use `into_*` when you need ownership of something.

It doesn't make sense to talk about `as_string` because `String`s by definition has ownership of its data. You will see `as_str` because `Str` don't have ownership."
