,username,comment_created_utc,comment_score,comment_text
139,Cere4l,1554902003.0,9.0,"I find linux' multi screen so much better than windows the conclusion you make seems laughable. No experience with different DPI's but 0 problems with different resolutions EVER. And by far the most important reason I like linux more for this. If I open a program on the left screen... it opens on the left screen! The only exception being wine stuff sometimes. It also doesn't matter what you want, multiple taskbars, one taskbar, one screen turned everything is possible.

not much experience with laptops or docks. 

And powershell... fuck if I'm ever forced to use that for more than a small moment again I'm quitting that job."
140,nostril_extension,1554913552.0,4.0,"> Vendor support for windows is better therefore windows criticism is artificial.

ok man."
141,beomagi,1554898159.0,4.0,"Linux in a notebook is a little of a sore point yes. Try in a Chromebook chroot. My best notebook so far.

As a desktop I'm fine with windows. I cringe at servers. I appreciate the power of PowerShell, but in my work environment, certain services (think it was wmi) get into a weird state where PowerShell won't run at times. We ended up settling on rebooting our windows servers before pushing upgrades that relied on those scripts to minimIze that. We ended up installing Python and using that for some scripts instead."
142,Democrab,1554907893.0,2.0,"Another spot is TV Tuners/capture cards. That's not to say they simply don't work on Linux, but you're just going to have a much easier time of it than on Windows because of drivers alone."
143,aaronfranke,1554953839.0,2.0,"> multi-screen with different DPIs or different resolutions. Honestly multi-screen in general.

Wayland should improve this greatly IIRC."
144,grimmr33fer,1554898426.0,8.0,"I don't like the entire Windoze philosophy.

Contextual empiricism isn't worth a lump of coal and it is no science without a peer review.


All the biggest headaches in Windoze can be traced (to some degree) to their broken principles.




.....


It was Henry Ford that perfected the assembly line in such a manner that if Billy Joe Bob dropped his tool, the whole system didn't come crashing down.


Gates didn't pay attention."
145,fsdagvsrfedg,1554929684.0,1.0,Cough cough cough Active Directory cough cough cough
146,makhno,1554970438.0,1.0,"A small comment to your first point: I'm currently running 3x 1080p monitors and 1x 4k monitor in Debian, and it works like a charm."
147,GorrillaRibs,1555022100.0,1.0,"Well on a couple of these -

- Gnome w/ wayland fixed the first 2, at least for me - touch handling + gestures are great on my 2-in-1, and multi-DPI setups just work, with no setup required.

- I'm starting to love powershell now too! It's on linux now too, I think officially ported by MS - I'm not going to use it as my default shell for a while yet but for scripting it's fantastic"
148,anechoicmedia,1554927593.0,1.0,">2-in-1s are basically useless on linux

I have never seen a fellow human use or purchase a two-in-one.

Blessing/curse of Linux is that it supports what the people developing it want to use. This is why Linux will flawlessly support Thinkpads and obscure gaming peripherals and have no support for flagship Asus/Microsoft/etc products with novelty features that geeks aren't familiar with or interested in.

>I love powershell. Powershell is awesome. I've started recoding my shell scripts into powershell core, because awk/sed/data structure handling in linux is so ugly. I love doing text replacement or JSON structuring in powershell. In bash, it feels like I'm fighting the OS.

This is a pet complaint of mine, but this comparison is the wrong one to make.

Powershell is not analogous to Bash; It is analogous to Python. That's why it's got so many features, such rich data handling, and more verbose error messages than a nested C++ template. It is glaringly apparent from every design choice that Powershell was never intended for continuous, interactive human use; The ergonomics are terrible. Like Python, you can technically use it as a REPL, and maybe a ""shell"", but that's not the intended use of either.

Powershell is indeed a better system automation/data management language than Bash; Then again, so is almost any real programming language, most of which Linux already had first and best.

Bash is a user interface that happens to support automation, in the same way Microsoft Word supports macros. It may be technically possible to manage complex data state in Word macros but it's hardly a fair fight.

The ""Windows version"" of Bash is *nothing*; Windows has no first-class user-interactive terminal environment. Bash et al were the primary or only user environment for Unix systems for many years; This is why they're so darn comfy -- it's been refined to perfection to be what it is. After years of having no analogous power-user interface, Microsoft missed the point and named their automation tool ""Powershell"" implying that the point of a command line was to write scripts, as if the reason Unix people have opening a shell down to muscle memory was because they're constantly needing to touch-up their scripts at a moment's notice. It's not, go to /r/unixporn and watch the workflow fetishists play with their terminals and appreciate people experiencing joy interacting with a computer. Windows still has nothing like this and that's why it's an agonizing experience to use."
149,_Anarchon_,1554971107.0,3.0,The half of the people using windows in the poll were developers.  They know what an operating system is.
150,senatorpjt,1554943825.0,5.0,I don't understand how any professional developer can cheap out on their machine. Tradesmen make less money but they don't buy tools at Harbor Freight.
151,urban-_-hominid,1554910506.0,2.0,They might have the different gestures support on Chrome OS but what about the underlying touchpad drivers ? They have to be updated to be more faster and smoother.
152,urban-_-hominid,1554910300.0,1.0,"I don't understand. Is it that difficult? If they did it, so can we right!"
153,little_kiss,1554912728.0,1.0,Install crouton on your chromebook so that you can run both chromeOS and Ubuntu at the same time :)
154,ender_wiggum,1554924511.0,2.0,"Verily, the vast territories of GPU memory must indeed be compelled into service."
155,,1554985720.0,1.0,"I don't think there's this one thing I find completely unacceptable, but rather small things that add up, some that come to mind:

* windows line feeds
* dotfiles and compatibility of such dotfiles with unix tools... .vimrc is _vimrc and it's not hidden...
* the shell blows ass, I tried WSL and it's just not the same
* my ""IDE"" is vim and tmux, gvimrc just won't cut it and there's no tmux.
* package management is shit
* some random shit like the maximum amount of charaters in a path
* no unix-like permissions
* missing unix tools in general
* windows update

For me, the user experience is just bad."
156,thethrowaccount21,1554910895.0,11.0,With less bugs.
157,house_of_kunt,1554910933.0,27.0,A gain of 240 basis points and 10.3%
158,,1554904627.0,59.0,[deleted]
159,,1554909373.0,-6.0,[deleted]
160,bigmikemk,1554901432.0,48.0,"That's an entirely different number. You are referring to the ""Most Popular Platforms"". It includes Android, Wordpress, and Arduino. That seems to be the platform developers work on, not the system they are running on their desktop. The ""[Developers' Primary Operating Systems](https://insights.stackoverflow.com/survey/2018#technology-_-developers-primary-operating-systems)"" wasn't there in 2017 as it seems."
161,13531,1554900112.0,5.0,Might be due to WSL getting better.
162,Raknarg,1554907119.0,1.0,three points of data isn't statistically significant
163,will_work_for_twerk,1554934605.0,8.0,"Well, not only that but very often the number of linux users aren't enough to justify hiring additional support staff for the machines, and end users who use linux are an auditing and compliance black hole. This is the main reason why Mac OS is so popular with devs, its because its an option most enterprises can reasonably support and maintain."
164,peeonyou,1554955943.0,7.0,"I work in a place that is primarily macos and linux.  Every engineer has a linux desktop, and about 90% of the company has a macbook.

The techs we hire are primarily from Apple.

We've been pushing really hard to find linux desktop support people but it's worse than hunting for a needle in a haystack."
165,ceeant,1555054567.0,1.0,"Yep, that's my job."
166,Setepenre,1554958507.0,4.0,"does ssh-ing to a linux box using putty sound better ?
Because that's how Financial companies do it..."
167,SMM_Sockpuppet,1554943286.0,7.0,Windows is buggy! Who knew?
168,alcoholic_chipmunk,1554955235.0,3.0,"Honestly I kinda doubt viruses were the primary concern for IT. A multi-os environment is harder to streamline and the environment just got harder to standardize. All their PS scripts are now irrelevant, remote access might now be impossible without switching to different $oftware. Plus Mac and Linux guys are more expensive and harder to find entry level guys that know those systems. 

I would be more surprised if IT didn't freak out. They probably just happened to find out when installing the AV."
169,iSnortedAPencilOnce,1554967982.0,-1.0,"No, just don't make changes to your system that are against company policy. Organizations that are serious about security have air-tight policies for compliance, auditing, monitoring, security, DR, etc. If you isolate your machine from them, you become a giant security and liability risk. If you want Ubuntu instead of MacOS, you go through the proper internal processes to request that the policies are changed. If you decide that's not worth your while and do it yourself, all the places I've worked at would have you escorted out of the building by armed security on the spot."
170,LtWorf_,1554980645.0,2.0,"Yep, osx has that thing called ""a browser"" that doesn't exist on linux."
171,Ogg149,1554906607.0,9.0,"I'm running into this issue right now, in fact!  Fortunately my workplace IT sets up all the machines with dual-boot"
172,,1554905765.0,4.0,"\> If you're deploying to Linux you should be actively developing and testing your code on this platform lest you get bit by any weird platform specific issues not caught by using Windows.

That's correct, but Visual Studio doesn't have a Linux version (yet) and it's still the best IDE for .NET development. You could work with Visual Studio Code but you'll be lacking features."
173,,1554915432.0,5.0,"Switch to Docker. You can have Docker for Desktop running locally, use VS or VSCode to compose, this can also run all your tests inside the container. Finally deploy the tested container. Docker on Windows supports both Windows and Linux containers."
174,MDSExpro,1554910782.0,4.0,"Not sure if You should give advice, when you are mistaking ""developing"" and ""testing"", and missing testing all together in development process. Testing for Linux software should be done on Linux. Developing can be done on any platform."
175,postmodern,1554937506.0,2.0,"The excuse I hear from macOS-bound developers is that you can just run everything in Docker and let CI run the tests. Of course, Docker on macOS will eat all of your available disk space and CI is always slower than testing locally..."
176,yawkat,1554963636.0,2.0,"That really depends on what you're doing. For many applications, testing on windows or the linux subsystem is sufficient during development."
177,sadhorse_kaishain,1554907838.0,2.0,"Genuine question: is testing it on a Linux VM inside Windows not good enough?

Because that's what I'm using at work. I keep the code in a shared folder and do most of my work in the Linux VM but load it up in Visual Studio in Windows now and then to try testing for platform issues."
178,s_s,1554910424.0,1.0,"I mean, most things are going to be deployed in a Docker container, it really matter less than ever."
179,LuckyHedgehog,1554903286.0,1.0,"I haven't had any weird issues yet using the WSL + Docker, but I do dual boot to linux when i know the day ahead is going ot be pure dotnet core work so I root out any potential issues"
180,LuckyHedgehog,1554903191.0,2.0,"dotnet core is amazing, from my experience. I am one of those devs that is working with framework but starting to pull out parts of our products into dotnet core services and building new on core. Microsoft took full advantage of a fresh start here and knocked it out of the park. I am dual booting to linux now which gives me the best dev experience in both worlds

If you don't mind me asking, what in particular are you cautious about?"
181,yur_mom,1554910018.0,4.0,I am used to ash on busybox for embedded so it seems modern to me.
182,yur_mom,1554910510.0,1.0,"Also, I mostly use the shell to ssh into a dev server which is running Linux so I do not write many scripts directly on the Mac Bash."
183,yur_mom,1554908177.0,5.0,"I like both os equally and each has their pluses and minuses.  



The hardware on my linux desktop is from 2000 and my MacBook Pro is a 2018 with a i9 and 32 gig of ram.  The inferior hardware has nothing to do with the os.


My statement stands as is.  I also have an LG v40 phone so I am not an Apple fanboy by any means, but I like some of their products.  I do not see a need to choose one or the other.  Linux is not practical in all applications, but I have been using linux over 20 years and once thought every device I own must run Linux, yet that mentality is toxic and narrow minded."
184,yur_mom,1554912003.0,3.0,"Yeah, I would never do my Linux dev directly on the Mac.  I would either use the virtual os locally or ssh into a AWS server.  I program in vim so I am mobile.


Using AWS for dev has many advantages like you can quickly save build environment, create copies, backups, increase number of cpus or ram.  It is nice to have everyone dev on the same version of Linux also no matter what they choose for a native os."
185,zamN,1554934174.0,6.0,You aren't missing out on anything. WSL is still lacking a ton in terms of performance compared to just using the real thing.
186,,1554927745.0,-1.0,WSL supports GUI's out of the box.
187,BlackCow,1554927870.0,12.0,"Unix is more than a bash shell. I know windows is trying to catch up with Ubuntu compatability. It's been years since I've used windows though so I don't know what it's like now.

Honestly windows just feels icky to me and I can't imagine ever going back or wanting to pay for it."
188,LtWorf_,1554980836.0,1.0,Let me guess… js?
189,Zoenboen,1554948465.0,3.0,"Wow. Jesus no, that it's why they are on Stack Overflow. But I think everyone missed the point too."
190,,1554909019.0,5.0,[deleted]
191,Hohenheim_of_Shadow,1554913869.0,-1.0,Why would I want to spend the extra time and effort trying to make my relaxation activities work ~95% as well so that I have access to Linux dev-tools that I like natively instead of only semi-natively? WSL is a thirty second setup and for college level development it does all I use Linux for.
192,Salty_Limes,1554937628.0,1.0,"Anything with relational databases is also slow. Reloading Postgres databases takes a minimum of 20 seconds on WSL, but less than 5 seconds on Mint. And my Mint box has far worse specs than my Windows box.

Also, I still haven't found anything comparable to Gnome terminal in terms of speed (and Gnome is certainly not the fastest), good keybindings, and not crashing."
193,,1554927433.0,1.0,"I just compared compiling 500k lines of C++ on WSL vs a 32 core machine.

Both using 4 cores, the WSL laptop was about 30s faster on a 5 minute compile. 

When WSL is slow in IO you need to add an exception to Windows Defender."
194,Hohenheim_of_Shadow,1554914286.0,3.0,"If you want to go down the security rabbit hole, why even have a software wallet? Or why even trust a pre-compiled OS? If you don't compile it yourself, someone could've modified the contents, similar attack vectors have happened before. Hell, even if you compile it yourself, how can you trust your compiler? Even if you have a trustworthy compiler, you probably didn't read all the source code so you have to trust it to some degree. If you're using a CPU you didn't build from the transistor up, someone could've put an attack vector somewhere in it. Intel has been shit on for baking a OS into their processors. If someones come up with a novel way to steal crypto, they're not wasting it on a small fish like me."
195,,1554927539.0,0.0,If you trust Canonical to develope Ubuntu do you think they would do so without checking if MS followed their stated privacy statements?
196,tronj,1554925493.0,4.0,Don't you mean Teams the application formerly known as Skype for Business?
197,atomic_cheese,1554943493.0,3.0,"Do you work at my company?

IT issues Windows laptops packed with so much bloatware that an i7 with 16GB of RAM hovers around 90% CPU and 1.5GB free memory with nothing open. Engineers each have private stashes of tips on how to bypass IT, and are hesitant to share because that might get it patched.

Most devs keep the old laptops after getting updated ones, install Linux on the old ones, and use a collection of hacks to get any work done."
198,Free_Bread,1554913685.0,3.0,That's great to hear. My MBP is starting to show its age and it's unfortunate that the newer models don't seem to hold up to the name. Would love to have a first class Linux experience on my next device
199,shreddit0rz,1554921887.0,9.0,"Ironically, my metal 2016 mbp suffers from the ""flexgate"" issue, and I'm given to understand it's a miracle the keyboard hadn't failed yet. Meanwhile my years-old plastic Thinkpad trucks along and runs Linux like a champ. Go figure."
200,Soundtoxin,1554943857.0,4.0,">Even a Windows PC is a more open platform than a Mac.

Are you sure about this? Obviously neither is fully free, but I've heard that large parts of Mac OS are free. There's even a project to build an OS from the free components\[1\]. I can't help but think that a large part of the cult-like Apple-hate is actually Windows apologists who gain a small bit of anonymity in insulting Mac OS because of the \*possibility\* that they use GNU/Linux or BSD. For the record I have used exclusively GNU/Linux for several years now, and I haven't even got Apple hardware. There is also a point to be made that Mac OS is at least unix-like. You get man pages, ssh, vim, emacs, and more out of the box on Mac OS. They're old versions, but in a scenario where you haven't got internet, I think this puts it far ahead of Windows.

\[1\] [https://www.puredarwin.org/](https://www.puredarwin.org/)"
201,,1554937711.0,-3.0,"Ubuntu isn't a kernel, it's a distribution of a userspace. It is the same Ubuntu. Byte for byte.

You do realize that it runs desktop enviornments, the same terminals that run when on the kernel?"
202,Arkhenstone,1554898744.0,16.0,"Which is a consequence of the windows centric in the general public. Struggles today, live better tomorrow."
203,timrichardson,1554906088.0,5.0,"The key point is mixed DPI multi- monitor support. Linux needs wayland-based compositors and and native Wayland apps to solve this. Right now we don't even have a Waylandnative mainstream browser. However it is progressing. Give it two more years: we should have screen sharing, remote control, multi DPI on all major apps and NVIDIA support by then. I have avoided high DPI laptops so I am happy with X. 

Perhaps by then we'll also have a browser which does hardware video decoding which is he biggest battery difference between Linux and windows for me (although I mostly use a chromium build with video decode support)."
204,LoneCookie,1554928262.0,9.0,Pretty sure the acceptance of windows is artificial
205,thethrowaccount21,1554900063.0,27.0,"> My hate for Microsoft and Windows isn't artificial. Just as some older users hate for IBM wasn't artificial. 

Exactly, I don't think its fair to say this hate is artificial. It was very much earned."
206,,1554923130.0,5.0,"Totally agree.  I switched to Linux in 2016 and never looked back.  I only have a single machine with Windows installed on it in my home and I got that machine for free.  I even got my wife using Ubuntu exclusively.  Microsoft spent years giving me reasons to hate Windows.  Hell they are still doing it.  Windows 10 is constantly introducing changes and features which I think are antagonistic.

That's not to say Linux is perfect but it's a hell of wonderful thing to feel like you are actually in total control of your own system.  In addition now that I only buy hardware that comes pre-installed with Linux, I generally don't have any problem getting started as all of these machines tend to be well supported by relatively current mainline kernels.

I've been pushing hard into .NET Core development recently as I can actually develop [ASP.NET](https://ASP.NET) Core apps exclusively in Linux using Visual Studio Code.  Sooner or later Windows will be nothing more than a bad yet vague memory of my past.  That day cannot come soon enough."
207,LuckyHedgehog,1554899795.0,2.0,"Pointing out the reason why windows has better hardware vendor support for being a monopoly on the market doesn't dismiss the advantage Microsoft has

It is similar to saying Amazon is cheaper than a local store because they operate on a much more massive scale and can lower profit margins to shove out competition. Ok... But the price is still cheaper. If you don't want to support Amazon because they kill small business then great! You can go shop at the local store instead and help them grow to being a viable competitor someday. But today, Amazon does dominate the market and does have cheap prices for a ton of stuff."
208,,1554897330.0,-2.0,[deleted]
209,,1554898985.0,-4.0,">The desktop monopoly means a lot of users grew up with Windows. This creates artificial preference as well.

Preferences can be either influenced by your environment or by genetics. The way you're using artificial you imply that environmental preferences (things you happened to grow up with) are inferior.

&#x200B;

\> My hate for Microsoft and Windows isn't artificial. Just as some older users hate for IBM wasn't artificial.

It's environmental though, because it's a reaction to your externals (what Microsoft did). Some people care, some don't, and that depends on their values which are again a product of their environment."
210,trevorishere,1554910895.0,1.0,"> On windows this is impossible and seriously annoying.

Woah, no not true by any means for Windows/Microsoft applications included. While 3rd parties may suffer from lack of accessibility, Microsoft probably does this _better_ than anyone else -- and keyboard only access is part of that accessibility package."
211,LuckyHedgehog,1554900367.0,0.0,">a million different processes start up and my battery gets nuked

If you are talking about programs you installed, you can disable startup on system start. Otherwise if you're talking the windows processes, that be accounted for when saying battery life is skewed towards windows"
212,HittingSmoke,1554905325.0,-1.0,"I've been a primary Linux user for years. Before that I used Linux servers and occasionally jumped on a desktop distro for a while dating back to before Ubuntu 7.04.

I have never found bash scripting anything remotely adjacent to ""intuitive"". It's completely unreadable unless you're a programmer and it was a huge part of why systemd  ended up so popular. A user shouldn't have to know how to wrangle a cryptic scripting language just to make a process start as a daemon at boot. All of the other major popular options used bash scripting for that. Maybe if you've used bash for years it makes sense, but if you compare to pretty much any other scripting language it's an absolute unreadable mess. Javascript is more readable than bash. bash looks like someone really felt the need to save 200 bytes in a 20-line script which may have made sense in the 80s but today we have the RAM and storage for something more comfortably readable. I avoid bash like the plague. If I have to do any complex scripting I go for Python and my primary shell is fish. Switching to fish was a major improvement in quality of life for me when I discovered it. Just realizing that I don't really have to touch bash scripts beyond skimming other people's script from time to time made Linux a much more accessible option for me. I probably wouldn't be here today if OpenRC was still the norm.

Powershell has its issues, but it's much more readable and pleasant than bash. As mentioned above, working with JSON and other data structures is *so* much more intuitive since Powershell includes custom objects. In makes data output so much easier and more reliable. User input is also much more simple and straightforward in PS. To me comparing bash and Powershell is like comparing FAT16 and ZFS. bash and FAT16 may have been the best we could do at one point, but it's far from the case in 2019."
213,nicocarbone,1554897627.0,12.0,"I have a Dell XPS 13, and I can get 12h of screen time (or even more if only reading) with Ubuntu and TLP. But, this is one of the better supported laptops in Linux."
214,ronasimi,1554900369.0,9.0,"I get better battery life in Linux after installing and configuring TLP and powertop.  Unfortunately, it takes a bit of work to improve battery life in Linux, and in Windows it works out of the box because the hardware manufacturers and the OEMs have already done the work."
215,agonyzt,1554916660.0,3.0,"Same here. I have a Xiaomi Mi Notebook Pro and I get over 10 hrs of usable battery instead of \~7 in Windows with similar workload. It used to be pretty equal, but Fedora 29 + TLP was a game changer for me."
