,username,comment_created_utc,comment_score,comment_text
72,audioen,1554953095.0,3.0,"Yeah, I am perhaps mildly exceptional in that have written code on all platforms, largely java and javascript kind of stuff in a so-called full stack setting. VS Code, Eclipse, node and openjdk are of course perfectly installable on all OSes, so you can evaluate the operating systems against each other while running the same client software. Hardware is typically different, though.

In my experience, Windows is hampered by low performance of its file I/O, and this is true even after you disable things like antivirus and windows search from indexing your node\_modules directories. It is bad enough that Windows seems to be several times slower doing some task that involves a lot of small file I/O, though this depends on the hardware as well. I guess WSL suffers from similar problem, I've seen that it is noticeably slower than native Linux doing similar tasks should be. I also ran into some compatibility issues, such as that deeply nested directories may end up hitting Windows's 256 character pathname length limitation, though this is only a concern for some older, legacy APIs. Still, that's not much consolation when the particular program you need doesn't work.

Linux, in comparison, has excellent i/o performance but I find that its GUIs are clearly laggier than the competition's. The new GNOME that's going into 19.04 seems to have made at least GNOME feel a lot snappier, but I think it's still not quite as fast as it should be. In my subjective experience Linux applications are just slower to paint and to respond to window resize and stuff like that, and it's been like that since I first started using Linux sometime in 199x. I think I had best experience on nvidia proprietary driver sometime in like 2004 before compositors arrived running KDE 3.5. Adding compositor to X made all GUIs noticeably laggier, giving Linux that heavy, nonresponsive feel that it seems to have never recovered from, over a decade later. I always complain about this but nobody else seems to agree, though.

So, in the end, I have stuck with macOS for now. It is the operating system married to hardware that I have least annoyance with, but Apple is getting worse. To be honest, I'm kinda dreading the next upgrade because I have a feeling that Apple computers have already reached the end of their road, for me. There seems to be problems all around from software to firmware to hardware, and they didn't use to have these issues until fairly recently, say in the last 3 years. I now have random issues with bluetooth connectivity which only clear via a reboot, the keyboard insensitivity issues we have been having from 2017 and forwards, and random crashes of system software and GPU lockups once a month or so. The previous 2016 MacBook Pro I had ate two batteries in about two years, both got destroyed way before their expected time, and I've no idea what is wrong with that particular computer that it would do that.

It's a real shame, this brand used to be pretty good. I had years of problem-free experience in the beginning, but perhaps it was Jobs's influence and demand for perfection from when he was still alive, or I was just lucky. I guess my next machine is going to be Linux one, and I may have to get one that has 120 Hz high-dpi wide-gamut screen, or something like that if such a machine even exists."
73,PullJosh,1554925621.0,5.0,">Do people seriously think that developers would pick Windows if they had other options? 

Not sure if you're looking for honest answers or if it was more of a rhetorical thing, but I personally switched back to Windows (from Linux) because I found Linux to be too unstable (weird bugs with connecting/disconnecting monitors, funky hardware behavior in general, etc...)

I loved Linux when it worked, but Windows has been far more consistent for me in the long run. I still love the Linux philosophy, but just couldn't stick with it because it wasn't user-friendly enough for an (already often-confused) developer like myself.

(Oh, and I don't do a Mac because I can't justify the cost of Apple products.)"
74,iTzHard,1554917407.0,2.0,There's [https://github.com/bulletmark/libinput-gestures](https://github.com/bulletmark/libinput-gestures) and some in the work revelotionary touchpad driver built on libinput that I can't remember the name of for some reason.
75,moosingin3space,1554967246.0,1.0,"I recently installed Fedora Silverblue 30 beta on a travel laptop, and a lot of packages have received new gestures that work surprisingly well. I used to always prefer keystrokes to gestures, but now, I use both (keystrokes due to muscle memory mostly). Gnome has smooth workspace-switch gestures, and Gnome Web has gained support for touchpad swipe-based navigation and zoom in the technology preview flatpak.

Firefox lags a bit in this area, but it should become possible once they officially support Wayland."
76,dsifriend,1554909955.0,1.0,"The chromebooks have a lot of those, but they’re limited to ChromeOS ☹️"
77,,1554923580.0,3.0,[deleted]
78,scandii,1554973447.0,1.0,"like, I get I'm in a Linux sub, but at the end of the day a normal day at work looks a bit like this:

fullscreen app, fullscreen app, fullscreen app

it really does not matter to 99% of people what OS they're in as long as they can install the app they need and the OS allows them to use said app without restriction.

and when we look at the first part, ""install the app they need"", Windows and macOS blows any singular linux dist out of the water when it comes to third party compatibility. you can install stuff like ZSH on both macOS and Windows today so it's not like linux is the undisputed king of usable terminals either, while still leading the pack naturally.

can you name something you find completely unacceptable when you're sitting in your IDE on Windows, caused by Windows that is solved in the linux dist of your choice? I can't think of anything. I can only think of downsides when it comes to things that actually matter in my day to day life."
79,RedditIsNeat0,1554901832.0,23.0,It's like using a buggy Windows desktop but simpler.
80,RADical-muslim,1554904447.0,9.0,"So far, linux has been less buggy than MacOS for me."
81,BlackCow,1554914650.0,3.0,Because I use LTS Ubuntu and it's not buggy.
82,Neumean,1554903171.0,166.0,Wouldn't that be a gain of 2.4 percentage points and 10.3% growth?
83,pipnina,1554899210.0,9.0,"Hm, but the 2017 survey said 32.9%, so backwards since then... [https://insights.stackoverflow.com/survey/2017#technology-\_-platforms](https://insights.stackoverflow.com/survey/2017#technology-_-platforms)"
84,steven4012,1554954403.0,2.0,"So it seems like 2.4% moved from Windows to Linux, when Mac didn't change much."
85,destarolat,1554990142.0,2.0,"And the Linux growth has come at the expense of Windows, not macOS."
86,dr_barnowl,1554904852.0,48.0,"> totally ok with corporate IT supporting Windows only

To be fair, I was mostly OK with corporate IT supporting Windows only in a former role, because it meant that as long as you installed an SNMP agent on your Linux servers, they left them the fuck alone because they were afraid to touch them.

The downside was getting their cooperation on anything involving AD integration."
87,cheese_is_available,1554925185.0,13.0,Sometime the IT support is so bad that you're very glad you can can handle your problem yourself with admin right... (Especially as a dev)
88,ZazzlesPoopsInABox,1554935620.0,5.0,Developing in Virtualbox sounds like a nightmare. I use it for pen testing and network simulations and i hate it.
89,neilhwatson,1554935207.0,3.0,"I was using VirtualBox on Windows for a while, but found it buggy."
90,53120123,1555358675.0,2.0,"as somebody who devs in a linux vmware remote vitual machine, I feel I must go full four-yorkshire-men uphill-both-ways-in-the-snow but I shan't, at least it beats windows corporate IT that's so locked down you can't install a firefox add-on without written permission in triplicate."
91,GabrielForth,1554921766.0,17.0,"I feel like having diversity in your eco system should help.protect against viruses, now if the Mac or Linux boxes started getting viruses the other portion will likely be immune and the virus will impact the business less."
92,,1554964471.0,1.0,"> but they made it clear that wasn't allowed for anyone else in the future.

So that includes ""don't develop **for** Linux"" as well?"
93,damselinuxindistress,1554922373.0,27.0,"Some things are better than Linux, some are worse. My experience is that developing software is generally better on Linux but corporate software basically only supports windows and sometimes Mac so macos is an OK middle ground"
94,bdsee,1554992541.0,2.0,">It's funny, my impression is the draw of OS X is for more polish, having your machine ""just work"", etc., but they're always having to deal with some issue or failure with it

This reminds me of the times people have brought Mac's into the various meeting rooms and tried to use the projectors (which are all different). Almost every Windows PC would work with them without issue but the Mac people would be unplugging and replugging into the projector for 5-10 mins every time."
95,Dan_Quixote,1554963371.0,1.0,Mac has vastly superior support for communication tools. Specifically for videoconferencing.
96,FlyingBishop,1554940555.0,1.0,I only reboot my Linux laptops for updates. My Windows laptops I reboot every time something stops working (which is frequent.)
97,xr09,1555035447.0,2.0,Found the Googler!
98,_ahrs,1554901334.0,29.0,If you're deploying to Linux you should be actively developing and testing your code on this platform lest you get bit by any weird platform specific issues not caught by using Windows. You want to find these issues early rather than after you've finished everything and deployed your code into production.
99,meeheecaan,1554901580.0,3.0,"> Corporations making the switch from .NET Framework to dotnet core can be developing for both platforms, 

im still a bit weary of dotnet core, but im always welcome to more linux software. id rather they port all of dotnet(and win32) to linux to more free myself from windows"
100,the_gnarts,1554909934.0,11.0,"> Mac has a decent bash prompt

Apple ever upgrade to a modern version?"
101,idenkov,1554907315.0,6.0,"You just explained how you overcome all limitations to bring the linux tools you need on it and then ranted about fanboys? But if the ""better hardware"" works for you that is all that matter."
102,kenmacd,1554911678.0,4.0,"Sounds okay for what you're doing. Personally I've had to work far too many developers working on code that would only ever run on Linux in production, but still had to be littered with `Darwin` checks so they could run it locally on their dev boxes. I'd have preferred if they ran Windows because at least that wouldn't have been expected to run."
103,Nowaker,1554945682.0,1.0,"> and the Mac os for off the self programs that are a pain to configure in Linux.  

Exsmples of such programs?

> Also, Mac has a decent bash prompt

It's actually pretty bad compared to Arch Linux ISO ""prompt"" (well, not just prompt). Check out zsh with zsh-grml-config, it's awesome. 

> and combined with Homebrew I can get a lot of native utils for command-line.

Every Linux distro gets you that through their distro-specific package manager, that's no different to Homebrew. 

>I also have a Linux desktop, but rarely use it because my Mac is way better hardware.  

Maybe get better hardware for your desktop? My 2016 desktop is way faster than my max-specced 2018 13"" MBP. And it doesn't sound like a tractor when CPU usage hits 100%."
104,ChikkaChiChi,1554918853.0,8.0,"Exactly. I started using a Mac because it gave me a solid terminal environment. My dev environment has been remote for years, so I never have to worry about local hardware failures borking all of my tweaks.

I know WSL supposedly gets Windows closer, but at this point, the GUI on my local device doesn't matter much."
105,,1554927705.0,-2.0,"So does Windows

/r/BashOnUbuntuOnWindows ;)"
106,burdalane,1554916965.0,8.0,"When I go to the annual Linux conference near me, the laptops l see are mostly Macs."
107,yawkat,1554963809.0,3.0,"Eh, I know lots of non-management devs that work on mac. It's just a combination of pleasant ux and a pleasant development environment. If you have the money it's a solid choice."
108,,1554945155.0,1.0,"You think people go to conferences because they need ""help""? Yikes."
109,Democrab,1554907563.0,16.0,"The thing is, depending on your taste in games plain Jane Linux does that equally well. I've basically had to give up on only Forza...Which I already had to give up once when I decided not to get an XBO and didn't think it was coming to PC."
110,StephenSRMMartin,1554950165.0,3.0,"Haven't really had that experience. Windows 10 annoys me to death. I've had far more problems with win10 on our acer laptop than linux. Linux 'just worked'. W10 has buggy drivers, it's slow, and the start menu is filled with ads and bull shit.

&#x200B;

Haven't had to mess w/ partitions either - I use btrfs + subvolumes. I added an SSD, and just moved the root subvolume there; easy-peasy.   
WINE has come a LONG way in the past 2 years; honestly, I rarely need it for anything other than games, and now Proton comes with steam, and most of my windows games also 'just work'. No fiddling (open steam, install game, launch, ???, profit).

&#x200B;

My work is largely statistical, with some programming required. Linux makes that far easier; and I can say that, because installing the same packages in windows for my labmates has been a major hassle. Dependency hell, compiler hell, version hell. All the hell. When I need to update my stats suite, I just update. When they need to update, it's several hours of hell."
111,Astrognome,1554918760.0,7.0,"WSL is *slooooow*. Try compiling a large dependency under it.

A VM is considerably faster in my experience."
112,,1554939062.0,6.0,"It also has numerous forced updates, countless reboots, slowness, viruses, privacy issues and misuse of system resources. It tries to emulate Linux with WSL and OpenSSH, but it's very slow like @Astrognome said, as opposed to Wine (which in some cases runs faster than native Windows). Wine is getting better by the day with stuff like Proton and Lutris, with over 50% of all Steam games having either native support or support via Proton. Yeah it's not the Year of the Linux Desktop™, but things have gotten a lot better and Windows isn't exactly the solution to al your problems."
113,,1554927305.0,1.0,/r/BashOnUbuntuOnWindows
114,thethrowaccount21,1554910233.0,-1.0,"It might be. But you are trading off your privacy with Win10. If you have cryptocurrencies like I do, you cannot alllow any unauthorized buffer copies, screen captures or other security vulnerabilities because your seed phrase can reconstruct your entire wallet. Linux **only** runs the software you want it to. Windows runs whatever MS wants it to.

Someone could then empty your financial accounts without your knowledge or any ability to get your funds back. So gaming may be better on Windows, but for serious, mission-critical software and systems like financial software/cryptocurrency wallets/secure communications, Linux is really the **_*only*_** way to go."
115,dr_barnowl,1554904681.0,7.0,"The latest annoyance for me is ""Skype for Business"" (aka, The Application Formerly Known As Lync), which has no Linux version.

Allegedly you can get Pidgin working with it, but I can't work out how to join meetings as a guest, which my current client demands.

So I have to boot into Windows. And transfer any materials that aren't cloud-based presentations over to it. And hope no-one wants to see me using real tools during a screenshare."
116,tsar9x,1554911332.0,6.0,Works perfectly fine on Chromium and Firefox too.
117,,1554937073.0,11.0,"Be careful doing this. What runs in wine does not always run on real windows... I learned this the hard way. Apparently, windows STILL does not have any compatibility layer for unix sockets."
118,taxeee,1554909167.0,9.0,Who's your employer? Seems nice
119,grudg3,1554919574.0,10.0,"I'm jealous. We had free reign when I first joined my employer. It was great, i had arch+i3 setup, luks on lvm, productivity was good.

Then we got merged/purchased by a larger company, they need you to run Windows and the corporate network is so stupidly locked down (port 22 is locked on outbound connection, can't ping) that it's killed my productivity.

I've effectively had to find ways to break IT policy to be able to do my work. Everyone I've spoken to inside the company does it also. The infra team must be aware and turning a blind eye. I want to find an employer that lets me run my chosen OS again."
120,bartturner,1554900592.0,13.0,"Excellent.  I am sensitive to keyboards and trackpads.  A big reason use Macs.

But the PB keyboard and trackpad are as good as Apple.   The keyboard feels similar but also has not broke.   My MBP keyboard broke twice.   I mean literally twice.

BTW, when home I use a mechanical keyboard with my PB."
121,bartturner,1554916544.0,5.0,"You do for signing apps for the App Store.   I am still turning on my MBP for the signing.  But there are cloud services and just been too lazy to switch.

I will get around to it at some point."
122,BlackCow,1554914987.0,15.0,Well the company is offering me two laptops. One is made of plastic and comes with windows and the other is made of metal and comes with a unix environment. It's pretty obvious why Windows is losing with developers.
123,Mordiken,1554913381.0,2.0,"IMO a Mac is not a status symbol as much as it is a ""fashion victim"" symbol that tells the world ""I'm a shallow person of terrible taste"": It's the computer equivalent of a gold-plated toilet.

EDIT: 

And because apparently some people (probably Mac users) got a bit salty because of my opinion, I'd like to double down, and I will in fact reiterate that **if you're a Mac user, I do indeed think less of you for it**, specially in the context of a FOSS-centric discussion forum.

Apple is anathema to both Software and Hardware Freedom, the home to what is by far the most proprietary consumer-oriented general purpose computing software and hardware platforms in the market today: Even a Windows PC is a more open platform than a Mac.

And by buying Apple Hardware and Software, you're legitimizing a business model that rests squarely on the principals of restriction of user Freedom, and you're throwing away principals and ethics because of a ""shiny brand experience""...

So no... I do not take you seriously, and I do think you are very much part of the problem! :D 

And if this offends you, good: It means you have a consciousness! ;)"
124,CapableCounteroffer,1554937584.0,8.0,">It's the same Ubuntu, byte for byte.  

Except for the kernel, the desktop environment, and the terminal emulator. I use WSL at work because it makes my windows laptop bearable, but it is not on par with actual Ubuntu."
125,Gavekort,1554895249.0,38.0,"I completely agree, but many of these points are simply just a lack of support from hardware manufacturers."
126,Agent_03,1554898743.0,17.0,"Eh, for linux a lot of that is the desktop environment.   I'm on KDE (Kubuntu 18.04) now.  Multi-screen worked OK last time I tried it, and since my X1 Yoga is a 2-in-1 I can say that the tablet hardware works fine... although I think the Windows UX support for tablet features is better.  Onboard is NO replacement for the Windows on-screen keyboard (or handwriting support) -- the Windows tablet features are better integrated into apps too.  The main thing that doesn't work so well out-of-box is screen rotation/autorotation -- I wrote a short script for that. 

Haven't tried a dock yet so I can't speak to that. 

Power management is a wash for me -- Windows generally has better tuned drivers and (especially) tends to use the GPU more efficiently, but Linux doesn't tend to have the fans spinning constantly installing an update."
127,13531,1554900148.0,16.0,"> laptops. Just laptops in general. 2-in-1s are basically useless on linux, their tablet functionality is hit or miss on a good day.


Hmm, I have a 2-in-1 and it works perfectly with both plasma and gnome."
128,,1554902985.0,14.0,"Weird, the poor multi screen support was one of the reasons I left Windows. 
Also, I find laptops infinitely more usable under Linux with window managers like i3."
129,thethrowaccount21,1554900006.0,21.0,I'd say the hate against windows is pretty real. As a dev who's gone from windows to linux within the last 2 years I can safely say its night and day in terms of productivity.
130,animefreak123323,1554905827.0,11.0,"If awk and sed are getting too ugly, that's time to switch to a proper language like Python, and then use those python programs from bash."
131,,1554897131.0,41.0,"The love for Windows is pretty superficial based on your bullet points. I've seen counterpoints to most of them. i.e., Linux does better.

As another reply pointed out, many of them are due to hardware vendor support, and Microsoft still has a monopoly on desktop preloads.

The desktop monopoly means a lot of users grew up with Windows. This creates artificial preference as well. I grew up pre-DOS. Dad had a Vic-20, and my friends had Atari and Apple. When I finally got my own computer, I went with OS/2, because it met my needs the best.

My hate for Microsoft and Windows isn't artificial. Just as some older users hate for IBM wasn't artificial. They both used monopoly power to drive better products out of the market."
132,Jeettek,1554900245.0,16.0,Linux on laptop is king for me since I have a setup where I do not have to touch a mouse for anything and navigate and work with only a keyboard. On windows this is impossible and seriously annoying. Especially if you only have the touchpad and not an external mouse connected.
133,satimal,1554896734.0,15.0,">multi-screen with different DPIs or different resolutions.

Ehh, have windows fixed the blur issue? Last I checked you *could* have different scaling options on different monitors but boy was it ugly if fractional scaling was used. One screen would always be incredibly blurry. Fractional scaling in Windows is far superior to Linux however. 

>laptops. Just laptops in general. 2-in-1s are basically useless on linux, their tablet functionality is hit or miss on a good day.

Depends on the laptop. I've been running Linux on my Dell XPS for years with no issues. 

>dock compatibility. USB 3.1 type c docks, especially using MST, seem to be 50-50 on whether it will actually work.

I don't think this is general over all docks. I've got a Dell WD15 which is USB C and outputs to two monitors, and have had no issues there. I actually get more issues with it on windows! The webcam is choppy when on windows and it's fine on Linux. 

>battery life. I haven't done a good benchmark recently, but power saving seems to be skewed to windows.

It is a little skewed to windows, but with correct configuration of tlp and monitoring with powertop you can get pretty close. However whenever I boot up windows, a million different process start up and my batter is nuked, but that's probably because of how infrequently I use that partition."
134,Chocrates,1554902565.0,8.0,"I'm curious about your Powershell Core experience.  I have been using it for about a year (granted mostly on windows build machines) and I have come to the opposite conclusion, sh scripts seem far more intuitive and less finicky so far."
135,voidsource0,1554896672.0,23.0,I've found for a few laptops that the battery life is almost twice that of windows after installing things like tlp and powertop
136,rytio,1554903898.0,14.0,I hate Windows 10 with so much passion that I want to throw my work computer out the window every day. I have been running Linux as my OS at home for 6 months now because I could not stand using windows anymore.
137,Soulthym,1554900660.0,6.0,"Wether or not we agree on which one is the best(is there even an answer to this?), we can all agree that they both have their problems.

Windows is flawed in its philosophy, in a way that makes it scale worse than Linux does with more performant hardware. 

As almost everyone said, Linux's main problem in laptops is the lack of official support... But it brought one of its best features, and I would say one of its strongest points: the community support!
Laptops are messy under Linux if you are not willing to put some effort into configuring the OS, but that's only for one God damn reason that has nothing to do with Linux... Windows comes pre-installed on almost every machine you can buy. That's a huge problem imo.

Also when people lack some support from the most used distributions, it mostly (I'm saying that by experience) boils down to the distro not being up to date with the most recent hardware. Honestly, try installing and Arch on recent hardware that's barely used. Yes it is hard and requires some knowledge and tweaking compared to a good old T420, but you can get so much more out of it that you would on Windows, at the expense of loosing some mild features (some RGB keyboards, fine grained fan control).

EDIT: This is mostly my experience with the Aero15X v7 from Gigabyte, and a couple EEEpcs, so take it with a grain of salt"
138,RedditIsNeat0,1554901423.0,13.0,"> the hate against windows is pretty artificial

Derp derp I like it so I'm going to say that everybody who disagrees with me is artificial. Lots of people hate Windows. Not just developers, ordinary users hate it too.

It's fine that it works for you but you should try getting less emotional and just accept that other people have other opinions."
