,username,comment_created_utc,comment_score,comment_text
0,pipnina,1554891397.0,121.0,How does this compare to last year's?
1,neilhwatson,1554897195.0,201.0,"Yeah, 50% are developing for Linux yet on 25% have a Linux workstation. Corporations not supplying the right tools for the job."
2,mrrchit,1554901948.0,36.0,Seems weird when all I see at conferences are MacBooks... Maybe Mac people go to conferences more?
3,thethrowaccount21,1554899960.0,90.0,"Linux is a dream for development. When you're a developer, in fact, one of the only good criticisms in the past about Linux becomes its strongest quality: the reliance on the terminal! Unlike windows which makes you lose several seconds by clicking on and opening a gui for everything (trust me, it adds up), with linux you have direct access to everything you need right from the terminal. 

This makes a developers workflow much, much faster. SSH'ing into a server to replace an executable and coming right back takes a couple seconds, limited by your typing speed. Opening remote connect, clicking on all the settings you need, clicking ok, then clicking on this and that to copy it over, rdpclip.exe freezing and needing to be restarted which is more clicks, it definitely adds up."
4,uncleguru,1554897968.0,13.0,I've been using Linux for years and the only reason I miss using Windows is for WebEx and other conference services that I have to use Windows for. Other then that I wouldn't use any other OS else.
5,ContractEnforcer,1554894572.0,23.0,I've been writing my application since last July.  Every few weeks I fire up Windows and MinGW and make sure it will run.  I admit I hate doing it.   I am  wondering if it is worth all the hassle to potentially  reach a larger market.
6,RR321,1554901088.0,57.0,I will not work where I cannot run Linux full time...
7,bartturner,1554896529.0,32.0,"I made the switch.  Had been using a Mac for almost a decade for development and did replace with a Pixel Book that comes with GNU/Linux and what I now use for development.

Been really happy with the move so far.   I also get Android which was not the reason for doing the switch but it actually comes in handy more often than I thought it would.

Really like how Google has done the GNU/Linux support on the Pixel Books with Crostini.     How they did it you get Wayland and XWindows support.

I have move to using Flutter for iOS development and the only thing that still sucks is needing to turn on my MBP to sign apps for the Apple app store.  The last thing I need is a cloud based service that I can use to sign Apple apps.

BTW, the keyboard broke on the MBP a second time and what was the catalyst.    Apple support was excellent.  I could not ask for more.  But it is still a huge hassle to go to the Apple store and be without the machine.

The keyboard issue on the MBP is not getting as much press as it should.   It is an actual issue.  Not a bunch of reddiots bitching."
8,maep,1554907990.0,32.0,"It is remarkable that OSX is still held in such high regard. In terms of developer friendlyness they have been getting increasingly worse for a couple of years now, while Windows is getting slightly better through WSL."
9,LizardOrgMember5,1554909385.0,15.0,"With Linux (or Ubuntu, a distro that I am using), I can download any programming language I want through Terminal without having to do tedious setup. That's why I enjoy using Linux more than any OS out there."
10,grimmr33fer,1554888382.0,42.0,"Love is a strong word.

Its not Windoze, and that's enough."
11,wittyaccountname123,1554931122.0,3.0,"I genuinely don't understand how so many devs are satisfied working on MacOS. The lack of a native package manager is a complete non-starter for me. Does Homebrew really work that well? I've used it a bit and it seems to break more often than not, and God forbid you upgrade MacOS. Maybe it's gotten better?"
12,cameos,1554919659.0,3.0,"Most loved platforms are mixed by OSes and hardware, ""Raspberry Pi"" is in the fourth place, but aren't most RPI users (if not all) using Linux?"
13,MitchTJones,1554912987.0,6.0,Keep in mind that this was also the year that Microsoft released the Ubuntu terminal and other tools specifically designed to retain developers who are used to Linux... and they’re still losing users.
14,_Anarchon_,1554924462.0,2.0,I don't see how it's the most loved if half the people are using windows.
15,rickdg,1554929390.0,2.0,When you dev but you also have to easily open fully-featured psd or xls files.
16,Groudie,1554946600.0,2.0,"As someone who switched to Windows this week, after about 6 years of having Linux as my primary OS, I must say that this is oddly comforting. I always believe that the vast majority of developers owned Macs or something UNIX-like and that that programming in Windows was so trash that it would rank well below MacOS especially. Programming in Windows isn't nearly as hard as some people made it out to be (including myself) if 47% of developers surveyed said they used it. With WSL the transition has been mostly painless but it has been less than a week so I'm not sure how long things will go this smoothly but programming in Windows is doable, at the very least."
17,Nodebunny,1554948955.0,2.0,Now if only Linux had better apps
18,robberviet,1554950045.0,2.0,"Does this mean desktop environment or just deploy environment?

I work just well with server running Linux (I mean what other option?), but Linux for personal usage is still suck for me. I don't know why but the UX is just off.

Also for this vote, I will of course vote both MacOS and Linux. Multiple choice could be misleading sometimes."
19,,1554961898.0,2.0,"75% are frauds

jk, my company doesn't allow linux. have to use an overpriced macbook pro."
20,,1554914847.0,3.0,[deleted]
21,supermans_90s_mullet,1554986631.0,1.0,"Linux is not a ""platform"" and things should stop acting like it is.

There is no real feasible way for software to ""target Linux"" and no ""GNU/Linux"" is not a plarform either.

Most of these distributions are their own platform and software often needs significant patching to run  on another and that's fine; these different operating systems have no obligation to be like one another but things should stop acting like it's any other way as well.

I would go so far as to say that for a lot of use cases  ""Ubuntu GNOME"" and ""Ubuntu KDE"" already become different platforms because some stuff stops working properly. Steam in particular says ""We only support Ubuntu Xorg KDE/GNOME/Unity"" and other than that you're on your own.""; one some platforms that are similar enough you can get it to work with hacks but good luck ever running it on Alpine Xorg KDE or Ubuntu Wayland Sway.

Linux just isn't a ""platform"" in the same way that Windows is where all this is centrally controlled and for a lot of applications whether you use Wayland or Xorg will have a bigger impact than kernels like say Wine which runs fine on any Unixlike kernel but the developers have announced they have no intention of as much as attempting a Wayland port since it doesn't offer a lot of things they need and it's far harder to map Windows to it because it functions completely differently from Windows."
22,soutsos,1555171198.0,1.0,"You mean GNU/Linux. Linux is simply the Kernel. Let's give the GNU guys some credit, which they surely deserve :)"
23,urban-_-hominid,1554908894.0,1.0,The one thing I ask is awesome touch gestures like Macos...then we'll have everything.
24,ender_wiggum,1554919453.0,0.0,"Jebus H. Christ in a chicken basket, look at the development environments... I feel the need to hork.  


Visual Studio / Android Studio takes the top spots.  <shudder/>.  


At least I can sleep well knowing those vile yet criminally fraudulent Emacs users aren't holding sway with their idolatrous nincompoopery."
25,,1554927155.0,0.0,"1. Holy shit VS Code really took off.
2. Where would WSL fall. I would not put down Windows if I had taken the poll"
26,,1554951455.0,0.0,How the fuck do people actually PREFER windows? I thought it'd be like 0.01%
27,igonejack,1554899482.0,-25.0,How could people do their jobs with so buggy Linux desktops?
28,,1554897648.0,184.0,[deleted]
29,dreamer_,1554901122.0,109.0,"I was in this situation... The whole team was using Linux in Virtualbox to work, yet management was totally ok with corporate IT supporting Windows only and mandate additional Windows-only software. Some people (including moi) made the switch to using Linux with Windows in Virtualbox, but it was almost equally painful."
30,CyanBlob,1554905257.0,37.0,"Yep, it's irritating. My company does embedded Linux development, but all the desktops run Windows. All the devs here use Linux VMs"
31,BlackCow,1554914484.0,20.0,"I installed Ubuntu on my work Macbook and sorta assumed it was fine. IT decided to install anti-virus on everyone's machines and found out that me and a handful of other engineers were running Linux.

My manager was awesome and decided to stick up for us. They decided we're ""grandfathered in"" but they made it clear that wasn't allowed for anyone else in the future."
32,bump_bump_bump,1554910240.0,39.0,"We develop to run only on Linux, but fully 75% of engineers choose OS X as their dev environment, and there are a few hoops we *all* have to jump through to make everything compatible for them.

It's funny, my impression is the draw of OS X is for more polish, having your machine ""just work"", etc., but they're *always* having to deal with some issue or failure with it (most recently many of them periodically lose USB connectivity and have to reboot).  It could be that we Linux users just accept that sometimes things fuck up and we have to reboot or something, or that we have internalized various workarounds and tricks, but frankly it seems like a lower-bother environment to me for a developer."
33,SahinK,1554918488.0,8.0,"We have a team of engineers developing and maintaining our own Linux distro based on Debian, and it's the only approved platform for development. I love it."
34,efethu,1554915179.0,12.0,"> Corporations not supplying the right tools for the job.

Not necessarily. In our company(fairly large, thousands of employees) all servers are Linux. When a new person starts they are asked if they want Linux, Windows or MacOS. No strings attached, purely their decision. I use Linux, but most(over 50%) of my colleagues use Mac.

You really don't have to write code on the same platform. Think microncontrollers and game consoles."
35,postmodern,1554937105.0,4.0,"Can confirm. The biggest excuse is that it's just too hard to manage Linux laptops/desktops, so IT departments stick with what they already know (Windows, macOS, JAMF, etc) instead of learning how to use [Canonical Landscape](https://landscape.canonical.com/) or [RedHat Satellite](https://www.redhat.com/en/technologies/management/satellite)."
36,jgierer12,1554906089.0,7.0,Keep in mind that includes things like web servers that run in a Linux environment. To me it's more surprising that the number isn't higher than that. I wouldn't say having a Linux workstation is necessary for those kind of applications.
37,lengau,1554927369.0,7.0,"This is literally my current situation. I'm running the following applications right now on my work laptop (Windows):

* Firefox (for Reddit and other personal stuff)
* Chrome (for work web pages, including Jupyter notebooks)
* PyCharm
* 8 different SSH sessions to Linux machines (including to a Linux VM running on my laptop).
* FileZilla, because Windows doesn't have SFTP integration.
* RDP session to a remote Windows server. (We have some data we're not contractually allowed to put on laptops, but we are allowed to remote to a server to work on the data)

I do need Windows-specific stuff occasionally, but 100% of what I need Windows for could be done within the aforementioned RDP session. I wouldn't even need a Windows VM."
38,LuckyHedgehog,1554900681.0,8.0,"Corporations making the switch from .NET Framework to dotnet core can be developing for both platforms, and probably still maintaining products built in framework. Windows os is the right tool for those developers"
39,yur_mom,1554902695.0,0.0,"I have been developing for Linux servers and embedded linux for 12 years and prefer my MacBook Pro for development.  I have an AWS instance that I ssh into to cross compile for embedded and all the server dev is on AWS.  I also have Linux desktop on parrellels.


This is the best of both worlds because I have all the Linux tools for development and the Mac os for off the self programs that are a pain to configure in Linux.  Also, Mac has a decent bash prompt and combined with Homebrew I can get a lot of native utils for command-line.


I also have a Linux desktop, but rarely use it because my Mac is way better hardware.  I feel forcing yourself to be a fanboy of one os is foolish and every os has its strengths and weaknesses."
40,Rookeh,1554916296.0,1.0,"My team pretty much all develop on Windows (one guy has a Mac), but for deployment we package everything up with Docker and deploy out to Linux. It's worked fine for us, but of course it depends on your stack and more importantly what exactly it is you're building."
41,AddemF,1554937273.0,-4.0,"To be fair, corporate management tends to be pretty idiotic and I just can't seeing them getting used to Linux.  So they're probably right to stick to Microsoft.  So you either have half the firm on one OS and half on the other, or enforce everyone on Microsoft.  Having half the firm working on a different OS entails another host of challenges.  So ... no matter which way you go, someone's going to have to deal with extra difficulties."
42,awxdvrgyn,1554912166.0,30.0,"Well money helps you make it to conferences..


I expect Linux dual boot or primary on main workstation and single stock OS on laptop is common"
43,BlackCow,1554915068.0,22.0,It's because they come with a unix environment.
44,idenkov,1554913597.0,23.0,"You are going to the wrong places - all I see when I go to some kind of conference/meeting is thinkpads.

But the bigger events have mostly macs - it is part company policies, part mostly management going there, but I might be wrong."
45,Ogg149,1554953108.0,1.0,They have more money?
46,,1554938397.0,1.0,"Wealthy developers tend to stop caring about cost efficiency for laptops. There’s not much point fussing over a couple hundred bucks, just buy what you want."
47,Zoenboen,1554914237.0,-5.0,"Just like how this really just shows is that the people who need the most help are Linux and Mac devs. 

Or rather, Windows developers are seeking help on Microsoft sites."
48,Hohenheim_of_Shadow,1554906287.0,5.0,"OpenSSH has first party support in Win10. It doesn't natively support remote desktop environments, but then you're looping back to evil GUIS. For an all in one gaming, moderate development and software support for random devices computer, Win10+WSL is pretty damn good. I don't even have to deal with the annoyances of dual boots, hard drive partitions, performance penalties of VMs or dicking around with WINE or other compatibility layers."
49,,1554927285.0,1.0,"> Unlike windows which makes you lose several seconds by clicking on and opening a gui for everything (trust me, it adds up), with linux you have direct access to everything you need right from the terminal.

/r/BashOnUbuntuOnWindows"
50,neogeek23,1554898462.0,14.0,I don't have a problem with webex in rhel.  Everything works really well.
51,captainstormy,1554903493.0,7.0,Chrome has a WebEx extension that makes it work just as well on Linux as it does Windows.  If you don't mind Chrome.
52,RedditIsNeat0,1554901707.0,14.0,You might want to look into cross compiling with mingw and using wine. Then you don't have to actually boot Windows and you can take advantage of your package manager rather than having to manually maintain your mingw installation on Windows.
53,sablal,1554895416.0,13.0,"I don't have a personal box with that OS. For all my utilities, the policy for Windows is - _port it if you need it_. As far as I know, there are no alternatives on windows with the same specifics and use-cases. And so far, I've seen people submitting patches for Windows OR having local patches to use them."
54,pdp10,1554911457.0,6.0,"You can cross-compile with MingGW and Clang/LLVM, so you don't have to run Windows just to keep the compile clean. Testing will still require some Windows, though you could also consider Wine. And if you want to make sure it compiles with Microsoft's toolchains, you'll need to figure those out, which is nontrivial.

The code I'm currently working on may or may not ever have significant Windows market share. There are a number of reasons I'm keeping it portable, and smoking out bugs is one of them. I may also end up using it on Windows myself in the future (it's a server application, not desktop)."
55,aaronfranke,1554953944.0,2.0,">  I am wondering if it is worth all the hassle to potentially reach a larger market.

Yes. Ideally, programs should run anywhere."
56,,1554927974.0,0.0,/r/BashOnUbuntuOnWindows?
57,dr_barnowl,1554904483.0,31.0,"+1 to this. Was a major factor for me leaving my previous job, who hired me on the premise that they were forming a dev team with agile principles and then 2 years later were issuing locked-down Macbooks with no root (and ... no Homebrew!), trapped in a network walled-garden, as ""managed"" developer workstations.

Did not get on with those Macs and held onto my trusty Dell (which I re-imaged with Ubuntu on day 1) for dear life, even if I was literally risking having my face burned off as it had some major battery swelling issues.

My current employer gave me a choice between 4 devices - big/small mac/XPS - and have wiki pages with well-tested procedures to dual-boot the Dells with Ubuntu.

TLDR : would literally rather risk lithium burns than use OSX or Windows."
58,the_gnarts,1554910043.0,9.0,Indeed. That’d be a deal-breaker in any job interview.
59,StephenSRMMartin,1554950672.0,3.0,"Same. I do stats/programming for my job currently. If an employer didn't let me use linux, I would strongly hesitate to work there."
60,Free_Bread,1554900501.0,11.0,How's the pixel trackpad in Linux?
61,,1554916052.0,5.0,[deleted]
62,Game-of-pwns,1554950458.0,4.0,"Being forced to use a Mac at work and it's my first experience working on one after using Windows Vista, Windows 7, windows 8, windows 10, ubuntu, lubuntu, Ubuntu mate, raspian, and mint over the years. 

Besides the quirky (cludgy?) window management and completely different keyboard shortcuts, the worst thing I've noticed is that pretty much every app I try to download costs money, and most of those are apps that I only want because they add functionality missing on OSX that is literally on all other modern desktop environments, like window snapping.

I've very much gotten used to finding cool Linux tools that are community developed and free. Big change when switching to OSX. Not sure why developers would chose OSX, although I will say it's nice how light the MacBooks are."
63,the_gnarts,1554910311.0,11.0,"Status symbol factor is strong.

That said, I don’t know a single developer colleague who would
touch a Mac unless compensated. Some still prefer Windows,
especially the older generations. But they’re cool about it and
it makes for hilarious banter."
64,thethrowaccount21,1554910876.0,4.0,Installing rust and using cargo will blow you away if it hasn't already. I know I could never go back to the old fashioned way of getting things without utilities like cargo.
65,strongdoctor,1554914088.0,1.0,"Well, I mean, Chocolatey lets you do just that on Windows."
66,,1554928100.0,1.0,"> I can download any programming language I want through Terminal without having to do tedious setup

That is true for WSL. It's the same Ubuntu, byte for byte. Including the programing languages you download using `apt`."
67,Reverent,1554894969.0,47.0,"Eh, the hate against windows is pretty artificial. I'm in devops, 90% of my servers are linux based, and my primary platform is windows. A short list of things windows does better:

* multi-screen with different DPIs or different resolutions. Honestly multi-screen in general. Windows has that pretty locked down. Well except for OSX. OSX is by far the best environment I've seen in regards to dealing with weird resolutions or DPI scaling.
* laptops. Just laptops in general. 2-in-1s are basically useless on linux, their tablet functionality is hit or miss on a good day.
* dock compatibility. USB 3.1 type c docks, especially using MST, seem to be 50-50 on whether it will actually work.
* battery life. I haven't done a good benchmark recently, but power saving seems to be skewed to windows. This is generally due to the attention manufacturers pay to windows drivers vs linux drivers.

Don't get me wrong, I mean 90% of my time is spent in a ssh terminal. I love docker, I love oVirt, I run homelab services on proxmox. But user experience in a notebook environment is not a strong suit for linux.

EDIT: Also, I *love* powershell. Powershell is awesome. I've started recoding my shell scripts into powershell core, because awk/sed/data structure handling in linux is so ugly. I love doing text replacement or JSON structuring in powershell. In bash, it feels like I'm fighting the OS.

EDIT2: sort by controversial is an interesting metric for this post."
68,shirro,1554950783.0,2.0,I am not a very serious developer but my experience was homebrew was fine until you started to run into differences between your development and production target. Then you move to virtual machines. And pretty soon you might as well be back on Linux. But it think it probably depends a lot on what you are doing. If you are developing web frontend it is probably  fine. Not so great with server side or compiled stuff.
69,bartturner,1554978419.0,1.0,"I use to use a Mac for development and did for a decade.   MacOS is unix based so close to GNU/Linux.

I have now replaced with a Pixel Book so have GNU/Linux.   

The one that surprises me is people using Windows.   I have not done Windows development for a decade now.   Windows is not at all like Unix."
70,CapableCounteroffer,1554938360.0,2.0,"Yeah, you can vote for several. For example I voted for AWS and linux, but I don't target desktop linux, just linux on AWS (and other cloud services). So someone can vote for linux, then also vote for rpi to specify that they develop specifically for that hardware (or in addition to other hardware)."
71,Soundtoxin,1554955631.0,2.0,I think someone using it has more meaning behind it. It doesn't come on most computers. In many cases you have to install it yourself. A lot of Windows users don't even know what an operating system is.
