,username,comment_created_utc,comment_score,comment_text
317,lengau,1554927994.0,7.0,"Seriously, FUCK WINDOWS in this regard, and fuck the bad habits it forms in developers."
318,BambooRollin,1554938732.0,5.0,And it hits when you develop on a Mac and discover its filenames are not case-sensitive. So another good reason to use Linux.
319,_ahrs,1554911700.0,2.0,"You:

> Not sure if You should give advice, when you are mistaking ""developing"" and ""testing""

Me:

> Testing is a part of the development process"
320,meeheecaan,1554911844.0,3.0,"and therein lies one of the things im not entirely happy about this with. MS pulling that. i love c# and am happy that I can use most of it on linux and love what ive got sofar, but i dont like how ms so sequestering so much of it away from me"
321,meeheecaan,1554908495.0,1.0,"dont get me wrong, im still using it and enjoying it so far just have  a little wishful thinking about how nice it would be if i could move all my c# to linux easily iguess. step 1 though."
322,,1554938755.0,-3.0,"That's hardly a concern for the majority of users. Even so, its actively being worked on.

However, with the Windows/WSL interoperability there are nuances available to the WSL that are not available on a Linux Kernel. But I guess it's better to only make comparions in one direction."
323,,1554997822.0,1.0,`sudo apt update; sudo apt upgrade`
324,iTzHard,1554916602.0,2.0,Why Pandora?
325,,1554913417.0,2.0,[deleted]
326,Not_Pelle,1554923377.0,1.0,"I've only ever had (and still have) 1 real problem with my Debian installation: LightDM (or maybe it is the GTK+ greeter or Light Locker) is an utter piece of crap, especially with multiple monitors or on mobile devices. I've tried it with Xubuntu's default config and with my own config on Debian Unstable, both have the exact same problems. The only 2 other active DMs according to Wikipedia are GDM (which is too tied to GNOME, so not really an option for me, though it works fine) and SDDM (which uses Qt, so not really an option for me, though I haven't tried it).

With Windows on the other hand, I'm only having issues with updates (it removing Office, GRUB, my Btrfs partition, etc). Also because I'm mostly working with things intended for a Linux environment, I've to fix all kind of weird shit on Windows. And no, WSL isn't a solution with their memory leaks and weird file system and things that just don't work. Also Windows is so much slower, especially on low-end machines (think Celeron N2840)."
327,TH3_ST0CK,1554912119.0,-1.0,"[This](https://itsfoss.com/how-to-fix-system-program-problem-detected-ubuntu/) is similar to the issues that I have experienced using Ubuntu in the past.  Almost always happens within 24 hours of a fresh install on multiple machines.

Additionally, NVidia drivers are not the best on Linux.  Noveau had bad performance on my Alienware Alpha, and the NVidia official drivers caused tearing when watching videos.

I can see how some computers may be slow when running Windows 10, but mine never skips a beat (i7 3770, 16gb Ram, AMD 290x, 500gb SSD)"
328,iTzHard,1554916913.0,5.0,Lutris?
329,Democrab,1554917207.0,5.0,"Literally all but 4 games were simply click install either in Steam or on the Lutris website for Linux for me, and those that required extra config typically do on Windows anyway. (eg. AoE3 as I said. [I literally just helped a dude out with getting it to work on Win10 earlier tonight](https://www.reddit.com/r/linux_gaming/comments/bbbvrb/linux_tech_tips_microsoft_should_be_very_afraid/ekjwieq/?context=3). I feel like both Windows and Linux have similarly 'intensive' solutions to make AoE3 work on them. Another one that required extra config was obviously SkyrimSE/FO4 that needed the wma enabled faudio patches which is extremely simple to do especially when compared to what most of us do to those games mod wise anyway and the other game, Subnautica, was a game I just used the ProtonDB stuff with initially only to find that just running it vanilla with no tweaks worked better for me.)

I've also had poor luck with older games and Windows, Jazz Jackrabbit 2 plays fine but screws up my desktop resolution when I quit (Something that Lutris can auto-fix for me, and is also fixed by extra config via installing JJ2+ on either Windows or Linux), Age of Empires II original (Lotta people prefer that to HD for MP still) works perfectly under Wine but *requires* patching to fully work under Windows, The Sims 1 is buggy as hell under Win8/10 because DirectDraw emulation is broken but works fine under Linux, Simcity 4 worked with zero tweaking (And actually allows for me to run my native res of 2560x1080 in Hardware DirectX or OpenGL mode, something I've never manged to have work under Windows) and while this last game is one most people probably don't know, Gearhead Garage will crash very quickly every time you run it on anything newer than XP which makes sense given that it needed patching to work properly on XP in the first place but once again, works fine under wine."
330,Astrognome,1555003504.0,1.0,"I find it really hard to believe that a 4 core laptop compiled faster than a 32 core workstation/server, especially seeing as mobile parts are way slower than desktop ones.. Mind posting specs? Ram, CPU model, storage?"
331,thethrowaccount21,1554916450.0,1.0,">Aight so if you need a software wallet for security and a hardware is impossible, Linux is better.

Not necessarily. If you have multiple pools of assets hardware wallets are better for long term hodling. Software wallets are better for quick transactions, like with Dash's instantSend. Most other blockchains are slow and require 50 minutes for confirmations, but all Dash's transactions use instantSend technology, so software wallets work very well as a quick way to spend your cryptos. I guarantee you I use cryptos more than you do so you can take that shouting somewhere else.

That might be for **your** workflow, but if your workflow requires privacy like mine does, there's no way it could be. In short, you're making a desperate argument for a worse solution. I don't envy you."
332,CapableCounteroffer,1554939606.0,3.0,"> Well, I download Ubuntu directly from Canonical and I get a user space.  

No, you download Ubuntu directly from Canonical and you get an entire operating system, which includes the userspace.

>No, there are no modifications to make. How about you start naming all these modifications.   

Literally just google ""run X server on WSL""...  

>You can't use gnome-terminal on any system without running an X-server. It's no different.  

Right, and when you download ubuntu it comes preinstalled with an x server and runs it by default on boot. It also comes with gnome-terminal preinstalled. WSL comes with neither.

> It is byte for byte the same userspace.  

Oh I thought it was byte for byte the same, now its byte for byte the same _userspace_? Nevermind that still isn't true, since the default ubuntu install comes with userspace programs that WSL ubuntu does not..."
333,,1554905031.0,7.0,"The marketplace for personal computers was illegally influenced by Microsoft, per US court findings of fact, so the hardware vendor support was stolen from possible competitors."
334,thethrowaccount21,1554909673.0,1.0,"No worries, I understand what you mean now."
335,nostril_extension,1554915972.0,6.0,"You set a very low bar for excellent. You don't even have basic context managers so if you have more than 4 programs you just keep mashing alt+tab?

I'm sorry but it's not _excellent_ in any way shape or form."
336,GiraffixCard,1554927593.0,10.0,"Same in Sweden (IME). It makes more intuitive sense to me too, since 10% growth of some arbitrary percentage can be anywhere between enormous and a rounding error, while 2 percentage points is always just 2 percentage points."
337,peeonyou,1559007928.0,1.0,"Well we filled the tech role so now we're just looking for an IT lead. Someone who can get around in MacOS, Linux, and W10. Also comfortable with asset management and gsuite+okta."
338,iSnortedAPencilOnce,1555013523.0,1.0,"Yup, worked with a small company of 100 people in the financial sector and it was absolutely mandatory before hiring. While I was with them they would routinely fire people in their LA offices who came in stoned."
339,MDSExpro,1554912033.0,0.0,"Nothing like editing you comment, and then failing to reference correct one in try to burn someone."
340,my_meme_ID5,1555036927.0,1.0,Does it solve windows updates problem? ;-)
341,thethrowaccount21,1554916913.0,4.0,"No reason. Haven't heard of anything better yet, I'm all ears though."
342,thethrowaccount21,1554915470.0,4.0,"That's fine, everyone is at different levels of this thing. I've never had a single issue with Linux after I bought a system76 box. Windows was a daily hassle that made me lose many hours of man time.  ¯\_(ツ)_/¯"
343,LtWorf_,1554981477.0,1.0,"What you mean is that you are more experienced with windows and know how to fix it, and you are very unexperienced with linux, and you to stupid stuff without realising."
344,thethrowaccount21,1554931340.0,0.0,"> Also Windows is so much slower, especially on low-end machines (think Celeron N2840).

This was also my experience too. Thanks for sharing
/u/MyDashWallet tip 1.8 mDASH"
345,thethrowaccount21,1554913683.0,8.0,"I'm sorry you had to deal with that. I can only go by my own experience, and the experience of those I've converted, linux is way faster and far less error prone than windows.

Whether its from a security perspective or a UX perspective, once you're no longer used to the 'Windows way' of doing things that is, Linux is far superior imo to Windows. I had a machine with the same amount of memory but with windows10 and I couldn't do half of what I do now. 

Windows defender or some other hard to kill program like svchost.exe would run in the background and take up 80% of my CPU for hours! I am not exaggerating. My machine would slow to a crawl if I opened up two instances of visual studio! It was an extremely frustrating and **eye-opening** period. Eye-opening because of how bad the UX had grown."
346,,1555003888.0,1.0,"Ok. Do you know that you can tell a compiler to limit itself to a certain number of cores, and that by default it uses 1?

Did you read where I said I only used 4 cores in both?"
347,Hohenheim_of_Shadow,1554917757.0,3.0,"My entire argument was that win10+wsl  is a superior solution for me and that this sub hates on Windows needlessly.  
    
If you use software wallets for long term storage, Linux is better, I never argued that Windows was a better tool than Linux for that particular problem. I don't have that problem and didn't bring crypto into the conversation because it is t relevant to my PC use case.  
    
My argument and point was that for my use case of a PC, moderate development, gaming, some specific windows only programs and general computing(and note that Crypto isn't on that list), Win10 + Windows Subsystem for Linux is a superior solution than Linux with a VM or dual booting. The fact that this setup is less optimal than a Linux system for HODLing is completely irrelevant to my point, so idk why you brought it up and act like you won."
348,,1554939770.0,-1.0,"> No, you download Ubuntu directly from Canonical and you get an entire operating system, which includes the userspace.

It's not my fault you don't understand that Canonical distributes via multiple methods.

You dont' run an X11 server on WSL. It runs on Windows. You can get one in the Windows Store.

> gnome-terminal

Multiple distribution methods. All Canonical.

> Oh I thought it was byte for byte the same

It is."
349,LuckyHedgehog,1554905837.0,-7.0,"How many decades ago was that? The market has had plenty of time to adjust at this point, and Windows is still better with hardware support.

It also ignores the shady behavior of all tech companies during that era. Macintosh, Microsoft's main competitor, was just as foul during that era as well. If you want ot say Microsoft is the equivalent of selling stolen goods out of the back of a truck, then I would say the only market available was stolen goods and everyone was pulling up their trucks."
350,trevorishere,1554933388.0,1.0,So you don't know about WinKey+Tab? This is the problem when you're talking about a subject you're unfamiliar with :-)
351,brrrchill,1554957003.0,2.0,"If your profit is 23.2% of gross and it goes up to 25.6% then your profit has increased by 10.3%, which is not too bad."
352,BlackCow,1555013847.0,1.0,Well coming in to work under the influence of anything is totally unacceptable in any industry. It's going to get interesting once cannabis is federally legal though.
353,,1555058860.0,1.0,What problem?
354,,1554984588.0,0.0,[deleted]
355,TH3_ST0CK,1554915235.0,-3.0,"I'm in no way tied to the Windows way of doing things, I remote into and manage many Linux servers for work, and I use a Mac as my personal laptop. I just think that many of the Linux frontends, as light as they might be, have way more rough edges. They don't have the same level of polish that MacOS, Windows, or even Android has.

I have no issue with interacting with Linux systems and I love the Bash shell. I would just rather interact with it via an SSH shell from my Windows or Mac environment with a compositor that is double buffered"
356,Astrognome,1555004307.0,1.0,"Ah I missed that part. That still doesn't make much sense though, my fairly new laptop still gets beat out by my 7 year old desktop with -j8, both quad core, with HT, both on linux. What are the actual specs?"
357,,1554927616.0,1.0,"> My entire argument was that win10+wsl is a superior solution for me and that this sub hates on Windows needlessly.

Not needlessly. It's a direct threat to the identify of this community, despite having a great benifit to users."
358,thethrowaccount21,1554917897.0,0.0,">My entire argument was that win10+wsl is a superior solution for me and that this sub hates on Windows needlessly.

I know. My entire argument was that its not needless. Windows deserves EVEN MORE hate than its getting. In fact, I'm kind of surprised it took this long to be honest with you.

> I don't have that problem and didn't bring crypto into the conversation because it is t relevant to my PC use case.

True, but not everyone is talking about you and only you. There are other people who might want to join the conversation, and some of them will use crypto. 

>My argument and point was that for my use case of a PC, moderate development, gaming, some specific windows only programs and general computing(and note that Crypto isn't on that list), Win10 + Windows Subsystem for Linux is a superior solution than Linux with a VM or dual booting

My argument is you're wrong.

>The fact that this setup is less optimal than a Linux system for HODLing is completely irrelevant to my point, so idk why you brought it up and act like you won.

Because there are several usecases where Linux is definably the only secure solution. Perhaps if you read my argument more carefully you would've read the part where I said that."
359,CapableCounteroffer,1554939894.0,5.0,"lol okay dude. idk how far out you must be to consider ""ubuntu"" and WSL byte for byte the same, but good for you."
360,,1554913061.0,6.0,"""How many decades ago was that?"" Try walking into a mainstream store and buying a desktop computer running Linux today."
361,CapableCounteroffer,1554938207.0,4.0,"Not OP, but couple of things I do on my linux computer that I don't know how to do on windows quickly, using just the keyboard: resize windows, send windows to different monitors or workspaces, switch workspaces, swap windows that are horizontally or vertically split, open a new window of a specified program directly to the right, left, above, or below the current window. Can all these things be easily done on windows?"
362,ExistingObligation,1554991297.0,3.0,"That makes more sense than the original case though, where it's measured against a total market share that sums to 100%. In that case, some obscure OS could go from one user to two users and you'd say it experienced 100% growth over the year, which is more misleading than saying it went from 0.00001% to 0.00002%"
363,my_meme_ID5,1555059532.0,1.0,"> > Windows updates problem..

> What problem?

Which century you are living in?"
364,LtWorf_,1554991006.0,0.0,">  Did you miss the part 

No i didn't miss it. I've seen people who work in offices for years and still type with 1 finger… using something for work doesn't mean much."
365,LtWorf_,1554981806.0,2.0,"For me, windows and osx desktops are shit compared to linux.

Linux has 2 copy paste buffers, one with ctrl+c one with the middle click. It also uses triple click to select an entire row or paragraph. I enabled compose key so I can type in multiple languages without changing layouts, and altgr+caps lock let you do many more symbols. For example italian speakers can't type ""È"" on windows, but can do so on linux.

And let's not even talk of klipper, which keeps track of everything you copy paste…

If you haven't learned how to use desktop linux yet, I can see why you wouldn't like it, but the overall experience is better."
366,,1555005586.0,1.0,"> my fairly new laptop still gets beat out by my 7 year old desktop with -j8

An E5-2697 v4 @ 2.30GHz vs an i7 8550U @ 1.8GHz (operating at compile at 2.5GHz)

And plenty of ram in both.

I also don't know how many processors your actual laptop has, but hyperthreading is not the same as a CPU, which is why I limited it to 4 cores, to make the comparison equal."
367,Hohenheim_of_Shadow,1554929311.0,1.0,"Communities  oppose a change that has tangible benefits simply because its ""a threat to their identity/culture"" tend to be toxic cesspools. WSL is a bad thing despite doing good because it isn't  ""Pure Linux"" or ""its a threat"" is the same logic behind pretty much every other argument against the future."
368,Hohenheim_of_Shadow,1554919060.0,2.0,"In the usecase outlined, why is Linux a superior solution? It isn't. It is still a decent solution, and you can make it work, but it is not a better solution."
369,,1554940409.0,1.0,"I guess you know more than Canonical

> “Right, so just Ubuntu running in a virtual machine?”  Nope!  This isn’t a virtual machine at all.  There’s no Linux kernel booting in a VM under a hypervisor.  It’s just the Ubuntu user space.

> “Ah, okay, so this is Ubuntu in a container then?”  Nope!  This isn’t a container either.  It’s native Ubuntu binaries running directly in Windows.

> “Hum, well it’s like cygwin perhaps?”  Nope!  Cygwin includes open source utilities are recompiled from source to run natively in Windows.  Here, we’re talking about bit-for-bit, checksum-for-checksum Ubuntu ELF binaries running directly in Windows."
370,LuckyHedgehog,1554913556.0,-4.0,"You can buy desktops running iOS, and laptops running Linux (Chromebook). You can buy desktops with no OS and the ability to install Linux on your own without paying the extra overhead for Windows licenses.

Nothing illegal about what Microsoft is doing, as you originally stated. Hardware companies don't bundle with Linux because Linux isn't a single OS anyways, and anyone who wants Linux will likely reinstall with a different distro.

The original issue wasn't even market saturation, it was hardware support. Who cares if pre-build desktops are running windows, the issue was after you wipe it clean and install Linux the hardware support isn't as good as Windows. That has nothing to do with finding Linux in stores or not. Any hardware company has the choice of shipping with Linux if they want to, and they typically do not. Windows currently has an advantage here no matter how much we would like it to be otherwise. 

Do I hope it gets better, and soon? Absolutely. I think it will happen sooner than later. Doesn't change the reality of 2019 though

You are complaining for the sake of complaining at this point"
371,nostril_extension,1554945868.0,2.0,"Let me add to this. Switch to program by part of its name. Drop down terminal and apps in general. Full screen window and back to original size. Automatic monad, matrix and a dozen different windows layouts. Windows remembering their position and automatic startup on launch. Moving floating windows with keyboard. Using hjkl instead of arrows - fully customisable controls. Launch program in specific window and specific place. Just the tip of the iceberg.

Op is full of shit when he says that windows keyboard support is even comparable to that of Linux.

Check out i3wm, qtile, sway to name a few."
372,,1555059633.0,1.0,"The one where I don't wasnt an army of botnet computers ala XP spaming me constantly.

The one where automatic updates serve a valid function, like immunization."
373,Astrognome,1555006818.0,1.0,"Both my laptop and my desktop are quad core. Laptop has the same CPU actually(8550U), desktop is an i7 2600k@4.8ghz. Both have SSD and 16gb of ram. Your results still seem kinda fishy to me. I'm not saying I don't believe you but I still find it hard to believe that a mobile part is beating out a desktop part at similar clocks, even a 2 year old one. Either way, I still can't get WSL to run acceptably fast on big compile jobs, even after adding an exception in defender. I get better results from VMs."
374,,1554929852.0,1.0,I agree. I didn't mean it was good that it's opposed. The opposite actually. I'm actually the creator of the official WSL subreddit.
375,senatorpjt,1554953355.0,1.0,"WSL has no tangible benefits if you don't use Windows, obviously. And it is actively harmful in driving adoption as an OS if it's just a layer on top of Windows. 

Unfortunately it's just the nature of OSS that it's going to be a one-way street, Microsoft has full access to Linux internals and Linux has no access to Windows internals."
376,thethrowaccount21,1554931286.0,0.0,"Linux is more secure, more private, faster, doesn't do random updates, doesn't delete your data, doesn't require 'telemetry', doesn't store your typed keys, spoken words and other input data on someone else's server, etc. there are a myriad of reasons, those are just off the top of my head though."
377,CapableCounteroffer,1554940903.0,1.0,">Here, we’re talking about bit-for-bit, checksum-for-checksum Ubuntu ELF binaries running directly in Windows.  

Do you not know what an ELF binary is? It's just a single executable/library. All this snippet says is that ubuntu userspace executables are byte for byte the same, which I never contested. No where does it say that ubuntu in it's entirety is the same, in fact it explicitly says ""there's no linux kernel booting,"" and furthermore there isn't even a linux kernel included, which would clearly lead to a change in the source code (and thus byte for byte parity). Honestly idk what planet you must be from to come to the conclusion that WSL ubuntu and the ubuntu operating system distributed from canonical are ""byte for byte the same,"" but you guys must excel at mental gymnastics. And don't give me some bullshit that ubuntu is just a userspace, not an operating system, because the title to ubuntu.com starts with ""the leading operating system,"" wikipedia categorizes it as an operating system, and even if it was just the userspace, _there are still userspace programs missing from WSL_ that come by default in ubuntu. The userspace programs that are included in WSL ubuntu are the same, great, but ubuntu in its entirety is not the same, in fact far from it, and many pieces are missing."
378,,1554913946.0,3.0,Disingenuous expected answer. You seem to be a Microsoft apologist.
379,CapableCounteroffer,1554946913.0,1.0,"Big i3 guy, been meaning to checkout sway - do you find it tends to work out of the box with your i3 config?"
380,,1555007088.0,1.0,"Adding exceptions to defender are tricky, and easy to get wrong. It also depends on the location you are compiling. 

Other than that, the results are what they are."
381,,1554941077.0,0.0,"> No where does it say that ubuntu in it's entirety is the same, in fact it explicitly says ""there's no linux kernel booting,"" 

This concept of a user space seems beyond you. Have a good one"
382,LuckyHedgehog,1554923005.0,-1.0,"What exactly is disingenuous? So far you have completely ignored all of my arguments, and dismiss me as a microsoft apologist. Don't strain yourself with the effort now, wouldn't want to seem like you have, like, educated opinions and stuff"
383,,1554949861.0,1.0,Your config will work. Sway is just i3 ported to Wayland.
384,Astrognome,1555028247.0,1.0,"Interesting. You should try to run a compile inside a linux VM on the same machine and see what results you get, I'd be curious to find out."
385,,1554926535.0,4.0,"Coming back with iOS, Chromebooks, and no OS self-installs as equivalencies of being able to walk into a store and buy a Linux desktop is either disingenuous or stupid. You choose which appellation you like better.

Same goes for saying hardware vendor support isn't based on market share."
386,LuckyHedgehog,1554929038.0,0.0,"You were saying Microsoft was manipulating the market with illegal practices by making all computers in stores run on Windows, which is factually wrong. 

And what difference does a desktop vs laptop make? They are both computers, and Chromebook running Linux is a big deal. If you really want to say those don't count then you are sticking your head in the sand by being pedantic about desktop vs laptop.

I get it, you hate all other companies and Linux is god. But learn to be coherent when you argue for Linux. There is a reason Linux users are viewed at elitist pricks and it is because of people like you. Leave your ""witty"" retort and we'll leave it at that, because you'll just spin around in more circles without having a reasonable response"
